send_date,Audit Date,spbu_no,region,year,address,city_name,tipe_spbu,rayon,audit_level,audit_next,good_status,excellent_status,Total Score,SSS,EQnQ,RFS,VFC,EPO,kelas_spbu,penalty_good_alerts,penalty_excellent_alerts
2025-05-10,2025-05-10,34-45103,III,2025,JL. Raya Cirebon - Lohsari Km 16 Desa Bendungan,Kab Cirebon,DODO,SBM Cirebon I Fuel,TAGE3,Re-CAE1,NOT CERTIFIED,NOT CERTIFIED,84.73,96.67,83.66,81.65,94.00,49.01,Basic,,"Jalur Fast Track, NFR, Produk JBU"
2025-05-10,2025-05-10,54-67113,V,2025,Jl. Raya Carat Gempol Pasuruan,Kab Pasuruan,DODO,SBM Malang I Fuel,TAG3,DAG1,CERTIFIED,NOT CERTIFIED,92.17,95.33,100.00,94.90,98.00,47.93,Pasti Pas Good,,"NFR, Jalur Fast Track, Produk JBU"
2025-05-10,2025-05-10,44-53136,IV,2025,Jln Dusun lll Kalibagor RT 01 /04 Banyumas . Purwokerto ,Kab Banyumas,DODO,SBM Tegal III Fuel,TAG1,TAG2,CERTIFIED,NOT CERTIFIED,95.5,100.00,100.00,91.20,98.00,74.58,Pasti Pas Good,,Jalur Fast Track
2025-05-10,2025-05-10,24-36552,II,2025,Desa Serdang Kecamatan Betara Kabupaten Tanjung Jabung Barat,Kab Tanjung Jab Bar,DODO,SBM Jambi I Fuel,DAGE,DAGE,CERTIFIED,NOT CERTIFIED,92.63,98.67,92.72,97.80,96.00,60.56,Pasti Pas Good,,"Produk JBU, NFR, Jalur Fast Track"
2025-05-10,2025-05-10,34-12502,III,2025,Jl. Lingkar selatan Ps. Minggu (TB. Simatupang),Kota Jakarta Selatan,,SBM Jabode III Fuel,TAGE2,TAGE3,CERTIFIED,NOT CERTIFIED,92.85,98.33,100.00,94.90,97.50,46.24,Pasti Pas Good,,"Rompi Khusus, NFR, Produk JBU"
2025-05-10,2025-05-10,54-63420,V,2025,Jl. Desa Bangun Rejo Kec. Sukorejo,Kab Ponorogo,DODO,SBM Kediri III Fuel,DAGE,DAGE,CERTIFIED,NOT CERTIFIED,91.39,93.33,100.00,92.20,96.00,53.45,Pasti Pas Good,,"Jalur Fast Track, NFR, Produk JBU"
2025-05-10,2025-05-10,54-83509,V,2025,jl. Raya Mantang-Kopang Peresak Lombok Tengah,Kab Lombok Tengah,DODO,SBM NTB I Fuel,TAGE2,TAGE3,CERTIFIED,NOT CERTIFIED,94.52,96.67,100.00,96.35,98.00,64.45,Pasti Pas Good,,"NFR, Produk JBU, Jalur Fast Track"
2025-05-10,2025-05-10,54-80117,V,2025,Jl. ByPass Ngurah Rai No.786,Kota Denpasar,DODO,SBM Bali I Fuel,TAGE3,DAGE,CERTIFIED,NOT CERTIFIED,92.65,96.67,100.00,93.34,96.00,53.73,Pasti Pas Good,,"Jalur Fast Track, Produk JBU, NFR"
2025-05-10,2025-05-10,44-50708,IV,2025,"Jl, Tengaran Sugihan, Tengaran Salatiga",Kab Semarang,DODO,SBM Semarang I Fuel,DAGE,DAGE,CERTIFIED,NOT CERTIFIED,91.21,100.00,94.25,96.70,98.00,37.96,Pasti Pas Good,,"Produk JBU, Jalur Fast Track, NFR"
2025-05-10,2025-05-10,54-601126,V,2025,JL. RAYA KENDUNG NO. 64 KEL. SEMEMI KEC. BENOWO,Kota Surabaya,DODO,SBM Surabaya I Fuel,DAGE,DAGE,CERTIFIED,NOT CERTIFIED,92.96,96.67,100.00,91.94,98.00,57.56,Pasti Pas Good,,"NFR, Jalur Fast Track, Produk JBU"
2025-06-17,2025-05-10,44-55605,IV,2025,"Jl. Jatingarang, Jatisuono, Nanggulan",Kab Kulon Progo,DODO,SBM Yogyakarta I Fuel,DAGE,DAGE,CERTIFIED,NOT CERTIFIED,90.34,94.33,100.00,89.10,91.00,51.21,Pasti Pas Good,,"Jalur Fast Track, NFR"
2025-05-10,2025-05-10,44-55529,IV,2025,JL. RAYA GITO GATI DS. DONOHARJO KE,Kab Sleman,DODO,SBM Yogyakarta I Fuel,DAGE,DAGE,CERTIFIED,NOT CERTIFIED,91.23,97.67,92.33,91.50,99.00,60.31,Pasti Pas Good,,"Produk JBU, NFR"
2025-05-10,2025-05-10,14-244489,I,2025,jln.banda aceh-medan desa bayeun aceh timur,Kab Aceh Timur,DODO,SBM Aceh II Fuel,TAGE1,TAGE2,CERTIFIED,NOT CERTIFIED,91.6,90.67,100.00,94.15,98.00,57.71,Pasti Pas Good,,"Produk JBU, NFR"
2025-05-10,2025-05-10,14-244429,I,2025,Desa Blang Bitra Kab.A.Timur  Kec.Peureulak,Kab Aceh Timur,DODO,SBM Aceh II Fuel,DAGE,DAGE,CERTIFIED,NOT CERTIFIED,89.92,86.67,96.17,99.80,96.00,55.06,Pasti Pas Good,,"NFR, Jalur Fast Track, Produk JBU"
2025-05-10,2025-05-10,44-55103,IV,2025,"Jl. Raya Bantul Km. 8, Sewon",Kab Bantul,DODO,SBM Yogyakarta I Fuel,DAGE,TAGE1,NOT CERTIFIED,NOT CERTIFIED,85.89,99.33,85.43,78.15,89.00,59.28,Pasti Pas Good,APAB,"NFR, APAB, Produk JBU, Jalur Fast Track"
2025-05-10,2025-05-10,51-61221,V,2025,JL. BY PASS KM.04 KRIAN,Kab Sidoarjo,,SBM Surabaya II Fuel,DAGE,DAGE,CERTIFIED,NOT CERTIFIED,95.09,96.67,100.00,96.99,100.00,66.86,Pasti Pas Good,,"Produk JBU, NFR"
2025-05-10,2025-05-10,44-55711,IV,2025,Jl. Raya Bantul Km. 7,Kab Bantul,DODO,SBM Yogyakarta I Fuel,TAGE1,TAGE2,CERTIFIED,NOT CERTIFIED,93.08,99.33,100.00,90.30,81.50,70.70,Pasti Pas Good,,Rompi Khusus
2025-05-10,2025-05-10,44-55502,IV,2025,"Jl. Magelang Km. 11, Dk. Tridadi, Sleman,  DI Yogyakarta",Kab Sleman,DODO,SBM Yogyakarta I Fuel,DAGE,DAGE,CERTIFIED,NOT CERTIFIED,86.25,85.00,87.95,91.80,98.00,62.16,Pasti Pas Good,,"Jalur Fast Track, NFR"
2025-06-16,2025-05-09,84-99105,VIII,2025,"Jl. Raya Sentani KM 18, Waena",Kota Jayapura,DODO,SBM Papua I,DAGE,DAGE,CERTIFIED,NOT CERTIFIED,91.26,94.00,100.00,93.40,90.50,53.40,Pasti Pas Good,,"NFR, Rompi Khusus"
2025-05-09,2025-05-09,54-60184,V,2025,Jl. Kusuma Bangsa No.33,Kota Surabaya,DODO,SBM Surabaya I Fuel,TAGE1,TAGE2,CERTIFIED,NOT CERTIFIED,93.49,96.67,100.00,92.45,95.00,64.80,Pasti Pas Good,,"Produk JBU, Jalur Fast Track, NFR"
2025-05-09,2025-05-09,54-60196,V,2025,Jl. Raya Arjuna No.80,Kota Surabaya,DODO,SBM Surabaya I Fuel,DAGE,DAGE,CERTIFIED,NOT CERTIFIED,93.91,96.67,100.00,92.40,96.00,68.30,Pasti Pas Good,,"Produk JBU, Jalur Fast Track, NFR"
2025-05-27,2025-05-09,34-42121,III,2025,Jl. Raya Serang Pakupatan,Kota Serang,DODO,SBM Banten II Fuel,DAGE,DAGE,CERTIFIED,NOT CERTIFIED,91.63,95.33,100.00,91.32,95.00,52.70,Pasti Pas Good,,"Jalur Fast Track, NFR"
2025-05-09,2025-05-09,34-16416,III,2025,Jl. Tole Iskandar Tirtajaya Depok,Kota Depok,DODO,SBM Jabode III Fuel,DAGE,DAGE,CERTIFIED,NOT CERTIFIED,92.45,94.00,98.47,94.65,97.50,60.31,Pasti Pas Good,,"NFR, Rompi Khusus, Produk JBU"
2025-06-16,2025-05-09,34-40313,III,2025,Jl. Raya Bojongsoang No. 42 Baleendah,Kab Bandung,DODO,SBM Bandung II Fuel,DAGE,DAGE,CERTIFIED,NOT CERTIFIED,85.98,81.67,100.00,92.70,90.00,39.36,Pasti Pas Good,,"NFR, Jalur Fast Track"
2025-05-09,2025-05-09,44-55607,IV,2025,"Jl. Wates Sentolo,Sukoreno",Kab Kulon Progo,DODO,SBM Yogyakarta I Fuel,DAGE,DAGE,CERTIFIED,NOT CERTIFIED,95.03,99.00,100.00,95.03,98.00,65.24,Pasti Pas Good,,"Produk JBU, NFR"
2025-05-09,2025-05-09,34-15140,III,2025,"Jl. Maulana Hasanuddin, Batu Ceper",Kota Tangerang,DODO,SBM Banten I Fuel,TAGE1,TAGE2,CERTIFIED,NOT CERTIFIED,85.07,81.67,90.80,87.00,99.00,60.31,Pasti Pas Good,,"NFR, Produk JBU"
2025-05-09,2025-05-09,54-68115,V,2025,Jl. Raya Ds. Jambe Arum Kec. Puger Jember.,Kab Jember,DODO,SBM Malang II Fuel,DAGE,DAGE,CERTIFIED,NOT CERTIFIED,91.62,96.67,100.00,94.70,93.00,43.76,Pasti Pas Good,,"NFR, Jalur Fast Track, Produk JBU"
2025-05-09,2025-05-09,64-707009,VI,2025,"JL. PONDOK EMPAT, KEL. LOKTABAT UTARA, KEC. BANJARBARU UTARA, KOTA BANJARBARU - KALSEL",Kota Banjarbaru,DODO,SBM Kalsel I Fuel,DAGE,DAGE,CERTIFIED,NOT CERTIFIED,91.78,96.67,100.00,92.78,90.00,52.16,Pasti Pas Good,,"Produk JBU, Jalur Fast Track, NFR"
2025-06-16,2025-05-09,44-50202,IV,2025,Jl. Perintis Kemerdekaan,Kota Semarang,DODO,SBM Semarang I Fuel,DAGE,TAGE1,NOT CERTIFIED,NOT CERTIFIED,88.59,97.00,81.60,94.75,100.00,60.60,Pasti Pas Good,,NFR
2025-05-09,2025-05-09,54-68312,V,2025,Jl. Basuki Rahmat No. 216,Kab Situbondo,,SBM Malang III Fuel,DAGE,DAGE,CERTIFIED,NOT CERTIFIED,91.39,93.33,100.00,95.55,96.00,46.77,Pasti Pas Good,,"Produk JBU, NFR, Jalur Fast Track"
2025-07-02,2025-05-09,34-17516,III,2025,Jl. Inspeksi kalimalang jembatan 2 ,Kab Bekasi,DODO,SBM Karawang I Fuel,DAGE,DAGE,CERTIFIED,NOT CERTIFIED,87.09,81.00,100.00,88.00,100.00,53.00,Pasti Pas Good,,NFR
2025-05-09,2025-05-09,54-60193,V,2025,Jl. Ngagel Jaya Utara No.91,Kota Surabaya,DODO,SBM Surabaya I Fuel,DAE,DAGE,CERTIFIED,NOT CERTIFIED,95.48,96.67,100.00,92.99,98.00,80.70,Pasti Pas Good,,NFR
2025-05-09,2025-05-09,74-90238,VII,2025,Jl. Perintis Kemerdekaan,Kota Makassar,DODO,SBM Sulselbar I Fuel,DAGE,DAGE,CERTIFIED,NOT CERTIFIED,88.92,96.67,86.97,92.15,95.50,58.54,Pasti Pas Good,,"Jalur Fast Track, Rompi Khusus, NFR, Produk JBU"
2025-05-09,2025-05-09,54-83510,V,2025,Jl. Bypass Bandara International Lombok,Kab Lombok Tengah,DODO,SBM NTB I Fuel,DAGE,DAGE,CERTIFIED,NOT CERTIFIED,92.83,96.67,100.00,92.89,98.00,54.50,Pasti Pas Good,,"Jalur Fast Track, NFR, Produk JBU"
2025-05-09,2025-05-09,34-15207,III,2025,Jl. Pondok Kacang Raya Pondok Aren,Kota Tangerang Sel.,DODO,SBM Banten I Fuel,TAGE1,TAGE2,CERTIFIED,NOT CERTIFIED,90.55,95.67,95.96,89.00,98.00,54.64,Pasti Pas Good,,Produk JBU
2025-05-09,2025-05-09,54-67133,V,2025,JL. RAYA PURWOSARI DS. KEMBANG,Kab Pasuruan,DODO,SBM Malang I Fuel,DAGE,DAGE,CERTIFIED,NOT CERTIFIED,90.8,93.33,98.26,93.20,96.00,50.37,Pasti Pas Good,,"NFR, Produk JBU, Jalur Fast Track"
2025-08-07,2025-05-09,34-46124,III,2025,jl Perintis kemerdekaan. Kec. Kawalu Kota Tasikmalaya,Kota Tasikmalaya,DODO,SBM Bandung IV Fuel,TAGE2,TAGE3,CERTIFIED,NOT CERTIFIED,87.15,97.33,92.70,85.25,79.00,51.88,Pasti Pas Good,,"Jalur Fast Track, Produk JBU, NFR"
2025-05-09,2025-05-09,34-12508,III,2025,Jl. Jagakarsa  No.4 Pasar Minggu,Kota Jakarta Selatan,DODO,SBM Jabode III Fuel,TAGE2,TAGE3,CERTIFIED,NOT CERTIFIED,93.63,91.67,100.00,99.50,98.00,64.31,Pasti Pas Good,,"Jalur Fast Track, NFR"
2025-05-09,2025-05-09,14-2011125,I,2025,Jl. Cemara,Kota Medan,DODO,SBM Medan I Fuel,DAGE,DAGE,CERTIFIED,NOT CERTIFIED,94.16,99.33,100.00,97.80,100.00,48.04,Pasti Pas Good,,"Produk JBU, NFR"
2025-05-09,2025-05-09,44-55528,IV,2025,JL. KEBON AGUNG DSN. GETAS KEL. TLO,Kab Sleman,DODO,SBM Yogyakarta I Fuel,DAGE,DAGE,CERTIFIED,NOT CERTIFIED,90.58,99.33,92.33,85.80,98.00,61.23,Pasti Pas Good,,NFR
2025-05-09,2025-05-09,34-11611,III,2025,Jl. Kembangan Raya Selatan No. 88,Kota Jakarta Barat,DODO,SBM Jabode II Fuel,DAGE,DAGE,CERTIFIED,NOT CERTIFIED,95.28,100.00,100.00,100.00,100.00,52.81,Pasti Pas Good,,NFR
2025-05-09,2025-05-09,24-36587,II,2025,Jl. Lintas Timur Km 174 Kec. Batang Asam. Kab. Tanjung Jabung Barat,Kab Tanjung Jab Bar,DODO,SBM Jambi I Fuel,DAG3,DAGE,CERTIFIED,NOT CERTIFIED,92.4,96.67,96.17,96.60,96.00,56.26,Pasti Pas Good,,"Jalur Fast Track, Produk JBU, NFR"
2025-07-02,2025-05-09,34-40240,III,2025,Jl. Raya Dayeuh Kolot No. 18-20,Kab Bandung,DODO,SBM Bandung II Fuel,DAGE,DAGE,CERTIFIED,NOT CERTIFIED,83.9,86.00,95.21,85.80,83.50,40.26,Pasti Pas Good,,"Rompi Khusus, Produk JBU, NFR, Jalur Fast Track"
2025-05-09,2025-05-09,24-301163,II,2025,Jl. MP Mangkunegara No.1 Kel. Bukit Sangkal Kec. Kalidoni,Kota Palembang,DODO,SBM Sumsel I Fuel,TAGE1,TAGE2,CERTIFIED,NOT CERTIFIED,93.81,96.33,100.00,93.66,97.00,64.66,Pasti Pas Good,,"NFR, Produk JBU"
2025-05-09,2025-05-09,54-63409,V,2025,Jl. Desa Babadan Kec. Babadan Ponorogo,Kab Ponorogo,DODO,SBM Kediri III Fuel,DAGE,DAGE,CERTIFIED,NOT CERTIFIED,93.34,96.67,100.00,92.90,96.00,61.56,Pasti Pas Good,,"NFR, Jalur Fast Track, Produk JBU"
2025-06-17,2025-05-09,34-10401,III,2025,Jl. Kramat Raya No. 116,Kota Jakarta Pusat,DODO,SBM Jabode I Fuel,DAGE,DAE,CERTIFIED,CERTIFIED,96.18,100.00,100.00,97.10,100.00,67.62,Pasti Pas Excellent,,
2025-07-02,2025-05-09,34-40209,III,2025,Jl. Soekarno Hatta No.801,Kota Bandung,DODO,SBM Bandung I Fuel,TAGE1,TAGE2,CERTIFIED,NOT CERTIFIED,89.85,90.33,100.00,86.25,95.50,59.54,Pasti Pas Good,,"NFR, Rompi Khusus, Jalur Fast Track, Produk JBU"
2025-05-09,2025-05-09,54-63116,V,2025,Jl. Sarimulyo Kel. Rejomulyo Kec. Kartoharjo,Kota Madiun,DODO,SBM Kediri III Fuel,DAGE,DAGE,CERTIFIED,NOT CERTIFIED,92.16,96.67,100.00,94.00,98.00,45.56,Pasti Pas Good,,"NFR, Produk JBU, Jalur Fast Track"
2025-06-23,2025-05-09,54-65157,V,2025,"Jl raya sumber pasir no 57 pakis, kab malang",Kab Malang,DODO,SBM Malang I Fuel,DAE,DAE,CERTIFIED,CERTIFIED,94.05,96.67,93.06,93.80,100.00,83.78,Pasti Pas Excellent,,
2025-05-09,2025-05-09,54-80124,V,2025,Jl. By Pass Ngurah Rai No. 88 A. Pemogan,Kota Denpasar,DODO,SBM Bali I Fuel,DAGE,DAGE,CERTIFIED,NOT CERTIFIED,91.59,96.67,100.00,92.95,96.00,43.76,Pasti Pas Good,,"Produk JBU, Jalur Fast Track, NFR"
2025-05-18,2025-05-09,64-75122,VI,2025,Jl. A Wahab Syahrani Sempaja,Kota Samarinda,DODO,SBM Kaltimut II Fuel,DAE,DAGE,CERTIFIED,NOT CERTIFIED,95.64,96.67,100.00,96.73,100.00,73.00,Pasti Pas Good,,NFR
2025-07-01,2025-05-09,34-42131,III,2025,"Jl. Kiajurum, cipocok jaya, kota serang",Kota Serang,DODO,SBM Banten II Fuel,DAGE,DAGE,CERTIFIED,NOT CERTIFIED,91.49,96.00,100.00,88.37,97.00,53.18,Pasti Pas Good,,NFR
2025-05-09,2025-05-09,34-13205,III,2025,Jl. Perintis Kemerdekaan Pulo Nangka,Kota Jakarta Timur,DODO,SBM Jabode I Fuel,TAGE2,TAGE3,CERTIFIED,CERTIFIED,95.89,100.00,100.00,100.00,100.00,58.90,Pasti Pas Good,,
2025-05-09,2025-05-09,44-55604,IV,2025,"Jl. Ngramang Kedungsari, Pengasih",Kab Kulon Progo,DODO,SBM Yogyakarta I Fuel,TAGE1,TAGE2,CERTIFIED,NOT CERTIFIED,96.17,100.00,100.00,100.00,100.00,61.68,Pasti Pas Good,,NFR
2025-05-09,2025-05-09,34-15113,III,2025,Jl. Jend. Sudirman No. 52,Kota Tangerang,DODO,SBM Banten I Fuel,TAGE3,Re-CAE1,NOT CERTIFIED,NOT CERTIFIED,86,91.00,84.73,84.45,96.50,67.45,Basic,Grounding,"Grounding, NFR, Rompi Khusus, Produk JBU"
2025-06-17,2025-05-09,74-90288,VII,2025,Jl. Perintis Kemerdekaan KM. 12,Kota Makassar,DODO,SBM Sulselbar I Fuel,DAE,DAE,CERTIFIED,CERTIFIED,88.28,88.33,89.46,85.33,97.00,81.56,Pasti Pas Excellent,,
2025-05-09,2025-05-09,54-601105,V,2025,Jl. Lidah Wetan No.139,Kota Surabaya,DODO,SBM Surabaya I Fuel,DAGE,DAGE,CERTIFIED,NOT CERTIFIED,89.37,92.67,96.17,91.74,96.00,47.60,Pasti Pas Good,,"NFR, Jalur Fast Track, Produk JBU"
2025-05-09,2025-05-09,74-90508,VII,2025,"Jl. Poros Kariango, Kec. Tanralili, Kab. Maros",Kab Maros,DODO,SBM Sulselbar I Fuel,DAE,TAGE1,NOT CERTIFIED,NOT CERTIFIED,75.22,87.67,71.73,56.11,95.00,67.13,Pasti Pas Good,DU Dispenser,"Jalur Fast Track, Produk JBU, DU Dispenser"
2025-05-09,2025-05-09,44-50203,IV,2025,"Jl. Perintis Kemerdekaan, Pudak Payung",Kota Semarang,DODO,SBM Semarang I Fuel,DAGE,DAGE,CERTIFIED,NOT CERTIFIED,94.64,100.00,100.00,96.80,85.00,67.76,Pasti Pas Good,,"NFR, Produk JBU"
2025-05-09,2025-05-09,34-40328,III,2025,"Jl. Raya Ciparay - Lembur Awi, Cikoneng",Kab Bandung,DODO,SBM Bandung II Fuel,DAGE,DAGE,CERTIFIED,NOT CERTIFIED,89.93,94.00,93.38,93.10,95.00,56.00,Pasti Pas Good,,"NFR, Jalur Fast Track"
2025-05-09,2025-05-09,44-53132,IV,2025,DS. KARANGGAYAM KEC. LUMBIR,Kab Banyumas,DODO,SBM Tegal III Fuel,DAG1,DAG2,CERTIFIED,NOT CERTIFIED,95.07,97.33,100.00,93.47,98.00,73.80,Pasti Pas Good,,"Produk JBU, Jalur Fast Track, NFR"
2025-05-09,2025-05-09,34-45120,III,2025,Jl. Kalijaga No. 51,Kota Cirebon,DODO,SBM Cirebon I Fuel,DAGE,DAGE,CERTIFIED,NOT CERTIFIED,85.08,95.33,90.32,85.40,89.50,33.56,Pasti Pas Good,,"Jalur Fast Track, Produk JBU, NFR, Rompi Khusus"
2025-05-09,2025-05-09,34-45142,III,2025,Jl. KH. Wahid Hasyim Cipeujeh,Kab Cirebon,DODO,SBM Cirebon I Fuel,DAGE,TAGE1,NOT CERTIFIED,NOT CERTIFIED,86.21,91.67,89.96,83.90,97.00,52.46,Pasti Pas Good,,NFR
2025-05-09,2025-05-09,54-67114,V,2025,Ds. Wonosari Pasuruan,Kab Pasuruan,DODO,SBM Malang I Fuel,DAGE,DAGE,CERTIFIED,NOT CERTIFIED,90.4,88.33,100.00,93.10,98.00,54.76,Pasti Pas Good,,"NFR, Jalur Fast Track, Produk JBU"
2025-05-09,2025-05-09,14-202132,I,2025,Jl. Gunung Krakatau Simp Cemara No. 235,Kota Medan,DODO,SBM Medan I Fuel,DAGE,DAGE,CERTIFIED,NOT CERTIFIED,93.92,97.67,100.00,99.60,98.00,48.96,Pasti Pas Good,,NFR
2025-05-09,2025-05-09,64-78116,VI,2025,Jl Sungai Raya Dalam,Kota Pontianak,DODO,SBM Kalbar I Fuel,DAGE,DAGE,CERTIFIED,NOT CERTIFIED,90.77,96.67,100.00,92.57,100.00,32.43,Pasti Pas Good,,"Produk JBU, NFR"
2025-05-09,2025-05-09,34-17517,III,2025,Jl. Raya Setu Cibitung Bekasi,Kab Bekasi,DODO,SBM Karawang I Fuel,DAGE,DAGE,CERTIFIED,NOT CERTIFIED,86.47,89.33,100.00,86.85,83.00,40.01,Pasti Pas Good,,"Produk JBU, NFR, Jalur Fast Track"
2025-06-16,2025-05-09,44-55106,IV,2025,"Jl. Wates Km. 2, Kadipiro",Kab Bantul,DODO,SBM Yogyakarta I Fuel,DAE,DAE,CERTIFIED,CERTIFIED,90.66,100.00,85.43,90.40,100.00,69.53,Pasti Pas Excellent,,
2025-05-09,2025-05-09,34-15153,III,2025,"Jl. KH. Ahmad Dahlan, Petir, Kec. Cipondoh, Kota Tangerang, Banten 15147",Kota Tangerang,DODO,SBM Banten I Fuel,TAG1,TAG2,CERTIFIED,CERTIFIED,93.7,94.00,100.00,93.60,98.00,69.82,Pasti Pas Good,,
2025-05-09,2025-05-09,44-53307,IV,2025,"Jalan raya letnan yusuf, babakan, Purbalingga",Kab Purbalingga,DODO,SBM Tegal III Fuel,DAGE,DAE,CERTIFIED,CERTIFIED,96.39,99.33,100.00,99.10,100.00,67.70,Pasti Pas Excellent,,
2025-05-09,2025-05-09,44-55513,IV,2025,"Jl. Godean Km.4,5 Gamping",Kab Sleman,DODO,SBM Yogyakarta I Fuel,DAGE,DAGE,CERTIFIED,NOT CERTIFIED,92.75,99.33,100.00,85.00,100.00,59.54,Pasti Pas Good,,"Produk JBU, NFR"
2025-05-09,2025-05-09,54-68116,V,2025,Jl. A Yani No. 13A Puger,Kab Jember,DODO,SBM Malang II Fuel,TAGE1,TAGE2,CERTIFIED,NOT CERTIFIED,92.24,97.33,100.00,93.30,96.00,48.36,Pasti Pas Good,,"Jalur Fast Track, Produk JBU, NFR"
2025-07-02,2025-05-09,34-40239,III,2025,Jl.M.Toha No.557,Kota Bandung,DODO,SBM Bandung I Fuel,TAGE1,TAGE2,CERTIFIED,NOT CERTIFIED,91.8,97.22,100.00,85.70,93.50,60.56,Pasti Pas Good,,"Produk JBU, Rompi Khusus"
2025-05-09,2025-05-09,34-12507,III,2025,Jl. Raya Cilandak KKO,Kota Jakarta Selatan,DODO,SBM Jabode III Fuel,DAGE,DAGE,CERTIFIED,NOT CERTIFIED,95.42,100.00,100.00,97.15,93.00,66.86,Pasti Pas Good,,NFR
2025-05-09,2025-05-09,44-50607,IV,2025,"Jl. Ambarawa Muncul, Banyu Biru",Kab Semarang,DODO,SBM Semarang I Fuel,TAGE1,TAGE2,CERTIFIED,NOT CERTIFIED,92.47,91.00,100.00,94.00,100.00,63.66,Pasti Pas Good,,Produk JBU
2025-05-09,2025-05-09,54-63114,V,2025,Jl. Raya Dungus Ds. Mojopurno Kec. Wungu,Kab Madiun,DODO,SBM Kediri III Fuel,DAGE,DAGE,CERTIFIED,NOT CERTIFIED,92.35,93.33,100.00,93.40,98.00,58.66,Pasti Pas Good,,"Jalur Fast Track, Produk JBU, NFR"
2025-05-09,2025-05-09,54-65127,V,2025,Jl. Raya Perusahaan No.33 Tunjung Tirto,Kab Malang,DODO,SBM Malang I Fuel,TAGE1,TAGE2,CERTIFIED,NOT CERTIFIED,92.07,96.22,99.04,93.40,98.00,49.46,Pasti Pas Good,,"Jalur Fast Track, Produk JBU, NFR"
2025-05-09,2025-05-09,54-60192,V,2025,Jl. Tegalsari No.43-45,Kota Surabaya,,SBM Surabaya I Fuel,DAE,DAE,CERTIFIED,CERTIFIED,97.25,96.67,100.00,95.23,100.00,92.00,Pasti Pas Excellent,,
2025-05-29,2025-05-09,44-57703,IV,2025,"Jl. Raya Solo Sragen Km. 14, Waru Kebakkramat",Kab Karanganyar,DODO,SBM Yogyakarta IV Fuel,DAGE,DAGE,CERTIFIED,NOT CERTIFIED,91.03,94.67,92.33,95.35,98.00,60.60,Pasti Pas Good,,NFR
2025-05-10,2025-05-09,34-16913,III,2025,Jl. Gunung Putri No.382,Kab Bogor,DODO,SBM Jabode V Fuel,TAGE3,Re-CAE1,NOT CERTIFIED,NOT CERTIFIED,85.67,92.67,92.33,86.68,94.50,33.90,Basic,Produk JBU,"Produk JBU, Jalur Fast Track, Rompi Khusus, NFR"
2025-06-16,2025-05-08,84-99302,VIII,2025,Jl. Raya Hawaii Sentani Jayapura,Kab Jayapura,DODO,SBM Papua I,TAGE1,TAGE2,CERTIFIED,NOT CERTIFIED,85.08,83.00,92.72,87.50,90.00,58.66,Pasti Pas Good,,NFR
2025-05-08,2025-05-08,14-251519,I,2025,Jl. Sawahan No.68,Kota Padang,DODO,SBM Sumatera Barat I Fuel,DAGE,DAGE,CERTIFIED,NOT CERTIFIED,88.97,82.67,100.00,93.80,98.00,56.08,Pasti Pas Good,,NFR
2025-05-08,2025-05-08,23-36612,II,2025,Jl. Jambi - Muaro Bulian Kel. Bajubang Kec. Batanghari Kab. Batanghari,Kab Batanghari,CODO I,SBM Jambi I Fuel,DAGE,DAGE,CERTIFIED,NOT CERTIFIED,93.93,95.33,96.17,97.10,96.00,74.56,Pasti Pas Good,,"Jalur Fast Track, Produk JBU, NFR"
2025-06-16,2025-05-08,34-40201,III,2025,Jl. Soekarno Hatta No.55,Kota Bandung,DODO,SBM Bandung I Fuel,DAE,DAGE,CERTIFIED,NOT CERTIFIED,88.04,87.00,92.33,89.90,92.50,70.06,Pasti Pas Good,,"Rompi Khusus, Jalur Fast Track"
2025-05-08,2025-05-08,34-40243,III,2025,Jl. Terusan Cibaduyut Raya,Kab Bandung,DODO,SBM Bandung II Fuel,DAGE,DAGE,CERTIFIED,NOT CERTIFIED,91.21,89.33,100.00,92.75,95.00,63.56,Pasti Pas Good,,"Produk JBU, NFR"
2025-06-16,2025-05-08,34-46128,III,2025,jl Ez Mutaqin. Cikurubuk Tasikmalaya,Kota Tasikmalaya,DODO,SBM Bandung IV Fuel,TAGE3,Re-CAE1,NOT CERTIFIED,NOT CERTIFIED,76.06,81.00,78.34,74.00,93.50,41.20,Basic,,"NFR, Rompi Khusus, Produk JBU"
2025-05-27,2025-05-08,34-42108,III,2025,Jl. Raya Serang-Jakarta KM 4.5,Kota Serang,DODO,SBM Banten II Fuel,TAGE1,TAGE2,CERTIFIED,NOT CERTIFIED,91.99,95.33,100.00,93.59,95.00,51.77,Pasti Pas Good,,"Jalur Fast Track, NFR, Produk JBU"
2025-05-08,2025-05-08,64-75128,VI,2025,"Jl. Ir. H Juanda, Kec. Samarinda Ulu, Kel. Air Hitam",Kota Samarinda,DODO,SBM Kaltimut II Fuel,TAGE2,TAGE3,CERTIFIED,NOT CERTIFIED,95.2,96.67,100.00,96.55,100.00,68.90,Pasti Pas Good,,"Produk JBU, NFR"
2025-05-08,2025-05-08,54-68106,V,2025,Jl. Desa Baratan Kec. Arjasa,Kab Jember,DODO,SBM Malang II Fuel,TAGE2,TAGE3,CERTIFIED,NOT CERTIFIED,93.35,96.67,100.00,95.10,98.00,55.33,Pasti Pas Good,,"NFR, Jalur Fast Track, Produk JBU"
2025-05-08,2025-05-08,34-45105,III,2025,Jl. Raya Cirebon-Bandung Km.11 Kec. plumbon,Kab Cirebon,DODO,SBM Cirebon I Fuel,TAGE1,Re-CAE1,NOT CERTIFIED,NOT CERTIFIED,82.93,93.33,83.17,79.10,82.00,59.60,Basic,,NFR
2025-05-18,2025-05-08,54-80132,V,2025,Jl. Gunung Soputan Kec. Denpasar Barat,Kota Denpasar,,SBM Bali I Fuel,TAGE1,Re-CAE1,NOT CERTIFIED,NOT CERTIFIED,3.53,0.00,0.00,4.80,10.00,15.50,Basic,"HP, Nol, Jalur Fast Track, APAB, Produk JBU, DU Dispenser, PELUMAS, Trims, Izin Prinsip, Masa Berlaku APAR, Grounding, Salam","HP, Nol, Jalur Fast Track, APAB, Produk JBU, DU Dispenser, Rompi Khusus, PELUMAS, NFR, Trims, Izin Prinsip, Masa Berlaku APAR, Grounding, Salam"
2025-05-08,2025-05-08,34-12105,III,2025,"Jl. Kemang Raya, Kemang",Kota Jakarta Selatan,DODO,SBM Jabode III Fuel,TAGE1,TAGE2,CERTIFIED,NOT CERTIFIED,91.29,97.33,96.35,90.91,85.50,65.08,Pasti Pas Good,,"Jalur Fast Track, Rompi Khusus, NFR, Produk JBU"
2025-05-08,2025-05-08,24-36645,II,2025,Jl.Jambi Muara Bulian sei Buluh,Kab Batanghari,DODO,SBM Jambi I Fuel,DAGE,DAGE,CERTIFIED,NOT CERTIFIED,94.12,98.67,100.00,93.84,98.00,59.54,Pasti Pas Good,,"Produk JBU, NFR"
2025-05-08,2025-05-08,14-244430,I,2025,"Jl. Medan-B. Aceh, Kebun Tengah",Kab Aceh Tamiang,DODO,SBM Aceh II Fuel,TAGE3,DAGE,CERTIFIED,NOT CERTIFIED,94.74,99.33,100.00,99.30,98.00,52.78,Pasti Pas Good,,"NFR, Produk JBU"
2025-05-08,2025-05-08,34-15504,III,2025,"Jl. Raya Pakuhaji, Ds. Situis",Kab Tangerang,DODO,SBM Banten I Fuel,TAG3,Re-CA1,NOT CERTIFIED,NOT CERTIFIED,79.52,78.33,77.61,86.82,99.00,54.64,Basic,DU Dispenser,"DU Dispenser, Produk JBU"
2025-05-08,2025-05-08,54-60132,V,2025,Jl. Semarang No.94,Kota Surabaya,DODO,SBM Surabaya I Fuel,DAGE,DAGE,CERTIFIED,NOT CERTIFIED,90.95,91.33,100.00,90.63,96.00,57.57,Pasti Pas Good,,"Jalur Fast Track, Produk JBU, NFR"
2025-05-08,2025-05-08,14-201114,I,2025,"Jl. SM. Raja Km. 9, Tj. Morawa",Kota Medan,DODO,SBM Medan I Fuel,TAGE1,TAGE2,CERTIFIED,NOT CERTIFIED,89.47,94.67,85.43,98.21,97.50,60.46,Pasti Pas Good,,"Rompi Khusus, NFR"
2025-05-08,2025-05-08,34-10205,III,2025,Jl. Cideng Timur Raya No. 50,Kota Jakarta Pusat,DODO,SBM Jabode I Fuel,DAE,DAE,CERTIFIED,CERTIFIED,96.4,100.00,100.00,98.50,75.00,92.00,Pasti Pas Excellent,,
2025-05-08,2025-05-08,14-281649,I,2025,"Suka Maju, Sail, Pekanbaru City, Riau 28127",Kota Pekanbaru,DODO,SBM Riau I Fuel,DAGE,DAGE,CERTIFIED,NOT CERTIFIED,93.12,99.00,96.17,95.85,93.00,61.00,Pasti Pas Good,,NFR
2025-05-08,2025-05-08,14-255590,I,2025,Jl. raya padang pariaman toboh olo kec. sintoga kab. padang pariaman,Kab Padang Pariaman,DODO,SBM Sumatera Barat I Fuel,TAGE2,TAGE3,CERTIFIED,NOT CERTIFIED,93.49,96.67,100.00,91.30,98.00,64.31,Pasti Pas Good,,NFR
2025-05-08,2025-05-08,54-68414,V,2025,Ds.Yosomulyo Gambiran,Kab Banyuwangi,DODO,SBM Malang III Fuel,DAGE,DAGE,CERTIFIED,NOT CERTIFIED,93.66,96.67,100.00,96.75,98.00,55.05,Pasti Pas Good,,"Produk JBU, NFR, Jalur Fast Track"
2025-05-08,2025-05-08,44-53412,IV,2025,"Jl. Raya Mandiraja  Banyumas, Kel. Kedawung, Kec. Susukan, Kab. Banajrnegara. 53475",Kab Banjarnegara,DODO,SBM Tegal IV Fuel,DAE,DAE,CERTIFIED,CERTIFIED,98.48,99.33,100.00,96.68,100.00,93.41,Pasti Pas Excellent,,
2025-05-08,2025-05-08,54-83501,V,2025,Jl. Gajah Mada Praya,Kab Lombok Tengah,DODO,SBM NTB I Fuel,TAGE1,TAGE2,CERTIFIED,NOT CERTIFIED,91.48,97.33,95.96,96.24,96.00,47.13,Pasti Pas Good,,"NFR, Jalur Fast Track, Produk JBU"
2025-06-16,2025-05-08,54-80129,V,2025,"Jl. Mahendradata, Denpasar",Kota Denpasar,DODO,SBM Bali I Fuel,DAE,DAE,CERTIFIED,CERTIFIED,95.14,96.67,100.00,93.52,98.00,76.25,Pasti Pas Excellent,,
2025-05-08,2025-05-08,44-50215,IV,2025,"Jl. Menoreh Raya, Kec. Gajah Mungkur",Kota Semarang,DODO,SBM Semarang I Fuel,DAGE,DAE,CERTIFIED,CERTIFIED,95.45,100.00,93.06,96.40,100.00,82.50,Pasti Pas Excellent,,
2025-05-08,2025-05-08,34-15204,III,2025,Jl. Raden Fatah Jombang Pondok Aren,Kota Tangerang Sel.,DODO,SBM Banten I Fuel,TAGE1,TAGE2,CERTIFIED,NOT CERTIFIED,89.88,95.33,92.33,92.10,97.00,54.56,Pasti Pas Good,,"Produk JBU, NFR"
2025-05-08,2025-05-08,34-13421,III,2025,Jl. Terusan I Gusti Ngurah Rai,Kota Jakarta Timur,DODO,SBM Jabode I Fuel,TAGE1,TAGE2,CERTIFIED,NOT CERTIFIED,96.23,100.00,100.00,100.00,98.00,64.33,Pasti Pas Good,,Jalur Fast Track
2025-05-08,2025-05-08,54-65145,V,2025,Jl. Trunojoyo Kec.Gondang Legi kulon,Kab Malang,DODO,SBM Malang I Fuel,DAGE,DAGE,CERTIFIED,NOT CERTIFIED,90.55,93.33,100.00,93.99,97.00,40.48,Pasti Pas Good,,"NFR, Jalur Fast Track, Produk JBU"
2025-05-08,2025-05-08,44-50224,IV,2025,Jl. Raya Gunung Pati - Boja,Kota Semarang,DODO,SBM Semarang I Fuel,DAGE,DAGE,CERTIFIED,NOT CERTIFIED,93.4,98.33,100.00,94.20,100.00,50.60,Pasti Pas Good,,NFR
2025-05-08,2025-05-08,54-67122,V,2025,Ds. Ngerong Kec.Gempol Pasuruan,Kab Pasuruan,DODO,SBM Malang I Fuel,DAGE,DAGE,CERTIFIED,NOT CERTIFIED,93.29,95.33,100.00,93.60,98.00,61.70,Pasti Pas Good,,"Jalur Fast Track, NFR, Produk JBU"
2025-05-08,2025-05-08,34-11506,III,2025,Jl. Kedoya raya,Kota Jakarta Barat,DODO,SBM Jabode II Fuel,TAGE3,DAGE,CERTIFIED,NOT CERTIFIED,94.8,98.67,100.00,97.65,95.50,61.23,Pasti Pas Good,,"Jalur Fast Track, NFR, Rompi Khusus"
2025-05-08,2025-05-08,24-33275,II,2025,"Jl. MS Rahman, Belinyu",Kab Bangka,DODO,SBM Babel I,TAGE2,TAGE3,CERTIFIED,NOT CERTIFIED,93.02,95.33,100.00,96.80,100.00,50.60,Pasti Pas Good,,NFR
2025-05-08,2025-05-08,54-601115,V,2025,Jl. Barata Jaya No.59,Kota Surabaya,DODO,SBM Surabaya I Fuel,DAGE,DAGE,CERTIFIED,NOT CERTIFIED,93.06,96.67,100.00,93.48,96.00,57.56,Pasti Pas Good,,"NFR, Jalur Fast Track, Produk JBU"
