send_date,Audit Date,spbu_no,region,year,address,city_name,tipe_spbu,rayon,audit_level,audit_next,good_status,excellent_status,Total Score,SSS,EQnQ,RFS,VFC,EPO,kelas_spbu,penalty_good_alerts,penalty_excellent_alerts
2025-06-20,2025-05-29,44-50139,IV,2025,Jl. Yos Sudarso No. 1,Kota Semarang,DODO,SBM Semarang I Fuel,DAE,DAE,CERTIFIED,CERTIFIED,93.06,96.67,100.00,89.09,97.00,65.20,Pasti Pas Excellent,,
2025-05-28,2025-05-28,74-96207,VII,2025,Mananggu Kabupaten Boalemo,Kab Boalemo,DODO,SBM Sulutgo III Fuel,DAGE,DAGE,CERTIFIED,NOT CERTIFIED,90.08,86.67,100.00,95.38,93.00,56.96,Pasti Pas Good,,NFR
2025-05-28,2025-05-28,44-53129,IV,2025,"Jl. KH. M. Bahrun, Kec. Rawalo",Kab Banyumas,DODO,SBM Tegal III Fuel,DAE,DAE,CERTIFIED,CERTIFIED,97.42,100.00,100.00,100.00,100.00,74.20,Pasti Pas Excellent,,
2025-05-28,2025-05-28,54-66302,V,2008,"Jl. Sukarno Hatta, Dobangsan, Ngantru, Kec. Trenggalek, Kab.Trenggalek",Kab.Trenggalek,DODO,SBM Kediri II Fuel,Re-CA1,Re-CA2,NOT CERTIFIED,NOT CERTIFIED,84.14,78.56,100.00,85.30,100.00,38.30,Basic,PELUMAS,"NFR, Produk JBU, PELUMAS"
2025-05-29,2025-05-28,14-214247,I,2025,"Jl. Lintas Sumatera, Pematang Seleng",Kab Labuhan Batu,DODO,SBM Sibolga III Fuel,DAG2,DAG3,CERTIFIED,NOT CERTIFIED,88.63,88.67,100.00,91.50,85.50,51.76,Pasti Pas Good,,"Produk JBU, NFR, Jalur Fast Track"
2025-05-29,2025-05-28,13-231408,I,2025,"Jl. Rama Setia, Lampaseh Kota, Kuta Raja, Kota Banda Aceh",Kota Banda Aceh,CODO I,SBM Aceh I Fuel,TAGE3,Re-CAE1,NOT CERTIFIED,NOT CERTIFIED,86.99,79.33,96.35,92.86,97.00,59.98,Basic,DU Dispenser,"NFR, Produk JBU, DU Dispenser"
2025-05-28,2025-05-28,74-95502,VII,2025,Jl.46 Kel.Girian Permai,Kota Bitung,DODO,SBM Sulutgo I Fuel,TAGE2,TAGE3,CERTIFIED,NOT CERTIFIED,86.07,90.00,95.44,88.10,83.00,45.16,Pasti Pas Good,,"NFR, Rompi Khusus"
2025-05-28,2025-05-28,44-53316,IV,2025,"Jl sersan sayun no 08 Majapura, Bobotsari",Kab Purbalingga,DODO,SBM Tegal III Fuel,DAGE,DAGE,CERTIFIED,NOT CERTIFIED,93.56,100.00,96.35,92.52,100.00,61.50,Pasti Pas Good,,"NFR, Produk JBU"
2025-05-28,2025-05-28,44-50606,IV,2009,"Jl.Semarang Magelang km. 48,6",Kab Semarang,DODO,SBM Semarang I Fuel,DAGE,DAGE,CERTIFIED,NOT CERTIFIED,90.92,97.33,100.00,88.61,88.00,51.76,Pasti Pas Good,,"Produk JBU, NFR"
2025-05-28,2025-05-28,54-81110,V,2025,Jl. Singaraja Air Sanih Ds. Girimas,Kab.Buleleng,DODO,SBM Bali III Fuel,Re-CAE1,Re-CAE2,NOT CERTIFIED,NOT CERTIFIED,65.69,76.22,54.68,77.95,76.00,32.23,Basic,Izin Prinsip,"NFR, Izin Prinsip"
2025-05-28,2025-05-28,34-17104,III,2009,Jl. Raya Narogong No.KM 12 17151 Kota Bekasi,Kota Bekasi,DODO,SBM Karawang I Fuel,Re-CAE1,Re-CAE2,NOT CERTIFIED,NOT CERTIFIED,79.42,69.56,92.72,75.20,88.00,61.23,Basic,Salam,"Jalur Fast Track, Salam, NFR"
2025-07-02,2025-05-28,44-59405,IV,2010,"Jl. Raya Jepara Tayu Keling Kelet, Jepara",Kab Jepara,DODO,SBM Semarang III Fuel,TAG1,TAG2,CERTIFIED,NOT CERTIFIED,88.53,91.67,99.04,86.55,100.00,40.04,Pasti Pas Good,,"Produk JBU, NFR"
2025-05-29,2025-05-28,51-60166,V,2025,Jl. Dupak No.15 Pasar Turi,Kota Surabaya,,SBM Surabaya I Fuel,DAGE,DAE,CERTIFIED,CERTIFIED,95.26,97.67,100.00,91.03,100.00,77.41,Pasti Pas Excellent,,
2025-05-28,2025-05-28,34-46318,III,2025,Jl Raya Pangandaran Rt 03 Rw 01 Padaherang Kab. Pangandaran,Kab Pangandaran,DODO,SBM Bandung IV Fuel,DAGE,TAGE1,NOT CERTIFIED,NOT CERTIFIED,83,91.33,92.72,73.34,74.00,57.06,Pasti Pas Good,APAB,"Produk JBU, NFR, Jalur Fast Track, APAB"
2025-05-28,2025-05-28,31-15105,III,2025,"JL. Parimeter Utara, bandara Soekarno Hatta - Tangerang",Kota Tangerang,COCO,SBM Banten I Fuel,TAGE1,TAGE2,CERTIFIED,CERTIFIED,97,96.67,100.00,95.61,97.00,91.70,Pasti Pas Good,,
2025-05-29,2025-05-28,44-59127,IV,2025,"Dukuh Pohijo, Ds Bulumanis, Kec Margoyoso",Kab Pati,DODO,SBM Semarang IV Fuel,TAGE3,DAGE,CERTIFIED,NOT CERTIFIED,91.69,100.00,100.00,90.30,83.00,53.40,Pasti Pas Good,,"NFR, Jalur Fast Track"
2025-05-29,2025-05-28,31-12802,III,2025,Jl. MT. Haryono,Kota Jakarta Selatan, COCO,SBM Jabode III Fuel,DAE,DAE,CERTIFIED,CERTIFIED,99.49,100.00,100.00,97.50,100.00,100.00,Pasti Pas Excellent,,
2025-05-28,2025-05-28,33-40101,III,2025,Jl. AH Nasution No. 105 Cipadung Bandung,Kota Bandung,CODO I,SBM Bandung I Fuel,DAGE,DAGE,CERTIFIED,NOT CERTIFIED,93.36,96.67,100.00,93.81,97.00,58.86,Pasti Pas Good,,"NFR, Produk JBU, Jalur Fast Track"
2025-07-02,2025-05-28,74-94109,VII,2025,Jl. Yos Sudarso Talise Palu,Kota Palu,DODO,SBM Sulteng I Fuel,DAGE,DAGE,CERTIFIED,NOT CERTIFIED,85.94,90.22,93.06,86.65,80.50,55.38,Pasti Pas Good,,"Rompi Khusus, Jalur Fast Track, Produk JBU, NFR"
2025-06-25,2025-05-28,54-61254,V,2008,"Ds.Klopo Sepuluh Kec.Sukodono, Sidoarjo",Kab Sidoarjo,DODO,SBM Surabaya II Fuel,TAGE3,DAGE,CERTIFIED,NOT CERTIFIED,85.28,81.33,100.00,87.95,90.50,42.43,Pasti Pas Good,,"Produk JBU, NFR, Jalur Fast Track, Rompi Khusus"
2025-05-28,2025-05-28,31-11802,III,2025,JL. DAANMOGOT KALIDERES KM 16,Kota Jakarta Barat,COCO,SBM Jabode II Fuel,DAGE,DAGE,CERTIFIED,NOT CERTIFIED,95.05,96.00,100.00,90.0,94.00,88.45,Pasti Pas Good,,Produk JBU
2025-05-29,2025-05-28,44-58108,IV,2025,Jl. Godong Klampok Km.16,Kab Grobogan,DODO,SBM Semarang III Fuel,TAG3,DAG1,CERTIFIED,CERTIFIED,92.7,94.67,96.17,100.00,90.00,64.50,Pasti Pas Good,,
2025-05-29,2025-05-28,31-12601,III,2025,Jl. Lenteng Agung Jakarta Selatan,Kota Jakarta Selatan,COCO,SBM Jabode III Fuel,DAE,DAE,CERTIFIED,CERTIFIED,99.96,100.00,100.00,99.80,100.00,100.00,Pasti Pas Excellent,,
2025-05-29,2025-05-28,51-63126,V,2025,Ruas Tol Trans Jawa Km 626 B Ds. Sugihwaras Kec Saradan,Kab Madiun,COCO,SBM Kediri III Fuel,TAGE1,TAGE2,CERTIFIED,NOT CERTIFIED,94.2,96.67,100.00,92.31,100.00,67.10,Pasti Pas Good,,"NFR, Produk JBU"
2025-05-29,2025-05-28,23-35317,II,2025,"Jl. Tegineneng Haduyang, Natar",Kab Lampung Selatan,CODO I,SBM Lampung I Fuel,DAGE,DAGE,CERTIFIED,NOT CERTIFIED,91.92,97.67,97.26,90.70,97.50,55.48,Pasti Pas Good,,"NFR, Rompi Khusus"
2025-06-24,2025-05-28,44-52309,IV,2025,Jl. Jenderal Sudirman No.1,Kab Pemalang,DODO,SBM Tegal II Fuel,DAE,DAE,CERTIFIED,CERTIFIED,88.71,88.33,93.06,91.70,97.00,62.30,Pasti Pas Excellent,,
2025-05-29,2025-05-28,14-211206,I,2025,"Jl. Medan Km. 4, Pematang Siantar",Kota PematangSiantar,DODO,SBM Medan III Fuel,Re-CAE1,TAGE1,CERTIFIED,NOT CERTIFIED,87.63,96.67,92.72,91.75,80.00,45.40,Pasti Pas Good,,NFR
2025-06-17,2025-05-28,74-93723,VII,2025,Jl. Sultan Hasanuddin Kel. Wolio,Kota Bau Bau,DODO,SBM Sultra I,DAGE,DAGE,CERTIFIED,NOT CERTIFIED,92.93,89.33,100.00,95.79,98.00,71.56,Pasti Pas Good,,Jalur Fast Track
2025-05-29,2025-05-28,31-12203,III,2025,"Jl. Tentara Pelajar no 5, kelurahan Grogol utara, Kecamatan Kebayoran lama, Kota Jakarta selatan, DKI Jakarta",Kota Jakarta Selatan,COCO,SBM Jabode III Fuel,DAE,DAE,CERTIFIED,CERTIFIED,97.66,98.00,100.00,94.90,100.00,92.80,Pasti Pas Excellent,,
2025-05-28,2025-05-28,54-67304,V,2010,Ds. Wonorejo Kec. Kedung Jajang,Kab. Lumajang,DODO,SBM Malang II Fuel,CA,TAG1,CERTIFIED,NOT CERTIFIED,88.27,88.33,100.00,92.29,98.00,35.03,Pasti Pas Good,,"Produk JBU, NFR"
2025-06-20,2025-05-28,43-54316,IV,2025,"Jl. Petanahan, Kab. Kebumen",Kab Kebumen,CODO I,SBM Tegal IV Fuel,DAE,DAE,CERTIFIED,CERTIFIED,95.54,100.00,100.00,94.26,100.00,66.90,Pasti Pas Excellent,,
2025-05-28,2025-05-28,54-61415,V,2009,"Jl. Raya Veteran No.455, Miagan, Kec. Mojoagung",Kabupaten Jombang,DODO,SBM Surabaya II Fuel,Re-CA1,Re-CA2,NOT CERTIFIED,NOT CERTIFIED,56.61,52.78,67.22,61.26,48.50,38.13,Basic,Masa Berlaku APAR,"NFR, Rompi Khusus, Masa Berlaku APAR, Produk JBU, Jalur Fast Track"
2025-05-28,2025-05-28,34-42104,III,2010,Jl. Raya Anyer Km. 129 Cikoneng Anyer,Kota Serang,DODO,SBM Banten II Fuel,TAGE3,DAGE,CERTIFIED,NOT CERTIFIED,93.94,96.67,100.00,94.88,93.00,66.68,Pasti Pas Good,,"NFR, Produk JBU, Jalur Fast Track"
2025-06-25,2025-05-28,44-53124,IV,2008,"Jl. Raya Jatilawang - Wangon, Desa Tinggarjaya",Kab Banyumas,DODO,SBM Tegal III Fuel,DAE,DAE,CERTIFIED,CERTIFIED,96.8,100.00,100.00,99.10,100.00,69.80,Pasti Pas Excellent,,
2025-05-28,2025-05-28,33-41301,III,2025,Jl. Interchange Dawuan Cikampek Karawang ,Kab Karawang,CODO I,SBM Karawang II Fuel,TAGE1,TAGE2,CERTIFIED,NOT CERTIFIED,93.56,98.67,100.00,97.90,88.00,55.76,Pasti Pas Good,,"NFR, Jalur Fast Track"
2025-06-17,2025-05-28,54-60101,V,2010,"Gresik Toll Rd No.40A, Genting Kalianak, Asem Rowo",Kodya Surabaya,DODO,SBM Surabaya I Fuel,Re-CAE1,Re-CAE2,NOT CERTIFIED,NOT CERTIFIED,86.23,79.89,100.00,89.35,98.00,48.80,Basic,,"NFR, Jalur Fast Track, Produk JBU"
2025-06-20,2025-05-28,54-66310,V,2025,Ds. Karangsoko,Kab Trenggalek,DODO,SBM Kediri II Fuel,DAGE,DAGE,CERTIFIED,NOT CERTIFIED,91.87,98.33,100.00,89.05,100.00,45.58,Pasti Pas Good,,NFR
2025-06-18,2025-05-28,44-57515,IV,2025,"Jl. Raya Solo - Sukoharjo, Km.4, Grogol",Kab Sukoharjo,DODO,SBM Yogyakarta III Fuel,DAE,DAE,CERTIFIED,CERTIFIED,95.3,98.33,100.00,96.25,98.00,67.50,Pasti Pas Excellent,,
2025-06-16,2025-05-28,74-93701,VII,2025,Jl. Pahlawan Km.4,Kota Bau Bau,DODO,SBM Sultra I,DAGE,DAGE,CERTIFIED,NOT CERTIFIED,89.78,88.33,100.00,91.50,97.50,52.26,Pasti Pas Good,,Rompi Khusus
2025-05-29,2025-05-28,74-96205,VII,2025,"Jl. Trans Sulawesi, Desa Bongo Nol, Kabupaten Boalemo",Kab Boalemo,DODO,SBM Sulutgo III Fuel,DAGE,DAGE,CERTIFIED,NOT CERTIFIED,90.23,93.00,100.00,87.80,90.50,56.96,Pasti Pas Good,,"NFR, Rompi Khusus"
2025-05-29,2025-05-28,31-14101,III,2025,Jl Raya Tanah Merdeka Cilincing,Kota Jakarta Utara,COCO,SBM Jabode II Fuel,DAE,DAE,CERTIFIED,CERTIFIED,96.1,100.00,100.00,91.87,85.00,92.00,Pasti Pas Excellent,,
2025-05-28,2025-05-28,34-17112,III,2010,"Jl. Raya Pd. Ungu Permai, RT.003/RW.006, Kaliabang Tengah, Kec. Bekasi Utara",Kota Bekasi,DODO,SBM Karawang I Fuel,Re-CAE1,TAGE1,CERTIFIED,NOT CERTIFIED,91.72,97.78,100.00,87.10,84.00,63.27,Pasti Pas Good,,"NFR, Produk JBU"
2025-05-29,2025-05-28,51-601118,V,2025,Komp. Pakuwon City (Laguna) Kav. MU-1 No.17 Surabaya,Kota Surabaya,,SBM Surabaya I Fuel,DAGE,DAE,CERTIFIED,CERTIFIED,95.84,98.67,100.00,91.16,90.00,89.90,Pasti Pas Excellent,,
2025-05-29,2025-05-28,14-231462,I,2025,"Jl. Soekarno Hatta, Mibo",Kota Banda Aceh,DODO,SBM Aceh I Fuel,Re-CAE1,Re-CAE2,NOT CERTIFIED,NOT CERTIFIED,46.31,61.44,2.40,58.12,87.50,58.44,Basic,"DU Dispenser, APAB, Grounding, Izin Prinsip, Masa Berlaku APAR","DU Dispenser, APAB, Rompi Khusus, Grounding, Produk JBU, Izin Prinsip, Masa Berlaku APAR"
2025-05-28,2025-05-28,34-40506,III,2025,Jl. Raya Cipatik - Cililin,Kab Bandung Barat,DODO,SBM Bandung II Fuel,DAE,DAE,CERTIFIED,CERTIFIED,92.5,87.67,100.00,89.80,100.00,82.40,Pasti Pas Excellent,,
2025-07-02,2025-05-28,74-95306,VII,2025,Watudambo,Kab Minahasa Utara,DODO,SBM Sulutgo I Fuel,DAGE,DAGE,CERTIFIED,NOT CERTIFIED,87.23,83.67,93.38,94.95,85.50,65.80,Pasti Pas Good,,"NFR, Rompi Khusus"
2025-05-29,2025-05-28,54-61256,V,2025,Jl. Raya Kletek Kec. Taman,Kab Sidoarjo,,SBM Surabaya II Fuel,DAGE,TAGE1,NOT CERTIFIED,NOT CERTIFIED,86.23,86.00,99.09,85.65,92.00,43.77,Pasti Pas Good,APAB,"Produk JBU, APAB, Jalur Fast Track, NFR"
2025-05-28,2025-05-28,34-11714,III,2025,"Jl. Lingkar Luar Barat, Rawa Buaya",Kota Jakarta Barat,DODO,SBM Jabode II Fuel,DAE,DAE,CERTIFIED,CERTIFIED,95.77,97.33,100.00,99.25,100.00,67.20,Pasti Pas Excellent,,
2025-05-28,2025-05-28,44-55809,IV,2008,Jl. Raya Wonosari - Yogya Km 8 Gading Paliyan,Kab Gunung Kidul,DODO,SBM Yogyakarta I Fuel,DAGE,TAGE1,NOT CERTIFIED,NOT CERTIFIED,92.97,99.33,99.13,85.00,99.00,65.30,Pasti Pas Good,APAB,"NFR, APAB"
2025-06-16,2025-05-28,74-91927,VII,2025,Jl Poros Trasn Sulawesi Desa Bakti Kec Ponrang Selatan Kab Luwu ,Kab. Luwu,,SBM Sulselbar IV Fuel,CA,Re-CA1,NOT CERTIFIED,NOT CERTIFIED,78.6,77.33,83.13,84.24,92.50,44.16,Basic,,"Produk JBU, Jalur Fast Track, Rompi Khusus, NFR"
2025-05-28,2025-05-28,34-43222,III,2025,Jl. Hanjawar Pacet Sukanagalih Cianjur,Kab Cianjur,DODO,SBM Sukabumi I Fuel,TAGE1,TAGE2,CERTIFIED,NOT CERTIFIED,89.6,92.00,90.80,92.43,97.00,65.50,Pasti Pas Good,,"Produk JBU, NFR, Jalur Fast Track"
2025-07-02,2025-05-28,74-94103,VII,2025,Jl Kartini Palu,Kota Palu,DODO,SBM Sulteng I Fuel,DAGE,DAGE,CERTIFIED,NOT CERTIFIED,83.68,87.67,87.29,87.15,89.50,48.14,Pasti Pas Good,,"NFR, Produk JBU, Rompi Khusus"
2025-05-29,2025-05-28,44-52305,IV,2025,Jl. Raya Brigjend. Katamso No.2,Kab Pemalang,DODO,SBM Tegal II Fuel,TAGE1,TAGE2,CERTIFIED,NOT CERTIFIED,86.5,95.33,92.72,89.00,85.00,37.66,Pasti Pas Good,,"Jalur Fast Track, Produk JBU, NFR"
2025-05-29,2025-05-28,44-53123,IV,2025,Jl. Laksda Yos Sudarso no. 141 Karanglewas,Kab Banyumas,DODO,SBM Tegal III Fuel,DAE,DAE,CERTIFIED,CERTIFIED,98.44,100.00,100.00,100.00,100.00,84.41,Pasti Pas Excellent,,
2025-06-25,2025-05-28,24-307145,II,2025,Jl. Palembang Betung Ds.Lubuk Lancang Km.58,Kab Banyuasin,DODO,SBM Sumsel I Fuel,TAGE3,DAGE,CERTIFIED,NOT CERTIFIED,79.57,80.67,86.01,85.88,88.00,35.86,Pasti Pas Good,,"Produk JBU, NFR, Jalur Fast Track"
2025-05-29,2025-05-28,44-59113,IV,2025,Ds. Tayu Utawa Growong Kidul,Kab Pati,DODO,SBM Semarang IV Fuel,DAG3,DAGE,CERTIFIED,NOT CERTIFIED,93.59,96.67,100.00,93.92,98.00,60.00,Pasti Pas Good,,Jalur Fast Track
2025-05-29,2025-05-28,51-63125,V,2025,Tip Ruas Tol Trans Jawa Km 626 A Ds. Sugihwaras Kec. Saradan,Kab Madiun,,SBM Kediri III Fuel,DAGE,DAGE,CERTIFIED,NOT CERTIFIED,95.95,100.00,100.00,96.60,100.00,66.10,Pasti Pas Good,,NFR
2025-05-29,2025-05-28,14-214226,I,2025,"Jl. Lintas Sumatera, Blok Songo",Kab Labuhan Bt Sel,DODO,SBM Sibolga III Fuel,TAGE3,DAGE,CERTIFIED,NOT CERTIFIED,92.28,94.00,98.17,88.04,98.00,72.06,Pasti Pas Good,,"NFR, Produk JBU, Jalur Fast Track"
2025-05-29,2025-05-28,44-54320,IV,2025,Jl. Raya Mirit Desa tlogopragoto Kec mirit kab kebumen,Kab Kebumen,DODO,SBM Tegal IV Fuel,TAGE2,TAGE3,CERTIFIED,NOT CERTIFIED,95.21,98.67,100.00,95.70,99.00,65.60,Pasti Pas Good,,NFR
2025-05-29,2025-05-28,44-57222,IV,2025,"Jl.Sragen - Ngawi Km.5 Benersari ,Ngrampal",Kab Sragen,DODO,SBM Yogyakarta IV Fuel,DAGE,DAGE,CERTIFIED,NOT CERTIFIED,93.91,99.00,100.00,95.10,96.00,55.90,Pasti Pas Good,,"NFR, Jalur Fast Track"
2025-05-28,2025-05-28,34-40131,III,2025,Jl. Garuda No. 92,Kota Bandung,DODO,SBM Bandung I Fuel,DAGE,DAGE,CERTIFIED,NOT CERTIFIED,87.07,94.00,92.33,88.35,90.00,44.96,Pasti Pas Good,,"Jalur Fast Track, Produk JBU, NFR"
2025-05-28,2025-05-28,54-67219,V,2025,Jl. Mastrip Kav.50-51,Kota Probolinggo,,SBM Malang II Fuel,DAGE,DAGE,CERTIFIED,NOT CERTIFIED,90.58,88.33,100.00,93.10,100.00,54.56,Pasti Pas Good,,"NFR, Produk JBU"
2025-05-28,2025-05-28,31-16901,III,2025,Jl. Mayor Oking,Kab Bogor,COCO,SBM Jabode V Fuel,DAE,DAE,CERTIFIED,CERTIFIED,94.32,98.33,88.02,99.80,100.00,84.51,Pasti Pas Excellent,,
2025-05-28,2025-05-28,54-61410,V,2010,"Tanggungan, Glagahan, Kec. Perak",Kabupaten Jombang,V,SBM Surabaya II Fuel,CA,Re-CA1,NOT CERTIFIED,NOT CERTIFIED,35.05,44.44,12.17,47.80,60.50,20.73,Basic,"Izin Prinsip, PELUMAS, Masa Berlaku APAR","Produk JBU, Izin Prinsip, Rompi Khusus, PELUMAS, NFR, Jalur Fast Track, Masa Berlaku APAR"
2025-05-29,2025-05-28,14-211203,I,2025,Jl. DI. Panjaitan No. 49,Kota PematangSiantar,DODO,SBM Medan III Fuel,DAGE,DAGE,CERTIFIED,NOT CERTIFIED,95.61,100.00,100.00,100.00,95.50,60.56,Pasti Pas Good,,"Rompi Khusus, NFR, Jalur Fast Track, Produk JBU"
2025-05-28,2025-05-28,34-15421,III,2025,Jl. Cendrawasih No. 25 Sawah Lama  Ciputat,Kota Tangerang Sel.,DODO,SBM Banten I Fuel,Re-CAE1,Re-CAE2,NOT CERTIFIED,NOT CERTIFIED,66.42,82.22,53.03,61.03,94.50,39.85,Basic,"PELUMAS, Izin Prinsip","NFR, Rompi Khusus, Produk JBU, PELUMAS, Jalur Fast Track, Izin Prinsip"
2025-05-29,2025-05-28,24-34199,II,2025,"Jl. Lintas Batanghari, Lampung Timur",Kab Lampung Timur,DODO,SBM Lampung II Fuel,TAGE2,TAGE3,CERTIFIED,NOT CERTIFIED,87.81,86.67,100.00,89.18,98.00,41.73,Pasti Pas Good,,"Jalur Fast Track, NFR"
2025-05-28,2025-05-28,34-41327,III,2025,"Jl.Bukit Indah Raya,Kec.Cikampek",Kab Karawang,DODO,SBM Karawang II Fuel,TAGE1,TAGE2,CERTIFIED,NOT CERTIFIED,96.61,99.00,100.00,97.05,100.00,74.96,Pasti Pas Good,,NFR
2025-05-29,2025-05-28,44-50613,IV,2025,"JL. RAYA AMBARAWA - MAGELANG KM.11, LENDOH, BEDONO",Kab Semarang,DODO,SBM Semarang I Fuel,DAGE,DAGE,CERTIFIED,NOT CERTIFIED,89.12,83.33,100.00,89.53,98.00,63.96,Pasti Pas Good,,"NFR, Produk JBU"
2025-05-28,2025-05-28,31-15701,III,2025,"Jl Citra Raya Utama Timur Blok O, Ciakar, panongan, Kabupaten tangerang, Banten",Kab Tangerang,COCO,SBM Banten I Fuel,DAGE,DAGE,CERTIFIED,NOT CERTIFIED,93.92,98.52,100.00,87.03,97.00,72.06,Pasti Pas Good,,"Produk JBU, NFR"
2025-07-02,2025-05-28,64-70201,VI,2025,"Jl. Ahmad Yani Km 5,70",Kota Banjarmasin,8125021657,SBM Kalsel I Fuel,TAGE3,DAGE,CERTIFIED,NOT CERTIFIED,84.88,88.33,93.06,87.67,72.50,56.80,Pasti Pas Good,,"Jalur Fast Track, Rompi Khusus, NFR, Produk JBU"
2025-05-28,2025-05-28,34-46310,III,2025,"Jl Raya Pangandaran, Kali Pucang",Kab Pangandaran,DODO,SBM Bandung IV Fuel,TAGE3,Re-CAE1,NOT CERTIFIED,NOT CERTIFIED,68.13,89.33,54.00,59.65,72.50,59.46,Basic,,"Rompi Khusus, NFR, Produk JBU"
2025-05-29,2025-05-28,54-66308,V,2025,Jl. Raya Bendo Rejo Pogalan,Kab Trenggalek,DODO,SBM Kediri II Fuel,DAGE,TAGE1,NOT CERTIFIED,NOT CERTIFIED,74.62,71.67,84.73,71.60,89.00,44.81,Pasti Pas Good,,NFR
2025-05-29,2025-05-28,54-81114,V,2025,"Jl. Gajah Mada, Singaraja",Kab Buleleng,DODO,SBM Bali III Fuel,DAGE,DAGE,CERTIFIED,NOT CERTIFIED,92.7,96.67,100.00,96.67,98.00,45.56,Pasti Pas Good,,"Produk JBU, NFR, Jalur Fast Track"
2025-05-28,2025-05-28,31-17103,III,2025,Jl. Raya Narogong KM. 12 Bantar Gebang,Kota Bekasi,COCO,SBM Karawang I Fuel,DAE,DAE,CERTIFIED,CERTIFIED,98.39,99.00,100.00,97.82,100.00,91.20,Pasti Pas Excellent,,
2025-05-29,2025-05-28,31-15302,III,2025,Jl. Raya Serpong - ,Kota Tangerang Sel.,COCO,SBM Banten I Fuel,DAE,DAE,CERTIFIED,CERTIFIED,98.39,100.00,100.00,94.10,97.00,98.70,Pasti Pas Excellent,,
2025-05-29,2025-05-28,44-57123,IV,2025,"Jl. Bhayangkara No.18, Panularan",Kota Surakarta,DODO,SBM Yogyakarta III Fuel,DAGE,DAGE,CERTIFIED,NOT CERTIFIED,92.5,96.67,100.00,89.50,93.00,63.00,Pasti Pas Good,,NFR
2025-05-29,2025-05-27,44-58101,IV,2025,Jl. Putat Purwodadi Grobogan,Kab Grobogan,DODO,SBM Semarang III Fuel,DAGE,DAGE,CERTIFIED,NOT CERTIFIED,90.04,84.33,100.00,100.00,95.00,52.40,Pasti Pas Good,,NFR
2025-05-29,2025-05-27,44-52425,IV,2025,"Jl. Raya Pejagan-Prupuk, Desa Marga Ayu, Kec. Margasari, Kab. Tegal",Kab Tegal,DODO,SBM Tegal I Fuel,Re-CAE1,Re-CAE2,NOT CERTIFIED,NOT CERTIFIED,77.83,60.33,96.35,88.88,87.50,42.88,Basic,"HP, Nol","Jalur Fast Track, NFR, Rompi Khusus, Produk JBU, HP, Nol"
2025-05-28,2025-05-27,31-12104,III,2025,Jln Gandaria 1 Kav. 27-28 Kel.Keramat Pela kec.Kebayoran Baru Jakarta Selatan ,Kota Jakarta Selatan,COCO,SBM Jabode III Fuel,TAGE2,TAGE3,CERTIFIED,NOT CERTIFIED,97.82,99.33,100.00,95.68,100.00,88.66,Pasti Pas Good,,Produk JBU
2025-05-28,2025-05-27,54-66311,V,2025,"Jl. Raya Dongko, Karang Tengah, Dongko, Kec. Dongko, Kabupaten Trenggalek",Kab.Trenggalek,DODO,SBM Kediri II Fuel,Re-CAE1,Re-CAE2,NOT CERTIFIED,NOT CERTIFIED,80.96,74.56,100.00,76.95,99.00,37.08,Basic,APAB,"NFR, Produk JBU, APAB"
2025-05-29,2025-05-27,44-52318,IV,2025,"Jl. Hos Cokroaminoto, Pelutan",Kab Pemalang,DODO,SBM Tegal II Fuel,DAG2,DAG3,CERTIFIED,NOT CERTIFIED,89.03,94.00,93.06,90.67,95.00,52.70,Pasti Pas Good,,"Jalur Fast Track, NFR"
2025-05-28,2025-05-27,33-16702,III,2025,JL. ENCE SOEMANTADIREJA - CIHIDEUNG,Kab Bogor,CODO I,SBM Jabode V Fuel,DAGE,DAGE,CERTIFIED,NOT CERTIFIED,90.26,99.33,91.67,90.07,93.00,56.70,Pasti Pas Good,,"Produk JBU, Jalur Fast Track"
2025-05-29,2025-05-27,74-96104,VII,2025,Jl.Raya Eyato Kota barat Gorontalo,Kota Gorontalo,DODO,SBM Sulutgo III Fuel,DAE,DAE,CERTIFIED,CERTIFIED,95.28,96.67,100.00,93.63,100.00,75.41,Pasti Pas Excellent,,
2025-05-28,2025-05-27,34-17116,III,2009,"Jl. Bintara, RT.006/RW.013, Bintara Jaya, Kec. Bekasi Barat",Kota Bekasi,DODO,SBM Karawang I Fuel,Re-CAE1,Re-CAE2,NOT CERTIFIED,NOT CERTIFIED,81.2,81.67,96.37,86.07,62.00,43.77,Basic,"Masa Berlaku APAR, APAB","Masa Berlaku APAR, NFR, Produk JBU, APAB"
2025-05-29,2025-05-27,24-34102,II,2025,Jl. Mulyo Jati,Kota Metro,DODO,SBM Lampung II Fuel,DAGE,DAGE,CERTIFIED,NOT CERTIFIED,93.22,100.00,100.00,95.52,93.00,48.10,Pasti Pas Good,,NFR
2025-05-28,2025-05-27,34-40515,III,2025,Jl. Gempol Asri - Melong Asih Cimahi,Kota Cimahi,DODO,SBM Bandung I Fuel,DAGE,DAGE,CERTIFIED,NOT CERTIFIED,90.91,95.33,100.00,90.10,97.00,45.90,Pasti Pas Good,,NFR
2025-06-12,2025-05-27,34-13703,III,2025,Jl. Raya Ciracas No. 107 Kec. Ciracas,Kota Jakarta Timur,DODO,SBM Jabode I Fuel,DAGE,DAGE,CERTIFIED,NOT CERTIFIED,96.18,100.00,100.00,99.60,100.00,62.60,Pasti Pas Good,,NFR
2025-05-28,2025-05-27,54-64123,V,2025,Desa Tanbi Bendo Kec Mojo,Kab Kediri,DODO,SBM Kediri I Fuel,DAGE,DAGE,CERTIFIED,NOT CERTIFIED,89.54,96.67,100.00,88.85,81.00,46.66,Pasti Pas Good,,"NFR, Produk JBU"
2025-05-28,2025-05-27,34-46304,III,2025,Jl. Raya Ciokong Pangandaran,Kab Pangandaran,DODO,SBM Bandung IV Fuel,TAGE2,Re-CAE1,NOT CERTIFIED,NOT CERTIFIED,72.71,62.89,89.50,75.80,76.00,48.80,Basic,"Masa Berlaku APAR, Izin Prinsip, HP","Masa Berlaku APAR, Izin Prinsip, HP, NFR"
2025-05-29,2025-05-27,44-59528,IV,2025,"Jl Raya Guntur, Desa Grogol, Kec Karangtengah",Kab Demak,DODO,SBM Semarang III Fuel,DAGE,DAGE,CERTIFIED,NOT CERTIFIED,94.11,100.00,100.00,99.17,93.00,49.73,Pasti Pas Good,,"Jalur Fast Track, NFR"
2025-05-28,2025-05-27,34-43201,III,2025,"Jl Raya Bandung, Karang Tengah",Kab Cianjur,DODO,SBM Sukabumi I Fuel,DAGE,DAGE,CERTIFIED,NOT CERTIFIED,92.15,93.33,100.00,93.19,95.00,60.13,Pasti Pas Good,,"Jalur Fast Track, Produk JBU, NFR"
2025-05-28,2025-05-27,61-78301,VI,2025,Jl.Raya Nusapati Kec. Sungai Pinyuh,Kab Mempawah,COCO,SBM Kalbar I Fuel,DAGE,DAGE,CERTIFIED,NOT CERTIFIED,95.13,100.00,100.00,98.40,100.00,54.38,Pasti Pas Good,,"NFR, Produk JBU"
2025-05-28,2025-05-27,34-17130,III,2025,Jl. Raya Pondok Ungu Permai No.2,Kab Bekasi,DODO,SBM Karawang I Fuel,TAGE1,Re-CAE1,NOT CERTIFIED,NOT CERTIFIED,56.35,28.00,53.77,84.80,95.50,53.10,Basic,"Nol, Trims, Salam, Produk JBU","Nol, Trims, Salam, Produk JBU, Rompi Khusus, Jalur Fast Track, NFR"
2025-05-28,2025-05-27,34-12804,III,2025,"Jl.DR.Supomo,Tebet",Kota Jakarta Selatan,DODO,SBM Jabode III Fuel,TAGE2,TAGE3,CERTIFIED,NOT CERTIFIED,92.63,95.67,100.00,93.35,100.00,52.56,Pasti Pas Good,,"NFR, Produk JBU"
2025-06-24,2025-05-27,14-214263,I,2025,"Jl. Lintas Sumatera, Pinang Awan",Kab. Labuhan Batu,DODO,SBM Sibolga III Fuel,Re-CAE1,TAGE1,CERTIFIED,NOT CERTIFIED,91.2,96.00,100.00,89.20,93.00,52.56,Pasti Pas Good,,"Jalur Fast Track, Produk JBU, NFR"
2025-05-28,2025-05-27,34-45306,III,2025,Jl. Raya Sukatali,Kab Sumedang,DODO,SBM Bandung III Fuel,TAGE1,Re-CAE1,NOT CERTIFIED,NOT CERTIFIED,81.38,91.67,88.29,62.37,85.50,63.90,Basic,Izin Prinsip,"NFR, Rompi Khusus, Izin Prinsip, Jalur Fast Track"
2025-05-29,2025-05-27,44-53209,IV,2025,KOMPLEK PELABUHAN,Kab Cilacap,DODO,SBM Tegal III Fuel,TAG2,TAG3,CERTIFIED,NOT CERTIFIED,89.41,96.67,100.00,98.35,72.50,34.91,Pasti Pas Good,,"Produk JBU, Rompi Khusus, NFR"
2025-07-02,2025-05-27,34-15405,III,2025,Jl. IR. H. Juanda,Kota Tangerang Sel.,DODO,SBM Banten I Fuel,TAG2,TAG3,CERTIFIED,NOT CERTIFIED,87.68,95.33,92.33,90.10,87.00,46.61,Pasti Pas Good,,"Produk JBU, NFR"
2025-05-29,2025-05-27,24-345107,II,2025,Jl. Lintas Timur Menggala,Kab Tulang Bawang,DODO,SBM Lampung II Fuel,TAGE3,DAGE,CERTIFIED,NOT CERTIFIED,83.82,84.00,100.00,85.15,73.00,42.66,Pasti Pas Good,,"NFR, Jalur Fast Track"
2025-05-28,2025-05-27,31-11601,III,2025,Jl. Meruya Ilir,Kota Jakarta Barat,COCO,SBM Jabode II Fuel,DAE,DAE,CERTIFIED,CERTIFIED,99.47,100.00,100.00,100.00,100.00,94.70,Pasti Pas Excellent,,
2025-05-28,2025-05-27,34-15139,III,2025,Jl. KH Hasyim Ashari Pinang Raya Narogong,Kota Tangerang,DODO,SBM Banten I Fuel,CA,Re-CA1,NOT CERTIFIED,NOT CERTIFIED,61.01,63.44,63.48,53.65,87.50,35.21,Basic,"Salam, Grounding, Izin Prinsip","Produk JBU, Salam, Grounding, Rompi Khusus, NFR, Izin Prinsip, Jalur Fast Track"
2025-05-29,2025-05-27,54-81115,V,2025,Jl. Ahmad Yani Singaraja,Kab Buleleng,O85238068995,SBM Bali III Fuel,DAGE,DAGE,CERTIFIED,NOT CERTIFIED,93.13,96.67,100.00,97.85,100.00,45.56,Pasti Pas Good,,"NFR, Produk JBU"
2025-05-28,2025-05-27,34-41311,III,2025,"Jl. Jend Sudirman, Kec. Kota Baru",Kab Karawang,DODO,SBM Karawang II Fuel,TAGE1,TAGE2,CERTIFIED,NOT CERTIFIED,95.02,98.00,100.00,98.10,100.00,60.46,Pasti Pas Good,,NFR
2025-05-28,2025-05-27,54-64413,V,2009," Mlorah Satu, Mlorah, Kec. Rejoso, Kab. Nganjuk",Kab Nganjuk,DODO,SBM Kediri I Fuel,Re-CA1,Re-CA2,NOT CERTIFIED,NOT CERTIFIED,81.5,83.44,93.98,78.06,94.00,33.50,Basic,Izin Prinsip,"Jalur Fast Track, NFR, Produk JBU, Izin Prinsip"
2025-05-29,2025-05-27,44-52214,IV,2025,Jl. Karangbale Larangan,Kab Brebes,DODO,SBM Tegal I Fuel,Re-CAE1,TAGE1,CERTIFIED,NOT CERTIFIED,92.73,98.33,100.00,100.00,95.00,37.33,Pasti Pas Good,,"NFR, Produk JBU"
2025-05-28,2025-05-27,54-61106,V,2025,Ds. Dahanrejo Kebomas,Kab Gresik,DODO,SBM Surabaya III Fuel,DAE,DAE,CERTIFIED,CERTIFIED,93.99,90.33,100.00,95.18,100.00,78.40,Pasti Pas Excellent,,
2025-05-29,2025-05-27,44-59314,IV,2025,Jl. Raya Kudus Solo,Kab Kudus,DODO,SBM Semarang III Fuel,TAGE3,DAGE,CERTIFIED,NOT CERTIFIED,95.83,100.00,100.00,99.00,100.00,60.31,Pasti Pas Good,,"Produk JBU, NFR"
2025-05-29,2025-05-27,74-95331,VII,2025,Desa Kolongan Kec. Kalawat Kab. Minahasa Utara,Kab Minahasa Utara,DODO,SBM Sulutgo I Fuel,TAGE3,DAGE,CERTIFIED,NOT CERTIFIED,88.3,89.00,99.04,88.30,96.00,46.24,Pasti Pas Good,,"Jalur Fast Track, Produk JBU, NFR"
2025-05-28,2025-05-27,54-61409,V,2010,"Desa Jatipelem, kec. Diwek, Jombang",Kabupaten Jombang,DODO,SBM Surabaya II Fuel,CA,Re-CA1,NOT CERTIFIED,NOT CERTIFIED,64.02,58.33,64.40,84.06,75.50,32.95,Basic,"Izin Prinsip, Masa Berlaku APAR","Izin Prinsip, Rompi Khusus, Produk JBU, Masa Berlaku APAR, Jalur Fast Track, NFR"
2025-05-29,2025-05-27,24-37223,II,2025,Jl. Letjend Suprapto No.8 Muara Tebo,Kab Tebo,DODO,SBM Jambi II Fuel,Re-CA1,Re-CA2,NOT CERTIFIED,NOT CERTIFIED,86.13,86.40,91.38,98.50,95.50,40.04,Basic,Masa Berlaku APAR,"Produk JBU, Jalur Fast Track, Rompi Khusus, NFR, Masa Berlaku APAR"
