send_date,Audit Date,spbu_no,region,year,address,city_name,tipe_spbu,rayon,audit_level,audit_next,good_status,excellent_status,Total Score,SSS,EQnQ,RFS,VFC,EPO,kelas_spbu,penalty_good_alerts,penalty_excellent_alerts
2025-05-17,2025-05-17,44-52403,IV,2025,Jl. Raya A.Yani Slawi,Kab Tegal,DODO,SBM Tegal I Fuel,DAGE,DAGE,CERTIFIED,NOT CERTIFIED,87.3,96.67,92.72,86.55,92.50,39.26,Pasti Pas Good,,"Jalur Fast Track, Rompi Khusus, NFR, Produk JBU"
2025-05-17,2025-05-17,54-61312,V,2025,Jl. Pemuda Ds. Ngrame Kec. Pungging,Kab Mojokerto,,SBM Surabaya I Fuel,DAG2,DAG3,CERTIFIED,NOT CERTIFIED,84.07,81.33,99.04,86.02,91.00,36.53,Pasti Pas Good,,"Jalur Fast Track, NFR, Produk JBU"
2025-05-17,2025-05-17,13-275505,I,2025,"Jalan Lintas Sumatera Km. 192,5, Nagari Sikabau, Kecamatan Pulau punjung",Kab Dharmas Raya,CODO I,SBM Sumatera Barat II Fuel,DAGE,DAGE,CERTIFIED,NOT CERTIFIED,88.38,88.67,96.52,91.03,80.00,66.00,Pasti Pas Good,,NFR
2025-05-17,2025-05-17,54-61127,V,2025,"Jl. Raya Roomo Kec.Manyar, Gresik",Kab Gresik,DODO,SBM Surabaya III Fuel,TAGE1,TAGE2,CERTIFIED,NOT CERTIFIED,94.53,99.33,100.00,92.90,100.00,61.46,Pasti Pas Good,,NFR
2025-05-17,2025-05-17,54-60143,V,2025,Jl. Indrakila,Kota Surabaya,,SBM Surabaya I Fuel,DAGE,DAGE,CERTIFIED,NOT CERTIFIED,87.1,88.33,96.52,88.28,83.50,56.20,Pasti Pas Good,,"NFR, Produk JBU, Rompi Khusus, Jalur Fast Track"
2025-07-02,2025-05-17,64-70614,VI,2025,"Jl. Martapura Lama, Gudang Hirang",Kab Banjar,DODO,SBM Kalsel I Fuel,DAGE,DAGE,CERTIFIED,NOT CERTIFIED,86.82,88.33,92.72,90.34,91.50,52.96,Pasti Pas Good,,"Rompi Khusus, Jalur Fast Track, Produk JBU, NFR"
2025-05-17,2025-05-17,74-90204,VII,2025,"Jl. Permandian Alam, Barombong",Kota Makassar,,SBM Sulselbar I Fuel,DAE,DAGE,CERTIFIED,NOT CERTIFIED,87.67,81.00,93.06,91.40,97.00,74.70,Pasti Pas Good,,NFR
2025-07-02,2025-05-17,54-601104,V,2025,Jl. Ambengan No.16 Surabaya,Kota Surabaya,DODO,SBM Surabaya I Fuel,TAGE1,TAGE2,CERTIFIED,NOT CERTIFIED,90.01,88.33,100.00,91.60,91.00,60.90,Pasti Pas Good,,"Produk JBU, Jalur Fast Track, NFR"
2025-05-17,2025-05-17,34-17127,III,2025,Jl. Khairil Anwar Margahayu,Kota Bekasi,DODO,SBM Karawang I Fuel,TAGE3,DAGE,CERTIFIED,NOT CERTIFIED,93.99,98.67,100.00,92.30,96.00,63.27,Pasti Pas Good,,"NFR, Produk JBU"
2025-05-17,2025-05-17,54-60106,V,2025,Jl. Dharmahusada No.114-116 Surabaya,Kota Surabaya,DODO,SBM Surabaya I Fuel,DAE,DAE,CERTIFIED,CERTIFIED,94.67,97.33,100.00,90.15,100.00,74.30,Pasti Pas Excellent,,
2025-05-17,2025-05-17,54-80308,V,2025,"Jl. Raya Kapal, Mengwi",Kab Badung,DODO,SBM Bali II Fuel,DAGE,DAGE,CERTIFIED,NOT CERTIFIED,88.68,88.33,98.47,87.73,93.00,57.83,Pasti Pas Good,,"Produk JBU, Jalur Fast Track, NFR"
2025-05-17,2025-05-17,54-61303,V,2025,Jl. Raya Pungging Kec. Pungging,Kab Mojokerto,DODO,SBM Surabaya I Fuel,TAG2,Re-CA1,NOT CERTIFIED,NOT CERTIFIED,73.88,67.67,84.48,82.60,84.00,35.76,Basic,APAB,"NFR, APAB, Jalur Fast Track, Produk JBU"
2025-05-17,2025-05-17,54-60120,V,2025,Jl. Gresik No.7 ,Kota Surabaya,DODO,SBM Surabaya I Fuel,DAGE,TAGE1,NOT CERTIFIED,NOT CERTIFIED,80.6,70.00,96.35,82.32,89.50,52.50,Pasti Pas Good,APAB,"NFR, APAB, Rompi Khusus, Jalur Fast Track"
2025-07-02,2025-05-17,54-67129,V,2025,Jl. Raci km 5 raci pasuruan,Kab Pasuruan,DODO,SBM Malang I Fuel,TAGE1,TAGE2,CERTIFIED,NOT CERTIFIED,84.51,85.00,92.70,86.78,97.00,41.05,Pasti Pas Good,,"NFR, Produk JBU, Jalur Fast Track"
2025-05-17,2025-05-17,44-57416,IV,2025,"Jl. Yogya-Solo, Ds. Sangrahan Kemudo, Prambanan",Kab Klaten,DODO,SBM Yogyakarta III Fuel,TAGE3,DAGE,CERTIFIED,NOT CERTIFIED,89.86,90.00,98.26,87.65,95.00,63.50,Pasti Pas Good,,"NFR, Produk JBU, Jalur Fast Track"
2025-05-17,2025-05-17,53-68135,V,2025,Jl. Basuki Rahmat No.5-7 Kelurahan Kebonsari Sumbersari Jember,Kab Jember,CODO I,SBM Malang II Fuel,TAGE1,TAGE2,CERTIFIED,NOT CERTIFIED,87.87,89.00,92.72,93.60,98.00,50.66,Pasti Pas Good,,"Jalur Fast Track, Produk JBU, NFR"
2025-05-17,2025-05-17,54-64403,V,2025,JL. PANGLIMA SUDIRMAN 276,Kab Nganjuk,DODO,SBM Kediri I Fuel,DAGE,DAGE,CERTIFIED,NOT CERTIFIED,90.04,90.33,100.00,92.88,95.50,48.04,Pasti Pas Good,,"Jalur Fast Track, NFR, Produk JBU, Rompi Khusus"
2025-07-02,2025-05-17,54-63411,V,2025,Jl. Raya Ponorogo-Trenggalek Ds. Besuki,Kab Ponorogo,DODO,SBM Kediri III Fuel,DAGE,DAGE,CERTIFIED,NOT CERTIFIED,90.58,94.33,100.00,91.60,93.00,46.56,Pasti Pas Good,,"NFR, Produk JBU, Jalur Fast Track"
2025-07-02,2025-05-17,54-65165,V,2025,Ds. Sengguruh Kec Kepanjen,Kab Malang,DODO,SBM Malang I Fuel,TAGE3,DAGE,CERTIFIED,NOT CERTIFIED,86.42,87.00,95.44,89.30,85.50,52.81,Pasti Pas Good,,"NFR, Rompi Khusus"
2025-07-02,2025-05-17,54-65164,V,2025,Jl. Karang Pucung,Kab Malang,DODO,SBM Malang I Fuel,TAGE1,TAGE2,CERTIFIED,CERTIFIED,91.48,95.33,95.44,93.80,100.00,54.88,Pasti Pas Good,,
2025-05-17,2025-05-17,34-16119,III,2025,Jl. KH. Soleh Iskandar,Kota Bogor,DODO,SBM Jabode IV Fuel,TAGE1,Re-CAE1,NOT CERTIFIED,NOT CERTIFIED,84.46,98.00,76.33,90.50,100.00,40.72,Basic,Produk JBU,"Produk JBU, NFR"
2025-05-17,2025-05-17,34-40516,III,2025,Jl. Kerkof Padakasih Cibeber,Kota Cimahi,DODO,SBM Bandung I Fuel,TAGE3,DAGE,CERTIFIED,NOT CERTIFIED,94.64,95.33,100.00,94.65,97.00,74.08,Pasti Pas Good,,NFR
2025-05-17,2025-05-17,34-45230,III,2025,Jl. Raya Patrol Haurgeulis,Kab Indramayu,DODO,SBM Cirebon II Fuel,TAGE1,TAGE2,CERTIFIED,NOT CERTIFIED,86.4,96.22,88.50,86.10,96.00,41.00,Pasti Pas Good,,"Jalur Fast Track, NFR"
2025-05-17,2025-05-17,34-17541,III,2025,"Jl. Inspeksi Kali Malang NO.27, Kec. Tambun Selatan",Kab Bekasi,DODO,SBM Karawang I Fuel,DAGE,DAGE,CERTIFIED,NOT CERTIFIED,88.73,84.33,99.09,93.69,86.00,63.48,Pasti Pas Good,,"NFR, Jalur Fast Track"
2025-05-17,2025-05-17,14-2031149,I,2025,"Jl. Perhubungan, Lau Dendang",Kab Deli Serdang,DODO,SBM Medan II Fuel,DAGE,DAGE,CERTIFIED,NOT CERTIFIED,93.29,93.67,100.00,98.80,98.00,56.31,Pasti Pas Good,,NFR
2025-05-17,2025-05-17,34-46202,III,2025,"Jl Raya Kawali Baregbeg, Desa Sukamaju",Kab Ciamis,DODO,SBM Bandung IV Fuel,TAGE2,Re-CAE1,NOT CERTIFIED,NOT CERTIFIED,77.27,81.00,85.43,78.50,66.50,49.90,Basic,,"Jalur Fast Track, NFR"
2025-05-17,2025-05-17,44-56312,IV,2025,"JL. Raya Kledung Ds. Jurangrejo, Kec. Kertek, Kab. Wonosobo",Kab Wonosobo,DODO,SBM Semarang II Fuel,DAGE,DAE,CERTIFIED,CERTIFIED,94.62,96.67,100.00,93.20,98.00,71.90,Pasti Pas Excellent,,
2025-05-17,2025-05-17,44-57603,IV,2025,"JL. Raya Wonogiri-Ponorogo, Kec.Sidoharjo",Kab Wonogiri,DODO,SBM Yogyakarta IV Fuel,DAGE,DAGE,CERTIFIED,NOT CERTIFIED,93.58,97.33,100.00,92.60,98.00,60.56,Pasti Pas Good,,"Produk JBU, Jalur Fast Track, NFR"
2025-05-17,2025-05-17,54-63417,V,2025,DS. BAJANG MLARAK,Kab Ponorogo,DODO,SBM Kediri III Fuel,DAGE,DAGE,CERTIFIED,NOT CERTIFIED,92.33,93.33,100.00,90.80,100.00,61.73,Pasti Pas Good,,"Produk JBU, NFR"
2025-05-17,2025-05-17,34-46209,III,2025,Jl. Raya Ciamis-Cirebon Panawangan,Kab Ciamis,DODO,SBM Bandung IV Fuel,DAGE,TAGE1,NOT CERTIFIED,NOT CERTIFIED,83.08,87.00,97.12,75.35,78.00,49.73,Pasti Pas Good,,"NFR, Jalur Fast Track"
2025-05-17,2025-05-17,44-55713,IV,2025,"JL. RAYA PARANGTRITIS KM.24,5 KRETEK",Kab Bantul,DODO,SBM Yogyakarta I Fuel,DAE,DAE,CERTIFIED,CERTIFIED,94.53,97.33,100.00,86.40,98.00,82.50,Pasti Pas Excellent,,
2025-05-17,2025-05-17,44-55610,IV,2025,Jl. Wates Purworejo Km. 8,Kab Kulon Progo,DODO,SBM Yogyakarta I Fuel,TAGE1,TAGE2,CERTIFIED,NOT CERTIFIED,90.84,97.33,92.33,92.38,97.00,57.71,Pasti Pas Good,,"Jalur Fast Track, Produk JBU, NFR"
2025-05-17,2025-05-17,34-16306,III,2025,"Jl. H. Mawi, Ciseeng - Parung",Kab Bogor,DODO,SBM Jabode V Fuel,DAGE,DAGE,CERTIFIED,NOT CERTIFIED,89.31,87.33,100.00,92.50,98.00,48.13,Pasti Pas Good,,"NFR, Jalur Fast Track, Produk JBU"
2025-05-17,2025-05-17,24-302129,II,2025,Jl. Gubernur HA Bastari Kec. Rambutan Kab. Banyuasin,Kab Banyuasin,DODO,SBM Sumsel I Fuel,DAGE,DAGE,CERTIFIED,NOT CERTIFIED,90.92,95.33,93.06,93.60,92.00,64.76,Pasti Pas Good,,"NFR, Produk JBU"
2025-07-02,2025-05-17,54-63407,V,2025,Jl. Sukowati Ds. Kutu kulon Kec. jetis,Kab Ponorogo,DODO,SBM Kediri III Fuel,DAGE,DAGE,CERTIFIED,NOT CERTIFIED,85.74,88.33,92.72,86.90,100.00,40.48,Pasti Pas Good,,"NFR, Produk JBU"
2025-05-17,2025-05-17,34-45202,III,2025,Jl. Raya Pilang Sari,Kab Indramayu,DODO,SBM Cirebon II Fuel,DAGE,DAGE,CERTIFIED,NOT CERTIFIED,88.55,93.33,99.04,88.50,89.50,41.90,Pasti Pas Good,,"Rompi Khusus, NFR"
2025-06-12,2025-05-17,14-262534,I,2025,Jl. Nusantara,Kota Payakumbuh,DODO,SBM Sumatera Barat II Fuel,DAGE,DAGE,CERTIFIED,NOT CERTIFIED,89.29,88.67,100.00,92.80,91.00,50.26,Pasti Pas Good,,"Produk JBU, NFR"
2025-05-17,2025-05-17,24-30219,II,2025,Jl. Ki. Merogan Kertapati,Kota Palembang,DODO,SBM Sumsel I Fuel,DAGE,DAGE,CERTIFIED,NOT CERTIFIED,86.85,95.33,88.88,91.10,88.00,45.66,Pasti Pas Good,,"Produk JBU, Jalur Fast Track, NFR"
2025-05-18,2025-05-17,14-241470,I,2025,"Jl. Medan-B. Aceh, Beurunuen",Kab Pidie,,SBM Aceh I Fuel,TAGE2,TAGE3,CERTIFIED,NOT CERTIFIED,90.67,87.67,99.04,94.50,98.00,59.54,Pasti Pas Good,,"NFR, Jalur Fast Track, Produk JBU"
2025-07-02,2025-05-17,54-60118,V,2025,"Jl. Perak Barat, Alun Alun Priok No.2",Kota Surabaya,,SBM Surabaya I Fuel,DAE,DAE,CERTIFIED,CERTIFIED,90.65,85.33,100.00,86.40,98.00,79.66,Pasti Pas Excellent,,
2025-07-02,2025-05-17,54-67138,V,2025,Jl. Cukur Gondang-Grati,Kab Pasuruan,DODO,SBM Malang I Fuel,DAGE,DAGE,CERTIFIED,NOT CERTIFIED,88.5,84.33,100.00,89.80,93.00,59.17,Pasti Pas Good,,"NFR, Produk JBU, Jalur Fast Track"
2025-05-17,2025-05-17,24-36101,II,2025,"Jl. Kapten Patimura, Simpang Rimbo",Kota Jambi,DODO,SBM Jambi I Fuel,DAGE,DAGE,CERTIFIED,NOT CERTIFIED,93.18,97.33,100.00,97.50,93.50,51.33,Pasti Pas Good,,"Produk JBU, Rompi Khusus, Jalur Fast Track, NFR"
2025-06-20,2025-05-17,44-52110,IV,2025,Jl. Raya Mindaka Larangan,Kab Tegal,DODO,SBM Tegal I Fuel,TAGE2,TAGE3,CERTIFIED,CERTIFIED,86.93,85.67,93.06,87.30,87.00,71.50,Pasti Pas Good,,
2025-06-16,2025-05-17,44-57401,IV,2025,"Jl. Klaten - Jogja, Ds. Geneng, Prambanan",Kab Klaten,DODO,SBM Yogyakarta III Fuel,TAGE1,TAGE2,CERTIFIED,NOT CERTIFIED,87.94,89.33,97.12,88.45,87.50,55.60,Pasti Pas Good,,"Rompi Khusus, NFR, Jalur Fast Track"
2025-05-17,2025-05-17,44-54321,IV,2025,JL. LINGKAR SELATAN LAAUT JAWA TEGALRETNO RT 001/002,Kab Kebumen,DODO,SBM Tegal IV Fuel,DAGE,DAGE,CERTIFIED,NOT CERTIFIED,90.46,97.33,93.38,89.10,100.00,54.30,Pasti Pas Good,,NFR
2025-05-17,2025-05-17,44-54311,IV,2025,Jl. Raya Puring Kalitenga,Kab Kebumen,DODO,SBM Tegal IV Fuel,DAGE,DAGE,CERTIFIED,NOT CERTIFIED,91.71,96.67,100.00,86.80,97.00,56.46,Pasti Pas Good,,"Jalur Fast Track, NFR, Produk JBU"
2025-05-17,2025-05-17,44-52229,IV,2025,"Jl. Raya Sitanggal, Kab. Brebes",Kab Brebes,DODO,SBM Tegal I Fuel,DAE,DAE,CERTIFIED,CERTIFIED,95.46,96.67,100.00,95.35,99.00,74.90,Pasti Pas Excellent,,
2025-05-17,2025-05-17,34-40310,III,2025,JL. Raya Cibiru No. 631,Kab Bandung,DODO,SBM Bandung II Fuel,DAE,DAE,CERTIFIED,CERTIFIED,95.06,96.67,100.00,90.10,98.00,82.40,Pasti Pas Excellent,,
2025-07-11,2025-05-17,34-40127,III,2025,Jl. Tamblong No. 3,Kota Bandung,DODO,SBM Bandung I Fuel,DAGE,DAE,CERTIFIED,CERTIFIED,93.66,96.33,100.00,86.67,100.00,74.10,Pasti Pas Excellent,,
2025-05-17,2025-05-17,34-16317,III,2025,Jl. Raya Serpong,Kab Bogor,DODO,SBM Jabode V Fuel,DAGE,DAGE,CERTIFIED,NOT CERTIFIED,93.93,98.33,100.00,90.95,98.00,64.40,Pasti Pas Good,,"Jalur Fast Track, NFR"
2025-05-17,2025-05-17,44-52217,IV,2025,"Jl. Raya Tonjong, Desa Kutamendala Kec. Tonjong",Kab Brebes,DODO,SBM Tegal I Fuel,DAGE,DAGE,CERTIFIED,NOT CERTIFIED,90.44,96.67,92.72,91.00,98.00,56.21,Pasti Pas Good,,"Produk JBU, NFR"
2025-07-02,2025-05-17,34-42109,III,2025,"Jl. Toll Tangerang Merak, Serang KM. 68",Kota Serang,DODO,SBM Banten II Fuel,TAGE3,DAGE,CERTIFIED,NOT CERTIFIED,91.85,96.67,100.00,86.54,99.00,56.00,Pasti Pas Good,,NFR
2025-05-17,2025-05-17,14-2826123,I,2025,Jl. Srikandi - Pekanbaru,Kota Pekanbaru,DODO,SBM Riau I Fuel,TAGE2,Re-CAE1,NOT CERTIFIED,NOT CERTIFIED,88.56,87.33,100.00,90.01,87.00,55.06,Basic,Izin Prinsip,"NFR, Izin Prinsip, Jalur Fast Track"
2025-05-17,2025-05-17,11-201107,I,2025,Jl. H.M. Yamin,Kota Medan,COCO,SBM Medan I Fuel,DAGE,DAGE,CERTIFIED,NOT CERTIFIED,94.6,95.33,100.00,98.69,100.00,62.60,Pasti Pas Good,,NFR
2025-05-17,2025-05-17,14-261580,I,2025,Jl. Raya Bukittinggi-Payakumbuh KM 10 Kab. Agam,Kab Agam,DODO,SBM Sumatera Barat I Fuel,TAGE1,TAGE2,CERTIFIED,NOT CERTIFIED,87.89,83.33,96.35,90.50,95.50,63.38,Pasti Pas Good,,"Rompi Khusus, NFR, Produk JBU"
2025-05-17,2025-05-17,44-52210,IV,2025,"Jl. Kemiriamba, Jatibarang - Brebes",Kab Brebes,DODO,SBM Tegal I Fuel,TAGE1,TAGE2,CERTIFIED,CERTIFIED,92.52,92.67,100.00,91.35,97.00,67.50,Pasti Pas Good,,
2025-05-18,2025-05-17,84-97504,VIII,2025,"Jl. Christina Marthatiahahu, Masohi",Kab Maluku Tengah,DODO,SBM Maluku I,DAGE,DAGE,CERTIFIED,NOT CERTIFIED,90.78,88.67,100.00,92.59,97.00,59.66,Pasti Pas Good,,NFR
2025-05-17,2025-05-17,44-57602,IV,2025,"Jl. Ry Baturetno- Surakarta Km.3 Talun Ombo, Baturetno",Kab Wonogiri,DODO,SBM Yogyakarta IV Fuel,DAG2,DAG3,CERTIFIED,NOT CERTIFIED,91.07,96.67,92.72,92.60,100.00,57.30,Pasti Pas Good,,NFR
2025-07-02,2025-05-17,34-15520,III,2025,"JL. RAYA IR. SUTAMI DESA PAGEDANGAN UDIK, KECAMATAN KRONJO KABUPATEN TANGERANG",Kab Tangerang,DODO,SBM Banten I Fuel,TAG1,TAG2,CERTIFIED,NOT CERTIFIED,84.21,81.67,92.33,88.14,91.50,52.28,Pasti Pas Good,,"Rompi Khusus, NFR, Produk JBU"
2025-06-17,2025-05-17,34-16304,III,2025,"Jl. Desa Parakan Jaya, Salabenda",Kab Bogor,DODO,SBM Jabode V Fuel,TAGE1,TAGE2,CERTIFIED,NOT CERTIFIED,87.5,84.67,100.00,88.62,83.50,60.46,Pasti Pas Good,,"Jalur Fast Track, NFR, Rompi Khusus"
2025-05-17,2025-05-17,74-90510,VII,2025,"Jl. Poros Makassar - Maros, Allepolea",Kab Maros,,SBM Sulselbar I Fuel,DAGE,DAGE,CERTIFIED,NOT CERTIFIED,89.67,94.00,93.06,90.55,92.50,61.90,Pasti Pas Good,,"Rompi Khusus, Jalur Fast Track, NFR"
2025-05-17,2025-05-17,44-56305,IV,2025,"Jl. Wonosobo-Banjarnegara, Selokromo Leksono",Kab Wonosobo,,SBM Semarang II Fuel,DAE,DAE,CERTIFIED,CERTIFIED,92.45,90.33,100.00,91.60,100.00,70.30,Pasti Pas Excellent,,
2025-05-17,2025-05-17,54-67141,V,2025,"Ds. Gading Kec. Winongan, Pasuruan",Kab Pasuruan,DODO,SBM Malang I Fuel,DAGE,DAGE,CERTIFIED,NOT CERTIFIED,90.24,96.67,100.00,88.25,95.50,40.36,Pasti Pas Good,,"NFR, Produk JBU"
2025-05-17,2025-05-17,34-16933,III,2025,"Jl. Tegar Beriman, Cibinong",Kab Bogor,DODO,SBM Jabode V Fuel,DAGE,DAGE,CERTIFIED,NOT CERTIFIED,92.02,94.00,100.00,93.35,100.00,51.54,Pasti Pas Good,,"Produk JBU, NFR"
2025-05-17,2025-05-17,34-40517,III,2025,Jl. Raya Citeureup No.69A,Kota Cimahi,DODO,SBM Bandung I Fuel,DAGE,DAGE,CERTIFIED,NOT CERTIFIED,90.38,96.67,100.00,91.60,78.00,52.56,Pasti Pas Good,,"Jalur Fast Track, Produk JBU, NFR"
2025-05-16,2025-05-16,24-301192,II,2025,Jl. Jaksa Agung R. Soeprapto,Kota Palembang,DODO,SBM Sumsel I Fuel,DAE,DAE,CERTIFIED,CERTIFIED,94.25,95.33,99.09,92.36,97.00,77.40,Pasti Pas Excellent,,
2025-05-16,2025-05-16,24-333143,II,2025,"Jl. Raya Kedondong, Kec Parit Tiga Jebus",Kab Bangka Barat,DODO,SBM Babel I,DAGE,DAGE,CERTIFIED,NOT CERTIFIED,91.25,97.67,99.04,91.65,98.00,41.06,Pasti Pas Good,,"Produk JBU, NFR"
2025-05-16,2025-05-16,44-55611,IV,2025,JL. RAYA PENGASIH DS. PENGASIH KEC.,Kab Kulon Progo,DODO,SBM Yogyakarta I Fuel,DAGE,DAGE,CERTIFIED,NOT CERTIFIED,93.06,96.67,100.00,92.80,95.00,59.96,Pasti Pas Good,,"NFR, Jalur Fast Track, Produk JBU"
2025-05-16,2025-05-16,44-57604,IV,2025,"Jl. Wonogiri - Ngadirojo, Ngadirojo",Kab Wonogiri,DODO,SBM Yogyakarta IV Fuel,DAGE,DAGE,CERTIFIED,NOT CERTIFIED,93.37,96.67,100.00,92.60,98.00,60.46,Pasti Pas Good,,NFR
2025-05-16,2025-05-16,34-16316,III,2025,JL Parung Panjang,Kab Bogor,DODO,SBM Jabode V Fuel,TAGE3,DAGE,CERTIFIED,NOT CERTIFIED,92.97,100.00,100.00,97.90,95.50,38.44,Pasti Pas Good,,"Produk JBU, Rompi Khusus, Jalur Fast Track, NFR"
2025-05-16,2025-05-16,24-37181,II,2025,JL. LINTAS SUNGAI PENUH-PADANG DESA PENGKOLAN DUA,Kab Kerinci,DODO,SBM Jambi II Fuel,DAGE,DAGE,CERTIFIED,NOT CERTIFIED,90.93,98.33,92.33,94.59,96.00,52.06,Pasti Pas Good,,"Produk JBU, NFR, Jalur Fast Track"
2025-07-02,2025-05-16,54-63402,V,2025,Jl. Trunojoyo 157,Kab Ponorogo,DODO,SBM Kediri III Fuel,DAGE,DAGE,CERTIFIED,NOT CERTIFIED,88.07,85.00,100.00,91.24,95.00,48.03,Pasti Pas Good,,"Produk JBU, NFR"
2025-05-16,2025-05-16,54-60252,V,2025,Jl. Rungkut Industri Raya No.10A,Kota Surabaya,DODO,SBM Surabaya I Fuel,DAGE,DAGE,CERTIFIED,NOT CERTIFIED,88.27,81.33,100.00,91.00,95.00,61.67,Pasti Pas Good,,"Produk JBU, Jalur Fast Track, NFR"
2025-06-17,2025-05-16,54-63413,V,2025,Jl. Raya Badegan Ds. Karang Waluh Kec. Sampung,Kab Ponorogo,DODO,SBM Kediri III Fuel,TAGE1,Re-CAE1,NOT CERTIFIED,NOT CERTIFIED,83.91,91.00,92.72,71.55,96.00,48.86,Basic,,"Produk JBU, Jalur Fast Track, NFR"
2025-05-16,2025-05-16,64-70202,VI,2025,"Jl. Ahmad Yani km 6,00, Banjarmasin, Kalimantan Selatan",Kota Banjarmasin,DODO,SBM Kalsel I Fuel,DAGE,TAGE1,NOT CERTIFIED,NOT CERTIFIED,83.22,70.67,100.00,87.40,97.00,48.36,Pasti Pas Good,PELUMAS,"Jalur Fast Track, NFR, Produk JBU, PELUMAS"
2025-05-16,2025-05-16,54-60112,V,2025,Jl. Tambak Oso Wilangun No.45,Kota Surabaya,DODO,SBM Surabaya I Fuel,DAGE,DAGE,CERTIFIED,NOT CERTIFIED,91.53,89.00,100.00,89.85,100.00,68.35,Pasti Pas Good,,"Produk JBU, NFR"
2025-05-16,2025-05-16,54-60179,V,2025,Jl. Kayoon No. 48,Kota Surabaya,,SBM Surabaya I Fuel,TAGE2,Re-CAE1,NOT CERTIFIED,NOT CERTIFIED,74.41,74.33,88.15,64.56,85.50,42.17,Basic,Masa Berlaku APAR,"NFR, Jalur Fast Track, Rompi Khusus, Masa Berlaku APAR, Produk JBU"
2025-06-12,2025-05-16,14-251510,I,2025,Jl. Proof Dr Hamka Tabing,Kota Padang,DODO,SBM Sumatera Barat I Fuel,DAGE,DAGE,CERTIFIED,NOT CERTIFIED,91.33,86.67,100.00,94.81,98.00,65.60,Pasti Pas Good,,"Jalur Fast Track, NFR"
2025-05-17,2025-05-16,14-243427,I,2025,"Jln. Lintas Aceh - Medan, Kec. Jeumpa",Kab Bireun,,SBM Aceh II Fuel,DAG2,DAG3,CERTIFIED,NOT CERTIFIED,91.6,91.33,96.35,95.77,98.00,63.38,Pasti Pas Good,,"NFR, Jalur Fast Track, Produk JBU"
2025-06-16,2025-05-16,34-46134,III,2025,jl Raya Bandung Tasikmalaya KM 81 Ds Pamoyanan Kec. Kadipaten Kab. Tasikmalaya,Kab Tasikmalaya,DODO,SBM Bandung IV Fuel,TAGE1,Re-CAE1,NOT CERTIFIED,NOT CERTIFIED,84.5,96.67,90.13,73.40,78.00,59.80,Basic,,"NFR, Jalur Fast Track"
2025-05-16,2025-05-16,34-16312,III,2025,Jl. Parung Panjang,Kab Bogor,DODO,SBM Jabode V Fuel,TAGE2,TAGE3,CERTIFIED,NOT CERTIFIED,93.13,97.33,100.00,94.90,98.00,51.46,Pasti Pas Good,,"Jalur Fast Track, NFR, Produk JBU"
2025-06-17,2025-05-16,34-16705,III,2025,JL Cipayung Raya Pd Rajeg,Kab Bogor,DODO,SBM Jabode V Fuel,TAGE2,Re-CAE1,NOT CERTIFIED,NOT CERTIFIED,85.07,95.33,87.63,84.96,80.50,51.46,Basic,,"Rompi Khusus, NFR"
2025-05-16,2025-05-16,34-17542,III,2025,Jl. Karang Satria Tambun Utara,Kab Bekasi,DODO,SBM Karawang I Fuel,TAGE2,TAGE3,CERTIFIED,NOT CERTIFIED,91.8,100.00,92.33,90.25,98.00,62.50,Pasti Pas Good,,"NFR, Jalur Fast Track"
2025-05-16,2025-05-16,44-57723,IV,2025,"Kaliwuluh, Grompol Karanganyar    ",Kab Karanganyar,DODO,SBM Yogyakarta IV Fuel,DAG3,DAGE,CERTIFIED,NOT CERTIFIED,89.06,84.67,100.00,91.36,95.00,58.76,Pasti Pas Good,,"Produk JBU, NFR, Jalur Fast Track"
2025-05-16,2025-05-16,84-97507,VIII,2025,Jl. Raya Desa Wainenat Kec. Waeapo,Kab Buru,DODO,SBM Maluku II,DAGE,DAGE,CERTIFIED,NOT CERTIFIED,91,93.33,92.72,94.70,99.00,63.44,Pasti Pas Good,,"Produk JBU, NFR"
2025-05-16,2025-05-16,44-52123,IV,2025,"Jl. Dr. Cipto Mangunkusumo, Kel. Sumurpanggang, Kec. Margadana",Kota Tegal,DODO,SBM Tegal I Fuel,TAGE3,DAGE,CERTIFIED,NOT CERTIFIED,89.86,88.67,100.00,88.19,95.00,61.00,Pasti Pas Good,,"NFR, Jalur Fast Track"
2025-05-16,2025-05-16,44-57716,IV,2025,"Jl. Solo - Sragen, Kemiri Kebakramat",Kab Karanganyar,DODO,SBM Yogyakarta IV Fuel,DAGE,DAGE,CERTIFIED,NOT CERTIFIED,89.14,89.33,99.04,89.50,90.00,57.30,Pasti Pas Good,,"NFR, Jalur Fast Track"
2025-07-02,2025-05-16,74-90109,VII,2025,Jl. Andalas,Kota Makassar,,SBM Sulselbar I Fuel,DAGE,DAGE,CERTIFIED,NOT CERTIFIED,88.02,87.33,92.72,92.60,87.50,67.40,Pasti Pas Good,,"Rompi Khusus, Jalur Fast Track"
2025-05-16,2025-05-16,64-78118,VI,2025,Jl Hasanudin,Kota Pontianak,,SBM Kalbar I Fuel,TAGE1,TAGE2,CERTIFIED,NOT CERTIFIED,89.46,88.33,99.04,94.15,98.00,46.13,Pasti Pas Good,,"NFR, Jalur Fast Track, Produk JBU"
2025-05-16,2025-05-16,44-52128,IV,2025,Jl. Gatot Subroto No. 37,Kota Tegal,DODO,SBM Tegal I Fuel,TAG2,TAG3,CERTIFIED,NOT CERTIFIED,87.49,85.00,92.72,91.38,97.00,60.70,Pasti Pas Good,,NFR
2025-05-16,2025-05-16,34-45160,III,2025,"Jl. Tol Palimanan-Kanci, Rest Area 226A, Cirebon",Kab Cirebon,DODO,SBM Cirebon I Fuel,TAG1,TAG2,CERTIFIED,NOT CERTIFIED,90.07,96.67,86.76,88.60,98.00,75.20,Pasti Pas Good,,NFR
2025-05-16,2025-05-16,34-16411,III,2025,"Jl. R.A Kartini No. 7, Pancoranmas",Kota Depok,DODO,SBM Jabode III Fuel,TAGE1,TAGE2,CERTIFIED,CERTIFIED,93.08,96.00,100.00,89.60,100.00,63.56,Pasti Pas Good,,
2025-05-16,2025-05-16,34-14101,III,2025,Jl.Tipar Cakung Suka Pura N0. 48,Kota Jakarta Utara,DODO,SBM Jabode II Fuel,TAGE3,DAGE,CERTIFIED,NOT CERTIFIED,93.4,96.00,100.00,99.00,100.00,48.04,Pasti Pas Good,,"Produk JBU, NFR"
2025-05-16,2025-05-16,24-35468,II,2025,"Jl. Raya Trans Sumatra, Tanjung Agung",Kab Lampung Selatan,DODO,SBM Lampung I Fuel,DAGE,DAGE,CERTIFIED,NOT CERTIFIED,90.55,99.00,100.00,87.89,88.50,44.26,Pasti Pas Good,,"Rompi Khusus, NFR"
2025-07-10,2025-05-16,64-77308,VI,2025,Jl. Marsma Iswahyudi Rinding Teluk Bayur Tanjung Redeb,Kab Berau,,SBM Kaltimut III Fuel,DAE,DAGE,CERTIFIED,NOT CERTIFIED,89.28,87.33,100.00,89.50,94.50,57.26,Pasti Pas Good,,"Jalur Fast Track, Rompi Khusus, Produk JBU, NFR"
2025-06-16,2025-05-16,34-40341,III,2025,Jl. Raya Majalaya Ibun Desa Cibeet ,Kab Bandung,DODO,SBM Bandung II Fuel,TAGE1,TAGE2,CERTIFIED,NOT CERTIFIED,92.04,97.33,100.00,92.00,91.00,53.40,Pasti Pas Good,,"NFR, Jalur Fast Track"
2025-05-16,2025-05-16,34-15320,III,2025,Jl. Graha Raya Utama,Kota Tangerang Sel.,DODO,SBM Banten I Fuel,TAGE1,Re-CAE1,NOT CERTIFIED,NOT CERTIFIED,83.79,82.00,85.05,90.20,97.00,59.38,Basic,Trims,"NFR, Trims"
2025-05-16,2025-05-16,34-15424,III,2025,Jl. Raya Tegal Rotan,Kota Tangerang Sel.,DODO,SBM Banten I Fuel,DAGE,DAGE,CERTIFIED,NOT CERTIFIED,88.15,94.00,88.88,91.60,95.00,54.61,Pasti Pas Good,,"Produk JBU, NFR, Jalur Fast Track"
2025-05-16,2025-05-16,44-55710,IV,2025,"Jl. Raya Wates km.11, Sedayu",Kab Bantul,DODO,SBM Yogyakarta I Fuel,DAE,DAE,CERTIFIED,CERTIFIED,93.95,96.67,100.00,91.30,100.00,66.90,Pasti Pas Excellent,,
2025-07-02,2025-05-16,74-90230,VII,2025,Jl. Ir. Sutami,Kota Makassar,,SBM Sulselbar I Fuel,DAGE,DAGE,CERTIFIED,NOT CERTIFIED,86.7,88.33,100.00,88.64,80.00,44.86,Pasti Pas Good,,"NFR, Jalur Fast Track, Produk JBU"
2025-07-02,2025-05-16,54-65168,V,2025,Jl. Ampeldento Pakis-Malang,Kab Malang,,SBM Malang I Fuel,DAE,DAE,CERTIFIED,CERTIFIED,90.55,90.33,99.09,89.15,85.00,73.81,Pasti Pas Excellent,,
2025-07-02,2025-05-16,34-40245,III,2025,Jl. Komp. Taman Kopo Indah II,Kab Bandung,DODO,SBM Bandung II Fuel,DAE,DAE,CERTIFIED,CERTIFIED,95.27,98.67,100.00,88.75,98.00,81.20,Pasti Pas Excellent,,
2025-07-01,2025-05-16,34-42138,III,2025,JL.Raya sawah luhur no.5 kel. Warung jaud kec.kasemen kota serang,Kota Serang,DODO,SBM Banten II Fuel,DAGE,DAGE,CERTIFIED,NOT CERTIFIED,91.25,93.33,100.00,88.18,95.00,61.08,Pasti Pas Good,,"Produk JBU, NFR, Jalur Fast Track"
2025-05-16,2025-05-16,54-60173,V,2025,Jl. Raya Pakal No.104 Kec.Pakal,Kota Surabaya,,SBM Surabaya I Fuel,DAGE,DAGE,CERTIFIED,NOT CERTIFIED,89.3,88.00,100.00,90.73,96.00,51.37,Pasti Pas Good,,"NFR, Produk JBU"
2025-05-16,2025-05-16,34-40258,III,2025,Jl. Cibolerang,Kota Bandung,DODO,SBM Bandung I Fuel,TAGE1,TAGE2,CERTIFIED,NOT CERTIFIED,90.11,90.00,100.00,91.60,95.00,52.91,Pasti Pas Good,,"Produk JBU, Jalur Fast Track, NFR"
2025-05-16,2025-05-16,54-61122,V,2025,Jl. Raya Menganti Sidowungu Gresik,Kab Gresik,,SBM Surabaya III Fuel,DAGE,TAGE1,NOT CERTIFIED,NOT CERTIFIED,91.44,94.00,100.00,88.30,98.00,57.83,Pasti Pas Good,Masa Berlaku APAR,"NFR, Produk JBU, Masa Berlaku APAR"
2025-05-16,2025-05-16,34-42134,III,2025,"Jl. Raya Palka no. 184, Kadubereum, Pabuaran, Serang - Banten",Kab Serang,DODO,SBM Banten II Fuel,DAGE,TAGE1,NOT CERTIFIED,NOT CERTIFIED,91.69,95.33,100.00,90.98,98.00,50.96,Pasti Pas Good,Izin Prinsip,"Izin Prinsip, Produk JBU, NFR"
2025-05-16,2025-05-16,24-35240,II,2025,"Jl. Alamsyah Ratu Prawira Negara, Srengsem",Kota Bandar Lampung,DODO,SBM Lampung I Fuel,DAGE,DAGE,CERTIFIED,NOT CERTIFIED,88.68,92.67,100.00,88.18,79.50,52.31,Pasti Pas Good,,"Rompi Khusus, Produk JBU, NFR, Jalur Fast Track"
2025-05-16,2025-05-16,34-16930,III,2025,Jl. Dedi Kusmayadi Cibinong,Kab Bogor,DODO,SBM Jabode V Fuel,DAGE,DAGE,CERTIFIED,NOT CERTIFIED,94.47,97.67,100.00,96.63,95.00,63.41,Pasti Pas Good,,Produk JBU
2025-05-16,2025-05-16,44-52227,IV,2025,Jl Raya Sitanggal,Kab Brebes,DODO,SBM Tegal I Fuel,DAGE,DAGE,CERTIFIED,NOT CERTIFIED,89.02,95.33,88.88,89.21,98.00,60.96,Pasti Pas Good,,"Produk JBU, NFR, Jalur Fast Track"
2025-05-16,2025-05-16,34-40233,III,2025,JL. Bojong Raya (Holis),Kota Bandung,DODO,SBM Bandung I Fuel,DAGE,DAGE,CERTIFIED,NOT CERTIFIED,90.07,93.33,100.00,90.30,92.50,47.64,Pasti Pas Good,,"NFR, Produk JBU, Jalur Fast Track, Rompi Khusus"
2025-07-02,2025-05-16,54-83206,V,2025,Jl. Prabu Rangkasari Ds. Cermen Kec. Cakranegara,Kota Mataram,DODO,SBM NTB I Fuel,TAG3,DAG1,CERTIFIED,NOT CERTIFIED,87.64,85.00,96.35,89.05,96.00,58.26,Pasti Pas Good,,"NFR, Produk JBU, Jalur Fast Track"
2025-05-16,2025-05-16,44-55705,IV,2025,Jl. Imogiri Timur Km. 13,Kab Bantul,DODO,SBM Yogyakarta I Fuel,DAE,DAE,CERTIFIED,CERTIFIED,89.87,96.67,86.13,86.90,97.00,79.51,Pasti Pas Excellent,,
2025-05-16,2025-05-16,44-55118,IV,2025,"Jl. Raya Parangtritis KM 5,5",Kab Bantul,DODO,SBM Yogyakarta I Fuel,DAGE,DAGE,CERTIFIED,NOT CERTIFIED,91.48,96.67,100.00,88.13,97.00,51.31,Pasti Pas Good,,Produk JBU
2025-05-16,2025-05-16,44-53102,IV,2025,Jl. Raya Sumpiuh Kradenan Sumpiuh,Kab Banyumas,DODO,SBM Tegal III Fuel,DAE,DAE,CERTIFIED,CERTIFIED,96.75,96.67,100.00,94.90,100.00,87.70,Pasti Pas Excellent,,
2025-05-16,2025-05-16,44-55601,IV,2025,"Jl. Yogya-Wates, Malayan, Sentolo",Kab Kulon Progo,DODO,SBM Yogyakarta I Fuel,DAGE,DAGE,CERTIFIED,NOT CERTIFIED,93.65,100.00,100.00,93.03,96.00,54.44,Pasti Pas Good,,"NFR, Jalur Fast Track, Produk JBU"
