send_date,Audit Date,spbu_no,region,year,address,city_name,tipe_spbu,rayon,audit_level,audit_next,good_status,excellent_status,Total Score,SSS,EQnQ,RFS,VFC,EPO,kelas_spbu,penalty_good_alerts,penalty_excellent_alerts
2025-07-02,2025-05-23,44-57116,IV,2025,"JL. Sumpah Pemuda No. 198, Mojosongo",Kota Surakarta,DODO,SBM Yogyakarta III Fuel,DAGE,DAGE,CERTIFIED,NOT CERTIFIED,90.22,96.67,92.72,90.69,94.00,58.66,Pasti Pas Good,,"NFR, Produk JBU"
2025-05-28,2025-05-23,21-35105,II,2025,"Jl. Hasanudin, Teluk Betung Selatan",Kota Bandar Lampung,COCO,SBM Lampung I Fuel,TAGE1,TAGE2,CERTIFIED,CERTIFIED,96.65,100.00,100.00,98.87,100.00,68.70,Pasti Pas Good,,
2025-05-28,2025-05-23,34-17507,III,2025,Jl. Fatahillah No. 59 Cikarang Barat,Kab Bekasi,DODO,SBM Karawang I Fuel,TAGE1,TAGE2,CERTIFIED,CERTIFIED,95.52,97.33,100.00,97.50,100.00,68.18,Pasti Pas Good,,
2025-05-28,2025-05-23,54-61425,V,2025,"Ds. Selorejo - Mojowarno, Jombang",Kab Jombang,DODO,SBM Surabaya II Fuel,DAGE,DAGE,CERTIFIED,NOT CERTIFIED,92.49,98.67,100.00,89.24,100.00,50.40,Pasti Pas Good,,"Produk JBU, NFR"
2025-06-20,2025-05-23,84-98103,VIII,2025,Jl. Sriwijaya Ridge II Kab Biak,Kab. Biak Numfor,DODO,SBM Papua II,TAG1,Re-CA1,NOT CERTIFIED,NOT CERTIFIED,78.55,92.89,61.67,84.74,96.00,56.46,Basic,,"Jalur Fast Track, NFR"
2025-05-28,2025-05-23,34-44121,III,2025,Jl. Pembangunan Desa Suka,Kab Garut,DODO,SBM Bandung III Fuel,TAGE1,Re-CAE1,NOT CERTIFIED,NOT CERTIFIED,84.81,90.00,85.43,81.90,88.00,70.00,Basic,,"Jalur Fast Track, NFR"
2025-05-23,2025-05-23,34-16406,III,2009,Jl. Raya Desa Kemiri Muka,Kota Depok,DODO,SBM Jabode III Fuel,Re-CAE1,TAGE1,CERTIFIED,NOT CERTIFIED,86.7,81.56,98.17,94.25,95.50,46.16,Pasti Pas Good,,"NFR, Rompi Khusus, Jalur Fast Track, Produk JBU"
2025-05-28,2025-05-23,34-16610,III,2025,Jl. Raya Cigudeg Desa Bunar,Kab Bogor,DODO,SBM Jabode V Fuel,TAGE1,Re-CAE1,NOT CERTIFIED,NOT CERTIFIED,70.71,86.67,55.25,76.73,82.50,45.60,Basic,,"Rompi Khusus, NFR, Produk JBU"
2025-05-29,2025-05-23,44-55523,IV,2025,"Semampir kulon, Tempel, Sleman",Kab Sleman,DODO,SBM Yogyakarta I Fuel,DAGE,DAGE,CERTIFIED,NOT CERTIFIED,92.1,96.67,100.00,93.34,95.00,49.16,Pasti Pas Good,,"NFR, Jalur Fast Track"
2025-05-29,2025-05-23,64-74201,VI,2025,Jln. Jend Sudirman Km.104 Desa Rungau Kec.Danau Sembuluh,Kab Seruyan,DODO,SBM Kalteng II Fuel,TAGE3,DAGE,CERTIFIED,NOT CERTIFIED,90.27,89.33,100.00,96.06,96.00,46.46,Pasti Pas Good,,"Produk JBU, Jalur Fast Track, NFR"
2025-05-28,2025-05-23,34-43205,III,2025,JL. Raya Bandung Bojong,Kab Cianjur,DODO,SBM Sukabumi I Fuel,DAE,DAGE,CERTIFIED,NOT CERTIFIED,90.11,84.67,98.17,90.64,96.00,75.41,Pasti Pas Good,,Jalur Fast Track
2025-06-16,2025-05-23,34-45522,III,2025,Jl Veteran Kab Kuningan,Kab Kuningan,DODO,SBM Cirebon I Fuel,DAE,DAE,CERTIFIED,CERTIFIED,89.82,90.67,92.15,91.04,90.00,77.40,Pasti Pas Excellent,,
2025-06-26,2025-05-23,14-294745,I,2025,"Jl. Letjen Suprapto, Simpang Dam",Kota Batam,DODO,SBM Kepulauan Riau I Fuel,DAE,DAE,CERTIFIED,CERTIFIED,94.58,96.67,100.00,91.03,100.00,73.81,Pasti Pas Excellent,,
2025-05-28,2025-05-23,34-16704,III,2025,Jl. Tol Jagorawi - Bogor,Kab Bogor,DODO,SBM Jabode V Fuel,TAGE2,TAGE3,CERTIFIED,NOT CERTIFIED,93.61,95.33,100.00,96.70,90.00,66.72,Pasti Pas Good,,NFR
2025-05-29,2025-05-23,74-95102,VII,2025,Jl.Malalayang II,Kota Manado,DODO,SBM Sulutgo I Fuel,DAGE,DAGE,CERTIFIED,NOT CERTIFIED,89.97,93.33,99.04,90.55,93.00,48.48,Pasti Pas Good,,"NFR, Jalur Fast Track"
2025-05-29,2025-05-23,44-52301,IV,2025,Jl. Raya Ulujami,Kab Pemalang,DODO,SBM Tegal II Fuel,DAGE,TAGE1,NOT CERTIFIED,NOT CERTIFIED,84.1,82.67,88.88,88.40,97.00,52.56,Pasti Pas Good,DU Dispenser,"DU Dispenser, Produk JBU, NFR"
2025-07-02,2025-05-23,51-63222,V,2025,Rest Area Ruas Tol Trans Jawa KM 575 A,Kab Ngawi,,SBM Kediri III Fuel,DAGE,DAGE,CERTIFIED,NOT CERTIFIED,88.89,96.67,86.76,87.72,95.00,67.10,Pasti Pas Good,,NFR
2025-05-28,2025-05-23,14-2031117,I,2025,"Jl. Binjai, Sei Semayang",Kab Deli Serdang,DODO,SBM Medan II Fuel,TAGE3,DAGE,CERTIFIED,NOT CERTIFIED,96.51,95.33,100.00,99.50,98.00,82.10,Pasti Pas Good,,NFR
2025-05-26,2025-05-23,54-69413,V,2025,Ds. Ketawang Karay Kec. Gading Kab. Sumenep,Kab Sumenep,DODO,SBM Surabaya IV Fuel,TAGE1,Re-CAE1,NOT CERTIFIED,NOT CERTIFIED,62.28,55.56,63.97,77.25,80.50,37.36,Basic,,"Rompi Khusus, NFR, Jalur Fast Track, Produk JBU"
2025-05-27,2025-05-23,34-14201,III,2025,Jl. Boulevard Barat Kelapa Gading,Kota Jakarta Utara,DODO,SBM Jabode II Fuel,DAE,DAE,CERTIFIED,CERTIFIED,96.77,94.33,100.00,97.85,100.00,89.00,Pasti Pas Excellent,,
2025-05-28,2025-05-23,34-14208,III,2025,Jl. Bulevard Artha Gading Blok A3 N0: 3,Kota Jakarta Utara,DODO,SBM Jabode II Fuel,DAGE,DAGE,CERTIFIED,NOT CERTIFIED,96.82,97.33,100.00,99.60,98.00,79.00,Pasti Pas Good,,Jalur Fast Track
2025-05-28,2025-05-23,34-41106,III,2025,Jl. Cikumpay-Campaka,Kab Purwakarta,DODO,SBM Karawang III Fuel,TAGE3,DAGE,CERTIFIED,NOT CERTIFIED,91.41,93.67,100.00,94.80,83.00,60.46,Pasti Pas Good,,"NFR, Jalur Fast Track"
2025-05-28,2025-05-23,34-45153,III,2025,Jl. Babakan,Kab Cirebon,DODO,SBM Cirebon I Fuel,TAGE1,Re-CAE1,NOT CERTIFIED,NOT CERTIFIED,84.04,87.00,86.28,87.15,95.00,51.30,Basic,Produk JBU,"Produk JBU, NFR, Jalur Fast Track"
2025-05-24,2025-05-23,34-15705,III,2025,"Jl. Pasir Gadung, Cikupa",Kab Tangerang,DODO,SBM Banten I Fuel,TAGE1,TAGE2,CERTIFIED,NOT CERTIFIED,85.86,86.00,93.06,90.76,97.00,42.85,Pasti Pas Good,,"NFR, Produk JBU, Jalur Fast Track"
2025-05-29,2025-05-23,74-93523,VII,2025,"Jalan Bypass Kolaka-Pomala, Wundulako, Kab. Kolaka",Kab Kolaka,DODO,SBM Sultra III Fuel,DAGE,DAGE,CERTIFIED,NOT CERTIFIED,92.48,96.67,96.35,93.20,95.50,63.80,Pasti Pas Good,,Rompi Khusus
2025-05-28,2025-05-23,14-282608,I,2025,Jl.Arengka - Pekanbaru,Kota Pekanbaru,DODO,SBM Riau I Fuel,TAGE1,TAGE2,CERTIFIED,NOT CERTIFIED,83.91,82.33,93.06,91.20,87.00,43.01,Pasti Pas Good,,NFR
2025-05-23,2025-05-23,54-61403,V,2025,JL. YOS SUDARSO,Kab Jombang,DODO,SBM Surabaya II Fuel,Re-CA1,Re-CA2,NOT CERTIFIED,NOT CERTIFIED,11.61,0.00,0.00,28.91,43.00,15.50,Basic,"HP, Salam, DU Dispenser, Nol, Trims, APAB, Masa Berlaku APAR, Jalur Fast Track, Produk JBU, Izin Prinsip, PELUMAS","HP, Salam, Rompi Khusus, DU Dispenser, Nol, Trims, APAB, Masa Berlaku APAR, Jalur Fast Track, Produk JBU, Izin Prinsip, NFR, PELUMAS"
2025-05-28,2025-05-23,34-42408,III,2025,Jl. Raya Akses Tol Jakarta Merak Cikuasa,Kota Cilegon,DODO,SBM Banten II Fuel,TAGE1,Re-CAE1,NOT CERTIFIED,NOT CERTIFIED,87.82,96.67,100.00,81.45,78.00,47.21,Basic,,"Produk JBU, NFR, Jalur Fast Track"
2025-05-29,2025-05-23,54-67203,V,2025,Jl. KH. Genggong No. 121 Probolinggo,Kota Probolinggo,,SBM Malang II Fuel,DAE,DAE,CERTIFIED,CERTIFIED,91.89,93.33,93.38,91.70,98.00,77.40,Pasti Pas Excellent,,
2025-05-27,2025-05-23,34-17518,III,2025,"Jl.Raya Mustika Jaya, Kec Mustika Jaya",Kab Bekasi,DODO,SBM Karawang I Fuel,Re-CAE1,TAGE1,CERTIFIED,NOT CERTIFIED,88.61,87.89,92.70,87.65,87.50,69.87,Pasti Pas Good,,Rompi Khusus
2025-05-29,2025-05-23,44-50227,IV,2025,JL. MAYJEN SUTOYO/ D. I PANJAITAN,Kota Semarang,DODO,SBM Semarang I Fuel,TAG1,TAG2,CERTIFIED,NOT CERTIFIED,92.66,96.67,93.06,94.19,98.00,71.00,Pasti Pas Good,,NFR
2025-05-23,2025-05-23,34-45145,III,2009,Jl. Rajawali No.7,Kota Cirebon,DODO,SBM Cirebon I Fuel,Re-CAE1,Re-CAE2,NOT CERTIFIED,NOT CERTIFIED,74.22,75.00,84.21,85.15,60.50,34.83,Basic,,"Jalur Fast Track, Produk JBU, NFR"
2025-06-16,2025-05-23,24-311194,II,2025,Jl. Padat Karya No. 108 Kel. Gunung Ibul Kel. Prabumulih Timur,Kota Prabumulih,DODO,SBM Sumsel III Fuel,DAGE,DAE,CERTIFIED,CERTIFIED,90.95,92.00,92.72,91.66,97.00,74.90,Pasti Pas Excellent,,
2025-05-29,2025-05-23,44-55213,IV,2025,Jl. Babarsari Kledokan Catur tunggal,Kab Sleman,DODO,SBM Yogyakarta I Fuel,TAG1,TAG2,CERTIFIED,NOT CERTIFIED,93.52,97.33,100.00,92.10,100.00,58.96,Pasti Pas Good,,"NFR, Produk JBU"
2025-06-12,2025-05-23,44-50714,IV,2025,Jl. Patimura No. 63 Bringin,Kota Salatiga,DODO,SBM Semarang I Fuel,TAGE3,DAGE,CERTIFIED,NOT CERTIFIED,91.38,91.67,100.00,92.60,88.00,65.60,Pasti Pas Good,,NFR
2025-05-28,2025-05-23,34-40227,III,2025,Jl. Terusan Tol Pasir Koja,Kota Bandung,DODO,SBM Bandung I Fuel,DAE,DAE,CERTIFIED,CERTIFIED,93.15,91.67,100.00,92.90,100.00,70.70,Pasti Pas Excellent,,
2025-05-28,2025-05-23,34-45317,III,2025,"Jl. Raya Tomo Sumedang-Kadipaten KM. 32,2",Kab Sumedang,DODO,SBM Bandung III Fuel,DAGE,DAGE,CERTIFIED,NOT CERTIFIED,91.19,95.33,100.00,93.00,92.00,47.86,Pasti Pas Good,,"NFR, Produk JBU"
2025-06-25,2025-05-23,24-34112,II,2025,Jl. Raya Proklamator Bandar Jaya.,Kab Lampung Tengah,DODO,SBM Lampung II Fuel,DAGE,DAGE,CERTIFIED,NOT CERTIFIED,84.75,81.67,100.00,85.23,75.50,56.33,Pasti Pas Good,,"Rompi Khusus, Jalur Fast Track"
2025-05-29,2025-05-23,44-57434,IV,2025,"Jl. Mayor Kusmanto No. 40 semangkak, klaten tengah, Klaten",Kab Klaten,DODO,SBM Yogyakarta III Fuel,DAGE,DAGE,CERTIFIED,NOT CERTIFIED,91.39,96.00,99.09,88.10,93.00,59.28,Pasti Pas Good,,"Produk JBU, NFR"
2025-05-29,2025-05-23,54-64113,V,2025,Dusun Bondo Kec. Wates Kab. Kediri,Kab Kediri,,SBM Kediri I Fuel,DAGE,DAGE,CERTIFIED,NOT CERTIFIED,89.51,90.33,100.00,88.55,98.00,48.96,Pasti Pas Good,,"Produk JBU, NFR"
2025-07-02,2025-05-23,34-15414,III,2025,"Jl. Terbang Layang No.97, Pondok Cabe",Kota Tangerang Sel.,DODO,SBM Banten I Fuel,TAGE1,TAGE2,CERTIFIED,NOT CERTIFIED,87.88,90.33,93.38,88.90,95.00,54.90,Pasti Pas Good,,"Jalur Fast Track, NFR"
2025-06-16,2025-05-23,74-91602,VII,2025,"Jl. AP. Pettarani, Kel. Lalebata Kec. Panca Rijang",Kab Sidrap,,SBM Sulselbar III Fuel,DAGE,DAGE,CERTIFIED,NOT CERTIFIED,90.5,96.44,93.38,89.04,95.00,62.58,Pasti Pas Good,,"Produk JBU, NFR, Jalur Fast Track"
2025-06-25,2025-05-23,54-80319,V,2025,Jl. Raya Kunti Sunset Road,Kab Badung,DODO,SBM Bali II Fuel,DAE,DAE,CERTIFIED,CERTIFIED,95.89,96.67,100.00,93.95,100.00,80.93,Pasti Pas Excellent,,
2025-05-29,2025-05-23,44-53408,IV,2025,Jl. Letjen Soeprapto No. 223 Kel. Wangon,Kab Banjarnegara,DODO,SBM Tegal IV Fuel,DAE,DAE,CERTIFIED,CERTIFIED,94.63,96.67,100.00,94.00,98.00,70.30,Pasti Pas Excellent,,
2025-05-29,2025-05-23,54-66126,V,2025,Jl. Raya Garum Ds. Bence Garum,Kab Blitar,,SBM Kediri II Fuel,DAGE,DAGE,CERTIFIED,NOT CERTIFIED,91.48,88.33,100.00,92.10,98.00,67.60,Pasti Pas Good,,NFR
2025-05-29,2025-05-23,44-57120,IV,2025,"Jl. Ki Mangun Sarkoro No.119 B, Sumber",Kota Surakarta,DODO,SBM Yogyakarta III Fuel,DAGE,DAGE,CERTIFIED,NOT CERTIFIED,86.82,92.67,86.13,90.50,94.00,56.86,Pasti Pas Good,,"NFR, Produk JBU"
2025-05-29,2025-05-22,64-78305,VI,2025,Jl Adi Sucipto KM 14 Sungai Raya,Kab Kubu Raya,,SBM Kalbar I Fuel,DAGE,DAGE,CERTIFIED,NOT CERTIFIED,93.84,98.67,100.00,94.64,98.00,55.16,Pasti Pas Good,,"Produk JBU, NFR, Jalur Fast Track"
2025-05-28,2025-05-22,54-601101,V,2025,Jl. Raya Banjar Sugihan No.1-2,Kota Surabaya,DODO,SBM Surabaya I Fuel,DAGE,DAGE,CERTIFIED,NOT CERTIFIED,89.14,84.67,100.00,90.77,96.00,59.86,Pasti Pas Good,,"NFR, Jalur Fast Track, Produk JBU"
2025-05-28,2025-05-22,14-261530,I,2025,Jl Soekarno Hatta Garegeh Bukittinggi,Kota Bukit Tinggi,DODO,SBM Sumatera Barat II Fuel,TAGE1,TAGE2,CERTIFIED,CERTIFIED,88,86.67,93.06,92.90,95.00,60.00,Pasti Pas Good,,
2025-07-02,2025-05-22,34-16608,III,2025,Jl.Raya Sadeng ds Sibanteng Leuwiliang,Kab Bogor,DODO,SBM Jabode V Fuel,TAGE1,TAGE2,CERTIFIED,NOT CERTIFIED,84.43,90.00,87.83,86.94,85.50,51.43,Pasti Pas Good,,"NFR, Rompi Khusus, Produk JBU, Jalur Fast Track"
2025-05-28,2025-05-22,24-353145,II,2025,JL. Raya Karang Anyar Dusun Karang Turi,Kab Lampung Selatan,DODO,SBM Lampung I Fuel,DAGE,DAGE,CERTIFIED,NOT CERTIFIED,95.36,100.00,100.00,97.94,97.50,60.18,Pasti Pas Good,,Rompi Khusus
2025-05-28,2025-05-22,34-17144,III,2025,Jl. RA. Kartini Margahayu Bekasi Timur,Kota Bekasi,DODO,SBM Karawang I Fuel,TAGE3,DAGE,CERTIFIED,NOT CERTIFIED,94.3,97.85,100.00,93.96,98.00,63.27,Pasti Pas Good,,"Jalur Fast Track, Produk JBU, NFR"
2025-05-29,2025-05-22,54-64124,V,2025,Desa Wonorejo Kec. Puncu Kab. Kediri,Kab Kediri,,SBM Kediri I Fuel,DAGE,DAGE,CERTIFIED,NOT CERTIFIED,90.55,96.33,100.00,91.25,93.00,40.96,Pasti Pas Good,,NFR
2025-05-29,2025-05-22,64-74307,VI,2025,"Jl. HM Arsyad KM. 5, Sampit",Kab KotawaringinTim,DODO,SBM Kalteng II Fuel,DAGE,DAGE,CERTIFIED,NOT CERTIFIED,91.32,94.00,100.00,94.20,91.00,51.78,Pasti Pas Good,,"Produk JBU, Jalur Fast Track, NFR"
2025-05-29,2025-05-22,44-53223,IV,2025,"Jl. Raya Kedungreja, Ds. Ciklapa, Kedungreja, Cilacap",Kab Cilacap,DODO,SBM Tegal III Fuel,DAGE,TAGE1,NOT CERTIFIED,NOT CERTIFIED,89.45,92.00,94.52,91.25,98.00,54.24,Pasti Pas Good,APAB,"APAB, NFR, Jalur Fast Track, Produk JBU"
2025-05-28,2025-05-22,24-31141,II,2025,Jl. Jend. Sudirman Prabumulih,Kota Prabumulih,DODO,SBM Sumsel III Fuel,TAGE1,TAGE2,CERTIFIED,NOT CERTIFIED,85.48,92.00,88.88,90.40,88.00,43.36,Pasti Pas Good,,"NFR, Jalur Fast Track, Produk JBU"
2025-05-28,2025-05-22,14-231407,I,2025,"JL.BANDA ACEH MEULABOH, DESA BEURADEN, ACEH BESAR.",Kab Aceh Besar,DODO,SBM Aceh I Fuel,DAGE,DAGE,CERTIFIED,NOT CERTIFIED,89.92,87.33,100.00,93.65,100.00,49.94,Pasti Pas Good,,"NFR, Produk JBU"
2025-05-29,2025-05-22,44-54112,IV,2025,"Jl. Diponegoro No. 160, Kutoarjo",Kab Purworejo,DODO,SBM Yogyakarta II Fuel,TAGE2,TAGE3,CERTIFIED,NOT CERTIFIED,94.42,96.67,100.00,94.10,98.00,68.00,Pasti Pas Good,,Jalur Fast Track
2025-06-12,2025-05-22,13-294705,I,2025,Jl. K.H Ahmad Dahlan Kel. Tanjung Riau,Kota Batam,CODO I,SBM Kepulauan Riau I Fuel,DAGE,DAGE,CERTIFIED,NOT CERTIFIED,91.56,93.67,100.00,95.33,91.50,52.46,Pasti Pas Good,,"NFR, Jalur Fast Track, Rompi Khusus"
2025-05-29,2025-05-22,54-61433,V,2025,Jl. Plumbon Gambang Kec Gudo Wangkal Kepuh,Kab. Jombang,DODO,SBM Surabaya II Fuel,TAG1,TAG2,CERTIFIED,NOT CERTIFIED,85.69,88.33,88.13,87.98,98.00,53.67,Pasti Pas Good,,"NFR, Produk JBU"
2025-05-29,2025-05-22,54-66107,V,2025,JL. CEMARA KEL. KARANGSARI KEC. SUKOREJO,Kota Blitar,,SBM Kediri II Fuel,DAGE,DAGE,CERTIFIED,NOT CERTIFIED,92.02,98.33,100.00,94.60,96.00,40.04,Pasti Pas Good,,"Jalur Fast Track, Produk JBU, NFR"
2025-06-25,2025-05-22,44-51119,IV,2025,Jl Raya Buaran Kradenan ,Kota Pekalongan,DODO,SBM Tegal II Fuel,TAGE1,TAGE2,CERTIFIED,CERTIFIED,89.92,96.67,93.06,87.46,90.00,64.80,Pasti Pas Good,,
2025-05-28,2025-05-22,14-202146,I,2025,"Jl. Titi Pahlawan, Marelan",Kota Medan,DODO,SBM Medan I Fuel,DAGE,DAGE,CERTIFIED,NOT CERTIFIED,94.65,99.33,100.00,98.00,100.00,52.46,Pasti Pas Good,,NFR
2025-05-28,2025-05-22,34-15717,III,2025,"Jl. Aria Wasangkara, Kp. Tapos, Kec. Tigaraksa, Kab. Tangerang, Banten",Kab Tangerang,DODO,SBM Banten I Fuel,DAGE,DAGE,CERTIFIED,NOT CERTIFIED,88.73,94.52,100.00,89.34,92.00,35.63,Pasti Pas Good,,"Produk JBU, Jalur Fast Track, NFR"
2025-05-29,2025-05-22,44-50131,IV,2025,Jl. Gajah Raya no. 108,Kota Semarang,DODO,SBM Semarang I Fuel,DAGE,DAGE,CERTIFIED,NOT CERTIFIED,93.05,98.33,100.00,91.85,100.00,51.76,Pasti Pas Good,,"NFR, Produk JBU"
2025-05-29,2025-05-22,44-56113,IV,2025,"Jl. Raya Magelang Muntilan Km. 5,6, Japunan",Kab Magelang,DODO,SBM Yogyakarta II Fuel,DAGE,DAGE,CERTIFIED,NOT CERTIFIED,92.44,96.67,100.00,93.59,90.00,57.30,Pasti Pas Good,,"NFR, Jalur Fast Track"
2025-07-02,2025-05-22,44-57418,IV,2025,"Jl. Raya Klaten Wonosari, Ds. Teloyo",Kab Klaten,DODO,SBM Yogyakarta III Fuel,TAG3,DAG1,CERTIFIED,NOT CERTIFIED,86.74,91.33,97.87,85.15,85.50,44.03,Pasti Pas Good,,"NFR, Produk JBU, Rompi Khusus, Jalur Fast Track"
2025-05-29,2025-05-22,74-93508,VII,2025,Samilambo,Kab Kolaka,DODO,SBM Sultra III Fuel,DAGE,DAGE,CERTIFIED,NOT CERTIFIED,91.22,96.67,96.35,93.60,88.50,57.41,Pasti Pas Good,,"Jalur Fast Track, NFR, Rompi Khusus"
2025-06-25,2025-05-22,24-34105,II,2025,"JL. Lintas Sumatra, Gunung Sugih",Kab Lampung Tengah,DODO,SBM Lampung II Fuel,DAGE,DAGE,CERTIFIED,NOT CERTIFIED,88.18,93.33,98.54,85.39,84.00,51.20,Pasti Pas Good,,Jalur Fast Track
2025-06-25,2025-05-22,34-16915,III,2025,"Jl. Akses Cibubur, Buperta",Kota Depok,DODO,SBM Jabode III Fuel,TAGE1,TAGE2,CERTIFIED,NOT CERTIFIED,93.13,91.67,100.00,86.65,97.50,85.50,Pasti Pas Good,,Rompi Khusus
2025-05-28,2025-05-22,34-41111,III,2025,Jl. Raya Bungursari,Kab Purwakarta,DODO,SBM Karawang III Fuel,DAGE,DAGE,CERTIFIED,NOT CERTIFIED,91.93,96.33,100.00,91.97,83.00,63.56,Pasti Pas Good,,"Jalur Fast Track, NFR"
2025-05-29,2025-05-22,44-59409,IV,2025,Jl. Raya Jepara - Bangsri Ds. Wonorejo,Kab Jepara,DODO,SBM Semarang III Fuel,DAGE,DAGE,CERTIFIED,NOT CERTIFIED,90.66,97.33,99.04,90.60,98.00,38.24,Pasti Pas Good,,"NFR, Produk JBU"
2025-05-29,2025-05-22,54-64121,V,2025,Desa Sumberagung Kec. Plosoklaten,Kab Kediri,,SBM Kediri I Fuel,DAGE,DAGE,CERTIFIED,NOT CERTIFIED,92.45,97.67,100.00,91.80,98.00,49.90,Pasti Pas Good,,NFR
2025-05-29,2025-05-22,44-59529,IV,2025,"Jl. Lingkar Demak km. 01, Kel Jogoloyo, Kec Wonosalam",Kab Demak,DODO,SBM Semarang III Fuel,TAG1,TAG2,CERTIFIED,CERTIFIED,91.22,90.67,96.17,97.64,100.00,56.33,Pasti Pas Good,,
2025-05-29,2025-05-22,74-95119,VII,2025,Jl. Martadinata No. 74 Paal 2,Kota Manado,,SBM Sulutgo I Fuel,TAGE2,TAGE3,CERTIFIED,NOT CERTIFIED,89.97,90.00,100.00,90.35,93.50,55.53,Pasti Pas Good,,"Rompi Khusus, NFR, Jalur Fast Track"
2025-06-20,2025-05-22,74-90236,VII,2025,Jl. Gunung Bawakaraeng,Kota Makassar,DODO,SBM Sulselbar I Fuel,DAE,DAE,CERTIFIED,CERTIFIED,86.6,88.00,89.41,85.10,97.00,66.58,Pasti Pas Excellent,,
2025-07-02,2025-05-22,34-40503,III,2025,JL. Raya Padalarang No. 514,Kab Bandung Barat,DODO,SBM Bandung II Fuel,DAGE,DAGE,CERTIFIED,NOT CERTIFIED,89.83,97.67,91.38,85.45,98.00,62.26,Pasti Pas Good,,"Produk JBU, NFR"
2025-05-28,2025-05-22,34-43203,III,2025,Jl. Raya Ciranjang - Cianjur,Kab Cianjur,DODO,SBM Sukabumi I Fuel,DAE,DAE,CERTIFIED,CERTIFIED,91.39,96.67,86.13,95.70,98.00,76.18,Pasti Pas Excellent,,
2025-06-16,2025-05-22,34-17419,III,2025,"Jl. Pabuaran kp. sawah jatirangon, jatisampurna.",Kota Bekasi,DODO,SBM Karawang I Fuel,TAGE1,TAGE2,CERTIFIED,NOT CERTIFIED,90.73,91.67,98.39,89.85,98.00,59.43,Pasti Pas Good,,"Jalur Fast Track, Produk JBU, NFR"
2025-06-12,2025-05-22,21-35313,II,2025,Jl. Tol bakauheni Terbanggi Besar Km. 87 B,Kab Lampung Selatan,COCO,SBM Lampung I Fuel,DAGE,DAGE,CERTIFIED,NOT CERTIFIED,95.57,100.00,100.00,97.57,95.00,65.40,Pasti Pas Good,,NFR
2025-05-29,2025-05-22,54-61413,V,2025,Jl. Raya Blimbing Ds. Blimbing Kec. Gudo,Kab Jombang,DODO,SBM Surabaya II Fuel,TAG2,TAG3,CERTIFIED,NOT CERTIFIED,86.61,87.33,92.33,91.66,98.00,45.76,Pasti Pas Good,,"Produk JBU, NFR"
2025-06-12,2025-05-22,44-50117,IV,2025,Jl. Osa Maliki Salatiga,Kota Salatiga,DODO,SBM Semarang I Fuel,DAGE,DAGE,CERTIFIED,NOT CERTIFIED,92.42,96.67,100.00,86.20,98.00,63.80,Pasti Pas Good,,NFR
2025-05-29,2025-05-22,54-66114,V,2025,"Jl. Trisula Desa Dauman, Kec. Kademangan",Kab Blitar,,SBM Kediri II Fuel,DAGE,DAGE,CERTIFIED,NOT CERTIFIED,89.6,96.67,100.00,85.68,91.00,43.71,Pasti Pas Good,,"Jalur Fast Track, NFR, Produk JBU"
2025-07-02,2025-05-22,54-60134,V,2025,"Jl. Wonorejo, Manukon Kulon, Tandes",Kota Surabaya,,SBM Surabaya I Fuel,DAG3,DAGE,CERTIFIED,NOT CERTIFIED,87.4,85.67,100.00,91.15,93.50,41.20,Pasti Pas Good,,"Produk JBU, Rompi Khusus, NFR, Jalur Fast Track"
2025-07-02,2025-05-22,54-66147,V,2025,Jl. Protokol Ds. Panggungrejo Kec. Panggungrejo,Kab Blitar,DODO,SBM Kediri II Fuel,TAGE1,TAGE2,CERTIFIED,CERTIFIED,90.46,95.33,99.04,91.30,86.00,52.90,Pasti Pas Good,,
2025-05-28,2025-05-22,34-16620,III,2025,Jl. Letnan Sayuti Desa Setu Kec Jasinga Kab. Bogor ,Kab Bogor,DODO,SBM Jabode V Fuel,TAG2,Re-CA1,NOT CERTIFIED,NOT CERTIFIED,77.19,83.33,74.58,82.97,89.50,42.90,Basic,Produk JBU,"Jalur Fast Track, Rompi Khusus, NFR, Produk JBU"
2025-05-28,2025-05-22,34-17139,III,2025,JL.Perjuangan KM 3 Desa Harapan Baru,Kota Bekasi,DODO,SBM Karawang I Fuel,TAGE2,TAGE3,CERTIFIED,NOT CERTIFIED,93.51,97.33,100.00,90.75,100.00,61.55,Pasti Pas Good,,"NFR, Produk JBU"
2025-05-29,2025-05-22,44-57614,IV,2025,"Jl. Raya Pracimantoro-Giriwoyo KM.6, Ds.Sambiroto",Kab Wonogiri,DODO,SBM Yogyakarta IV Fuel,DAGE,DAGE,CERTIFIED,NOT CERTIFIED,90.91,95.33,98.08,92.30,92.00,52.26,Pasti Pas Good,,"NFR, Produk JBU, Jalur Fast Track"
2025-05-27,2025-05-22,24-38226,II,2025,Jl.RE Martadinata,Kota Bengkulu,DODO,SBM Bengkulu I Fuel,DAGE,DAGE,CERTIFIED,NOT CERTIFIED,93.33,91.33,100.00,96.05,100.00,67.16,Pasti Pas Good,,Produk JBU
2025-05-28,2025-05-22,34-45237,III,2025,Jl Raya Lempuyang Desa Lempuyang Kec. Anjatan Kab. Indramayu,Kab Indramayu,DODO,SBM Cirebon II Fuel,TAGE1,TAGE2,CERTIFIED,NOT CERTIFIED,91.18,96.22,98.99,91.40,95.00,47.70,Pasti Pas Good,,"Jalur Fast Track, NFR"
2025-06-25,2025-05-22,14-264566,I,2025,Jl. Padang - Bukittinggi Desa Ladang Laweh,Kab Agam,DODO,SBM Sumatera Barat I Fuel,TAGE1,TAGE2,CERTIFIED,NOT CERTIFIED,87.57,87.67,99.09,85.52,96.00,48.08,Pasti Pas Good,,NFR
2025-06-16,2025-05-22,84-98101,VIII,2025,Jl. Jend. Sudirman,Kab Biak Numfor,DODO,SBM Papua II,TAG1,Re-CA1,NOT CERTIFIED,NOT CERTIFIED,79.83,84.00,83.66,80.90,95.00,38.50,Basic,,NFR
2025-05-27,2025-05-22,14-261532,I,2025,Jl. Bukittinggi - Medan km.3 Gadut Kab. Agam,Kab Agam,DODO,SBM Sumatera Barat I Fuel,TAGE1,TAGE2,CERTIFIED,NOT CERTIFIED,88.84,84.00,96.35,90.70,95.00,71.00,Pasti Pas Good,,
2025-05-29,2025-05-22,61-70701,VI,2025,Jl. A. Yani KM. 34,Kota Banjarbaru,COCO,SBM Kalsel I Fuel,DAGE,DAGE,CERTIFIED,NOT CERTIFIED,87.61,87.33,92.72,90.62,97.00,57.57,Pasti Pas Good,,"Produk JBU, NFR"
2025-06-26,2025-05-22,14-294722,I,2025,"Jl. Gajah Mada Tiban Center, Batam",Kota Batam,DODO,SBM Kepulauan Riau I Fuel,DAE,DAE,CERTIFIED,CERTIFIED,95.33,99.00,100.00,97.69,96.00,64.88,Pasti Pas Excellent,,
2025-05-29,2025-05-22,54-64152,V,2025,Jl. Kediri Desa Ploso Lor Kec.Plosoklaten,Kab Kediri,,SBM Kediri I Fuel,DAGE,DAGE,CERTIFIED,NOT CERTIFIED,92.23,92.67,100.00,91.80,93.00,67.60,Pasti Pas Good,,NFR
2025-06-25,2025-05-22,34-40230,III,2025,Jl. Laswi No. 61,Kota Bandung,DODO,SBM Bandung I Fuel,TAGE1,Re-CAE1,NOT CERTIFIED,NOT CERTIFIED,65.64,72.67,65.50,70.49,82.50,18.51,Basic,"Izin Prinsip, PELUMAS","Izin Prinsip, Produk JBU, Jalur Fast Track, Rompi Khusus, PELUMAS, NFR"
2025-06-25,2025-05-22,44-53116,IV,2025,"Jl. Soeparjo Rustam No. 170, Sokaraja, Banyumas",Kab Banyumas,DODO,SBM Tegal III Fuel,DAE,DAE,CERTIFIED,CERTIFIED,94.63,96.67,100.00,94.50,97.00,70.30,Pasti Pas Excellent,,
2025-05-29,2025-05-22,44-53214,IV,2025,Jl. Raya Cimanggu Majenang,Kab Cilacap,DODO,SBM Tegal III Fuel,DAGE,DAGE,CERTIFIED,NOT CERTIFIED,93.49,96.67,100.00,93.99,96.00,60.96,Pasti Pas Good,,"Jalur Fast Track, Produk JBU, NFR"
2025-05-28,2025-05-22,54-67201,V,2025,JL. RAYA DRINGU NO.37,Kab Probolinggo,,SBM Malang II Fuel,TAGE3,DAGE,CERTIFIED,NOT CERTIFIED,90.67,88.33,100.00,92.90,86.00,69.90,Pasti Pas Good,,"Produk JBU, Jalur Fast Track, NFR"
2025-05-27,2025-05-22,24-31139,II,2025,"Jl.Raya Prabumulih Cambai, Kab. Prabumulih",Kota Prabumulih,DODO,SBM Sumsel III Fuel,TAGE1,TAGE2,CERTIFIED,NOT CERTIFIED,87.46,94.00,100.00,87.38,79.50,38.24,Pasti Pas Good,,"Jalur Fast Track, NFR, Produk JBU, Rompi Khusus"
2025-06-24,2025-05-22,44-51116,IV,2025,"Jl. Raya Paesan, Kec. Kedungwuni",Kab Pekalongan,DODO,SBM Tegal II Fuel,DAE,DAE,CERTIFIED,CERTIFIED,91.31,96.67,93.06,91.69,97.00,63.31,Pasti Pas Excellent,,
2025-05-29,2025-05-22,54-61416,V,2025,JL. MERDEKA KEC. MOJOWARNO,Kab Jombang,DODO,SBM Surabaya II Fuel,DAG3,TAG1,NOT CERTIFIED,NOT CERTIFIED,84.83,91.33,89.05,79.33,95.00,53.58,Pasti Pas Good,"DU Dispenser, APAB","Produk JBU, NFR, Jalur Fast Track, DU Dispenser, APAB"
2025-05-29,2025-05-22,44-57424,IV,2025,"Jl. Tlogo Randu, Juwiring",Kab Klaten,DODO,SBM Yogyakarta III Fuel,DAGE,TAGE1,NOT CERTIFIED,NOT CERTIFIED,90.33,96.67,100.00,84.57,96.00,48.04,Pasti Pas Good,APAB,"Jalur Fast Track, Produk JBU, NFR, APAB"
2025-05-28,2025-05-22,34-40504,III,2025,Jl. Raya Purwakarta Cikalong wetan,Kab Bandung Barat,DODO,SBM Bandung II Fuel,DAGE,TAGE1,NOT CERTIFIED,NOT CERTIFIED,70.53,72.67,78.49,71.25,53.50,55.86,Pasti Pas Good,HP,"Rompi Khusus, Produk JBU, NFR, Jalur Fast Track, HP"
2025-07-02,2025-05-22,64-74304,VI,2025,"Jl HM Arsyad KM 1, Samuda",Kab KotawaringinTim,DODO,SBM Kalteng II Fuel,DAGE,DAGE,CERTIFIED,NOT CERTIFIED,85.9,84.33,100.00,86.40,93.50,39.66,Pasti Pas Good,,"Rompi Khusus, Produk JBU, Jalur Fast Track, NFR"
2025-05-29,2025-05-22,74-95104,VII,2025,Jl Tikala,Kota Manado,DODO,SBM Sulutgo I Fuel,DAGE,DAGE,CERTIFIED,NOT CERTIFIED,88.29,88.33,100.00,90.01,88.50,49.16,Pasti Pas Good,,"NFR, Jalur Fast Track, Rompi Khusus"
2025-05-27,2025-05-22,14-2021140,I,2025,Jl Platina Raya - Titi Papan,Kota Medan,DODO,SBM Medan I Fuel,TAGE1,TAGE2,CERTIFIED,CERTIFIED,94.88,96.00,100.00,97.73,100.00,65.36,Pasti Pas Good,,
2025-06-16,2025-05-22,34-46215,III,2025,Jl Siliwangi Kawali Mukti Kec. Kawali Kab. Ciamis,Kab Ciamis,DODO,SBM Bandung IV Fuel,DAGE,TAGE1,NOT CERTIFIED,NOT CERTIFIED,84.5,91.67,91.38,76.95,83.00,58.93,Pasti Pas Good,,"NFR, Jalur Fast Track"
2025-05-29,2025-05-22,74-93510,VII,2025,Jl. Pemuda Km. 5 Kel. Balandete,Kab Kolaka,DODO,SBM Sultra III Fuel,DAGE,DAGE,CERTIFIED,NOT CERTIFIED,88.52,96.67,85.40,92.35,90.50,63.80,Pasti Pas Good,,Rompi Khusus
2025-05-29,2025-05-22,44-57521,IV,2025,Desa Dalangan Kecamatan Tawangsari,Kab Sukoharjo,DODO,SBM Yogyakarta III Fuel,DAGE,DAGE,CERTIFIED,NOT CERTIFIED,93.73,96.67,100.00,92.63,98.00,63.80,Pasti Pas Good,,NFR
2025-05-28,2025-05-22,34-40518,III,2025,Jl. Cihanjuang Cibabat,Kota Cimahi,DODO,SBM Bandung I Fuel,TAGE3,DAGE,CERTIFIED,NOT CERTIFIED,92.61,95.33,100.00,92.35,98.00,57.40,Pasti Pas Good,,NFR
2025-05-28,2025-05-22,34-17506,III,2025,Jl. Raya Sultan Hasanudin No 1 Kec.Tambun Selatan,Kab Bekasi,DODO,SBM Karawang I Fuel,TAGE3,DAE,CERTIFIED,CERTIFIED,98.32,100.00,100.00,100.00,100.00,83.20,Pasti Pas Excellent,,
2025-06-25,2025-05-22,24-34103,II,2025,"Jl. Lintas Sumatra, Gunung Sugih",Kab Lampung Tengah,DODO,SBM Lampung II Fuel,DAGE,DAGE,CERTIFIED,NOT CERTIFIED,83.93,81.67,96.17,85.81,93.50,40.61,Pasti Pas Good,,"Jalur Fast Track, Rompi Khusus, Produk JBU"
2025-05-29,2025-05-22,44-59423,IV,2025,JL. RAYA JEPARA - BANGSRI KM.9 MLONGGO JEPARA,Kab Jepara,DODO,SBM Semarang III Fuel,TAG1,Re-CA1,NOT CERTIFIED,NOT CERTIFIED,93.41,96.67,99.04,90.90,97.00,68.15,Basic,Produk JBU,Produk JBU
