send_date,Audit Date,spbu_no,region,year,address,city_name,tipe_spbu,rayon,audit_level,audit_next,result,Total Score,SSS,EQnQ,RFS,kelas_spbu,penalty_alerts
2025-10-28,2025-10-28,24-38642,II,2025,"Jl. Lintas Barat Sumatra, Desa Bintunan, Batik Nau, Propinsi Bengkulu",BENGKULU UTARA,DODO,SBM Bengkulu I Fuel,BOA1,BOA2,NOT CERTIFIED,88.57,88.00,95.21,84.36,Basic,
2025-10-28,2025-10-27,14-246101,I,2025,"Jl. Kutacane-Tigabinanga, Kuning I, Kec. Bambel, Kabupaten Aceh Tenggara",Kab. Aceh Tenggara,DODO,SBM Aceh II Fuel,BOA1,BOA2,NOT CERTIFIED,57.56,55.67,49.96,63.92,Basic,"Izin Prinsip, Pelumas, Masa Berlaku APAR, APAR"
2025-10-28,2025-10-27,14-229326,I,2025,"Jl. Trans Sumatera Bukittinggi - Padang Sidempuan, Parbangunan, Kec. Panyabungan Kab. Madina",Kab. Madina,DODO,SBM Sibolga III Fuel,BOA1,BOA2,NOT CERTIFIED,77.72,67.33,92.97,73.64,Basic,"APAR, Izin Prinsip"
2025-10-27,2025-10-27,14-235409,I,2025,"JL. COT BAU, Kodya Sabang",Kodya Sabang,DODO,SBM Aceh I Fuel,BOA1,BOA2,NOT CERTIFIED,77.73,63.00,94.96,75.76,Basic,"APAR, Izin Prinsip"
2025-10-27,2025-10-27,24-36334,II,2025,Jl.Lintas Timur Sumatera Bukit Baling Muaro Jambi,Kab Muara Jambi,DODO,SBM Jambi I Fuel,BOA1,BOA2,NOT CERTIFIED,67.16,75.67,34.17,86.08,Basic,Pelumas
2025-10-27,2025-10-27,14-246477,I,2025,"Jl. Blangkejeren - Kutacane, Rak Lunung, Kec. Blangkejeren, Kabupaten Gayo Lues",Kab. Gayo Luwes,DODO,SBM Aceh II Fuel,BOA1,BOA2,NOT CERTIFIED,66.96,57.33,73.59,68.22,Basic,"Izin Prinsip, Masa Berlaku APAR, APAB, Pelumas"
2025-10-27,2025-10-25,14-246467,I,2025,"Jl. Lintas Takengon - Blangkejeren, Kuta Lintang, Kec. Blangkejeren, Kabupaten Gayo Lues",Kab. Gayo Luwes,DODO,SBM Aceh II Fuel,BOA1,BOA2,NOT CERTIFIED,85.09,89.67,81.98,83.18,Basic,"Pelumas, Izin Prinsip"
2025-10-27,2025-10-25,64-78303,VI,2025,JL. RAYA NGABANG.,Kab Landak,DODO,SBM Kalbar II Fuel,BOA1,BOA2,NOT CERTIFIED,59.97,45.67,89.84,48.19,Basic,"APAR, Izin Prinsip, Grounding, Masa Berlaku APAR, HP, Pelumas"
2025-10-25,2025-10-25,64-79305,VI,2025,JL. RAYA NGABANG PONTIANAK KM.10,Kab Landak,DODO,SBM Kalbar II Fuel,BOA1,BOA2,NOT CERTIFIED,51.65,57.33,33.02,61.20,Basic,"Izin Prinsip, Pelumas, HP, APAR, Masa Berlaku APAR"
2025-10-27,2025-10-25,13-245409,I,2025,"Jl. Bandara Rembele, Wonosobo, Kec. Wih Pesam, Kabupaten Bener Meriah",Kab. Bener Meriah,CODO I,SBM Aceh II Fuel,BOA1,BOA2,NOT CERTIFIED,81.62,50.00,97.51,93.62,Basic,"Pelumas, Izin Prinsip"
2025-10-25,2025-10-24,64-75517,VI,2025,Jl. Let. Sudirman RT 12 Loa Kulu,KAB. KUTAI KERTANEGA,DODO,SBM Kaltimut II Fuel,BOA1,BOA2,NOT CERTIFIED,69.75,70.00,74.12,66.28,Basic,"Izin Prinsip, Pelumas, APAB, Produk JBU"
2025-10-25,2025-10-24,14-2826117,I,2025,Jl.Subrantas Panam  - Pekanbaru	Kota Pekanbaru,Kodya Pekan Baru,DODO,SBM Riau I Fuel,BOA1,CA,CERTIFIED,95.13,87.33,100.00,97.37,Basic,
2025-10-25,2025-10-24,64-79506,VI,2025,"JL. ADI SUCIPTO, KEL. SUNGAI AYAK,",Kab Sekadau,DODO,SBM Kalbar II Fuel,BOA1,BOA2,NOT CERTIFIED,49.58,43.33,40.13,61.46,Basic,"HP, Izin Prinsip, Pelumas, CCTV, Masa Berlaku APAR, APAR"
2025-10-25,2025-10-24,14-251523,I,2025,"Jl. Khatib Sulaiman No. 50, Padang",Kota Padang,DODO,SBM Sumatera Barat II Fuel,BOA1,CA,CERTIFIED,95.4,86.33,100.00,98.75,Basic,
2025-10-25,2025-10-24,64-793001,VI,2025,JL. RY.NGABANG PONTIANAK KEC.SENGAH,Kab Landak,DODO,SBM Kalbar II Fuel,BOA1,BOA2,NOT CERTIFIED,36.27,16.33,34.83,51.27,Basic,"Masa Berlaku APAR, Grounding, Trims, Pelumas, Salam, HP, Izin Prinsip, Nol, APAB"
2025-10-25,2025-10-24,54-68124,V,2025,"JL. AMBULU BALUNG LOR, Kab. Jember",Kab. Jember,DODO,SBM Malang II Fuel,BOA1,BOA2,NOT CERTIFIED,60.7,61.00,41.83,73.97,Basic,"Masa Berlaku APAR, Izin Prinsip, APAR, Pelumas"
2025-10-25,2025-10-24,14-241103,I,2025,"Jl. Beureunuen - Tangse, Mali Guyui, Kec. Sakti, Kabupaten Pidie",Kab. Pidie,DODO,SBM Aceh I Fuel,BOA1,BOA2,NOT CERTIFIED,66.33,56.67,63.82,75.52,Basic,"Pelumas, Izin Prinsip, APAR"
2025-10-25,2025-10-24,23-32231,II,2025,"DESA KARANG AGUNG, KEC. SIMPANG",Kab Ogan Kom Ulu Sel,CODO,SBM Sumsel III Fuel,BOA1,BOA2,NOT CERTIFIED,72.61,75.67,77.85,66.38,Basic,"Izin Prinsip, Masa Berlaku APAR, APAR, Pelumas"
2025-10-25,2025-10-24,14-245428,I,2025,"Jl. Raya Bireuen - Takengon, Gegerung, Kec. Wih Pesam, Kabupaten Bener Meriah",Kab. Bener Meriah,DODO,SBM Aceh II Fuel,BOA1,BOA2,NOT CERTIFIED,62.12,45.67,68.71,68.97,Basic,"Izin Prinsip, APAR, Pelumas"
2025-10-25,2025-10-24,64-77104,VI,2025,JL. SEI MAHAKAM KEL. KAMPUNG EMPAT,Kota Tarakan,DODO,SBM Kaltimut V Fuel,BOA1,BOA2,NOT CERTIFIED,85.4,82.33,91.93,82.80,Basic,Izin Prinsip
2025-10-25,2025-10-24,13-227120,I,2025,Jl.Lintas Tengah Sumatera Kel. Tolang Jae Kec. Sayur Matinggi Kab. Tapanuli Selatan,Kab. Tapanuli Selata,CODO,SBM Sibolga III Fuel,BOA1,BOA2,NOT CERTIFIED,57.19,30.00,48.49,82.45,Basic,"Izin Prinsip, Salam"
2025-10-25,2025-10-24,64-78502,VI,2025,JL. RAYA SANGGAU,Kab Sanggau,DODO,SBM Kalbar II Fuel,BOA1,BOA2,NOT CERTIFIED,54.56,49.00,60.39,53.97,Basic,"APAB, Masa Berlaku APAR, Grounding, HP, CCTV, Pelumas, Izin Prinsip, APAR"
2025-10-25,2025-10-24,53-68136,VI,2025,JL. AHMAD YANI DESA AMBULU KEC. AMBULU,Kab. Jember,CODO I,SBM Malang II Fuel,BOA1,BOA2,NOT CERTIFIED,77.93,89.00,70.48,75.35,Basic,"Pelumas, Masa Berlaku APAR, Izin Prinsip, APAR"
2025-10-25,2025-10-23,63-76201,VI,2025,Jl. Kusuma Bangsa KM. 7 Kel. Janju Kec. Tanah Grogot,KAB. PASIR,CODO,SBM Kaltimut I Fuel,BOA1,BOA2,NOT CERTIFIED,91.98,83.33,100.00,92.45,Basic,Izin Prinsip
2025-10-25,2025-10-23,74-92602,VII,2025,Jl Poros Sinjai Kajang Mangara Bombang,Kab Sinjai,DODO,SBM Sulselbar II Fuel,BOA1,BOA2,NOT CERTIFIED,59.05,57.33,49.26,67.56,Basic,"Masa Berlaku APAR, APAR, Pelumas"
2025-10-25,2025-10-23,14-237422,I,2025,"Jl. Tapaktuan - Subulussalam, Gelumbuk, Kec. Kluet Sel., Kabupaten Aceh Selatan",Kab. Aceh Selatan,DODO,SBM Aceh II Fuel,BOA1,BOA2,NOT CERTIFIED,82.6,71.33,95.21,81.36,Basic,"Izin Prinsip, Pelumas"
2025-10-25,2025-10-23,14-223362,I,2025,"JL. NOMMENSEN 2002, SIGUMPAR DANGSI",Kab. Toba Samosir,DODO,SBM Sibolga II Fuel,BOA1,BOA2,NOT CERTIFIED,78.54,78.67,73.53,82.01,Basic,"Izin Prinsip, APAR, Masa Berlaku APAR"
2025-10-24,2025-10-23,64-75207,VI,2025,"JL. BUKIT BIRU, KEL.TIMBAU, KEC.TENGGARONG",KAB. KUTAI KERTANEGA,DODO,SBM Kaltimut II Fuel,BOA1,BOA2,NOT CERTIFIED,55.92,49.00,66.45,53.22,Basic,"Izin Prinsip, Masa Berlaku APAR, Pelumas, APAR, Salam"
2025-10-24,2025-10-23,64-79505,VI,2025,"Jl. NANGA TAMAN - NANGA MAHAP, DESA",Kab Sekadau,DODO,SBM Kalbar II Fuel,BOA1,BOA2,NOT CERTIFIED,69.91,50.67,81.79,75.49,Basic,"Pelumas, Izin Prinsip"
2025-10-25,2025-10-23,24-32157,II,2025,JL. RAYA MARTAPURA BELITANG,Kab Ogan Kom Ulu Tim,DODO,SBM Sumsel III Fuel,BOA1,BOA2,NOT CERTIFIED,38.68,42.67,21.08,48.43,Basic,"CCTV, Pelumas, APAR, Nol, Izin Prinsip, HP, Grounding, DU Dispenser"
2025-10-23,2025-10-23,64-78514,VI,2025,JL. LINTAS BEDUAI BALAI KARANGAN DS,Kab Sanggau,DODO,SBM Kalbar II Fuel,BOA1,BOA2,NOT CERTIFIED,32.65,23.00,8.58,57.78,Basic,"APAR, APAB, HP, Trims, Salam, Izin Prinsip, CCTV, Nol, Pelumas, DU Dispenser"
2025-10-25,2025-10-23,34-17206,III,2025,KP. PAMAHAN RT 001/005 JL. RAYA TAR,Kabupaten Bekasi,DODO,SBM Karawang I Fuel,BOA1,CA,CERTIFIED,92.56,86.33,95.96,94.43,Basic,
2025-10-23,2025-10-23,64-79502,VI,2025,JL. RAWAK NANGA TAMAN DS. RAWAK HUL,Kab Sekadau,DODO,SBM Kalbar II Fuel,BOA1,BOA2,NOT CERTIFIED,49.03,59.00,36.08,51.16,Basic,"Masa Berlaku APAR, Izin Prinsip, Pelumas, APAR, APAB"
2025-10-23,2025-10-23,63-772002,VI,2025,"JL. JELARAI RAYA RT.13, KEC. TANJUN",Kab Bulungan,CODO,SBM Kaltimut IV Fuel,BOA1,BOA2,NOT CERTIFIED,66.16,77.33,66.18,57.78,Basic,"Pelumas, Masa Berlaku APAR, Izin Prinsip, CCTV"
2025-10-25,2025-10-23,14-223364,I,2025,"JALAN BAYPASS BALIGE, KELURAHAN HIN",Kab. Toba Samosir,DODO,SBM Sibolga II Fuel,BOA1,BOA2,NOT CERTIFIED,84.42,87.33,76.04,88.12,Basic,"Masa Berlaku APAR, Izin Prinsip"
2025-10-23,2025-10-23,64-78509,VI,2025,JL. LINTAS KEMBAYAN KEC. KEMBAYAN,Kab Sanggau,DODO,SBM Kalbar II Fuel,BOA1,BOA2,NOT CERTIFIED,45.12,43.67,48.03,44.46,Basic,"CCTV, Grounding, Masa Berlaku APAR, APAB, DU Dispenser, Izin Prinsip, APAR, Pelumas"
2025-10-23,2025-10-23,64-75504,VI,2025,"JL. BELIDA RT.VIII KEL.TIMBAU KEC.TENGGARONG, Kab. Kutai Kartanegara",KAB. KUTAI KERTANEGA,DODO,SBM Kaltimut II Fuel,BOA1,BOA2,NOT CERTIFIED,80.73,75.00,83.71,82.80,Basic,"CCTV, Pelumas, Izin Prinsip"
2025-10-23,2025-10-22,64-75518,VI,2025,"Jl. YA LEJAU RT.02 RW.00, MUARA WAH",KAB. KUTAI KERTANEGA,DODO,SBM Kaltimut II Fuel,BOA1,BOA2,NOT CERTIFIED,68.67,68.33,73.56,65.25,Basic,"APAR, Izin Prinsip, Pelumas, Masa Berlaku APAR, CCTV"
2025-10-23,2025-10-22,34-42315,III,2025,"JL. RY.RANGKAS  LEUWI DAMAR DS.KALANG ANYAR KEC.KALANG ANYAR KAB.LEBAK, LEBAK",Kabupaten Lebak,DODO,SBM Banten III Fuel,BOA1,CA,CERTIFIED,91.91,83.33,92.52,97.88,Basic,
2025-10-23,2025-10-22,24-348164,II,2025,JL. LINTAS LIWA KEL. TAMBAK JAYA,Kab Pesisir Barat,DODO,SBM Lampung III Fuel,BOA1,BOA2,NOT CERTIFIED,69.35,60.00,73.57,73.34,Basic,Masa Berlaku APAR
2025-10-24,2025-10-22,24-32187,II,2025,JL. HANG JEBAT  RT. 024 RW.09 NO.08,Kab Ogan Kom Ulu Tim,DODO,SBM Sumsel III Fuel,BOA1,BOA2,NOT CERTIFIED,45.98,24.00,63.25,49.06,Basic,"Nol, CCTV, APAR, Masa Berlaku APAR, HP, Trims, Pelumas, Salam, Izin Prinsip, Grounding"
2025-10-23,2025-10-22,64-761019,VI,2025,JL. PROPINSI DS. BABULU DARAT KEC.,Kab Penajam Paser Ut,DODO,SBM Kaltimut I Fuel,BOA1,BOA2,NOT CERTIFIED,49.68,65.00,18.65,61.13,Basic,"APAR, Pelumas, Masa Berlaku APAR, APAB, CCTV, DU Dispenser, Nol, Izin Prinsip"
2025-10-23,2025-10-22,64-737003,VI,2025,"JL. SOEKARNO HATTA, DESA SABABIL KE",Kab Barito Selatan,DODO,SBM Kalteng III Fuel,BOA1,BOA2,NOT CERTIFIED,58.11,40.67,77.29,56.82,Basic,"CCTV, APAR, Pelumas, HP, Masa Berlaku APAR, Izin Prinsip"
2025-10-24,2025-10-22,24-323151,II,2025,DS.TULUNG SARI KEC.BELINTANG MULYA,Kab Ogan Kom Ulu Tim,DODO,SBM Sumsel III Fuel,BOA1,BOA2,NOT CERTIFIED,29.29,4.44,11.46,61.63,Basic,"APAR, Pelumas, Trims, HP, Salam, Izin Prinsip, Masa Berlaku APAR"
2025-10-23,2025-10-22,64-78516,VI,2025,"JALAN TRANS KALIMANTAN, DES/KEL. SU",Kab Sanggau,DODO,SBM Kalbar II Fuel,BOA1,BOA2,NOT CERTIFIED,68.86,46.67,89.31,69.60,Basic,"Pelumas, Izin Prinsip, APAR, Masa Berlaku APAR"
2025-10-22,2025-10-22,24-34518,II,2025,JL.TRANS SUMATERA NO.174 BARADATU,Kab Way Kanan,DODO,SBM Lampung III Fuel,BOA1,BOA2,NOT CERTIFIED,45.69,63.00,26.50,46.73,Basic,"Pelumas, CCTV, Izin Prinsip, Masa Berlaku APAR, APAB, APAR"
2025-10-22,2025-10-22,34-42314,III,2025,"DS. SIPAYUNG KEC. CIPANAS KAB. LEBAK., LEBAK",Kabupaten Lebak,DODO,SBM Banten III Fuel,BOA1,CA,CERTIFIED,95.08,86.00,99.09,98.88,Basic,
2025-10-23,2025-10-22,64-79501,VI,2025,JL. SEKADAU SINTANG DS. TAPANG SEMA,Kab Sekadau,DODO,SBM Kalbar II Fuel,BOA1,BOA2,NOT CERTIFIED,62.82,54.00,58.32,72.70,Basic,"Masa Berlaku APAR, Pelumas, Izin Prinsip"
2025-10-24,2025-10-22,14-236110,I,2025,JL. NASIONAL MEAULABOH T TUAN,Kab. Aceh Barat,DODO,SBM Aceh I Fuel,BOA1,BOA2,NOT CERTIFIED,84.76,73.67,84.00,93.85,Basic,
2025-10-24,2025-10-22,24-32164,II,2025,JL. HANG JEBAT,Kab Ogan Kom Ulu Tim,DODO,SBM Sumsel III Fuel,BOA1,BOA2,NOT CERTIFIED,67.22,46.33,71.62,79.00,Basic,"APAR, Izin Prinsip, Masa Berlaku APAR"
2025-10-23,2025-10-22,64-76103,VI,2025,"JL. PROVINSI KM.2 KEC. PENAJAM, KAB. Penajam Paser Utara",KAB. PENAJAM,DODO,SBM Kaltimut I Fuel,BOA1,BOA2,NOT CERTIFIED,45.8,62.67,7.19,61.66,Basic,"Pelumas, DU Dispenser, Izin Prinsip, Masa Berlaku APAR, Grounding"
2025-10-23,2025-10-22,34-43114,III,2025,"JL.RAYA SURADE DS.JAYAMUKTI KEC.SURADE, KODYA SUKABUMI",Kabupaten Sukabumi,DODO,SBM Sukabumi I Fuel,BOA1,CA,CERTIFIED,87.21,81.00,94.96,85.82,Basic,
2025-10-23,2025-10-22,64-75302,VI,2025,"JL. RAYA LOA JANAN RT.13, Kab. Kutai Kartanegara",KOTA SAMARINDA,DODO,SBM Kaltimut III Fuel,BOA1,BOA2,NOT CERTIFIED,39.46,45.33,21.19,48.75,Basic,"Pelumas, Masa Berlaku APAR, Izin Prinsip, Salam, Grounding, APAR"
2025-10-22,2025-10-22,24-347122,II,2025,JL. RAYA LINTAS TENGAH SUMATERA KEL,Kab Way Kanan,DODO,SBM Lampung III Fuel,BOA1,BOA2,NOT CERTIFIED,46.84,40.67,40.58,55.84,Basic,"APAR, APAB, Masa Berlaku APAR, Izin Prinsip, Pelumas"
2025-10-23,2025-10-22,64-78313,VI,2025,"JL. RAYA JUNGKAT, DESA PENITI LUAR",Kab Mempawah,DODO,SBM Kalbar I Fuel,BOA1,BOA2,NOT CERTIFIED,56.56,42.00,74.78,53.87,Basic,"Izin Prinsip, Trims, Masa Berlaku APAR, Grounding, APAB, APAR"
2025-10-22,2025-10-22,64-77310,VI,2025,"JL. BAYANUDIN RT.001 RW.00,",Kab Berau,DODO,SBM Kaltimut III Fuel,BOA1,CA,CERTIFIED,91.32,83.00,95.21,94.65,Basic,
2025-10-22,2025-10-22,64-73804,VI,2025,"JL. PAHLAWAN KEL.BUNTOK KOTA KEC.DUSUN SELATAN, KAB. BARITO SELATAN",KAB. BARITO SELATAN,DODO,SBM Kalteng III Fuel,BOA1,BOA2,NOT CERTIFIED,70.87,69.33,83.45,62.61,Basic,"CCTV, Izin Prinsip, Masa Berlaku APAR, APAR, Pelumas"
2025-10-24,2025-10-21,24-331144,III,2025,"Jl. Kampak, Pangkal Pinang",KODYA PANGKAL PINANG,DODO,SBM Babel I,BOA1,CA,CERTIFIED,93.95,86.33,100.00,95.12,Basic,
2025-10-23,2025-10-21,44-59326,IV,2025,JL. RAYA SEDANG MEJOBO KEL. BULUCAN,Kab. Kudus,DODO,SBM Semarang III Fuel,BOA1,CA,CERTIFIED,95.16,86.33,100.00,98.01,Basic,
2025-10-22,2025-10-21,64-773002,VI,2025,LOKASI SAMBALIUNG,Kab Berau,DODO,SBM Kaltimut III Fuel,BOA1,BOA2,NOT CERTIFIED,27.16,38.33,4.51,34.92,Basic,"Masa Berlaku APAR, CCTV, Izin Prinsip, Grounding, Pelumas, APAB, APAR"
2025-10-24,2025-10-21,14-236498,I,2025,"Jalan Banda Aceh - Meulaboh, Desa Kuta Tuha, Kecamatan Panga, Kab. Aceh Jaya",Kab. Aceh Jaya,DODO,SBM Aceh I Fuel,BOA1,BOA2,NOT CERTIFIED,55.54,27.33,59.78,73.38,Basic,"HP, Masa Berlaku APAR, Pelumas, Nol, Salam, Izin Prinsip, APAR"
2025-10-22,2025-10-21,34-43209,III,2025,DS.CIJEDIL CIHERANG,Kabupaten Cianjur,DODO,SBM Sukabumi I Fuel,BOA1,CA,CERTIFIED,93.64,88.33,100.00,93.12,Basic,
2025-10-25,2025-10-21,74-91673,VII,2025,"Jl. Jurusan Pinrang Simae, Kab. Sidrap",Kab. Sidrap,DODO,SBM Sulselbar III Fuel,BOA1,CA,CERTIFIED,92.5,85.00,100.00,92.50,Basic,
2025-10-22,2025-10-21,64-75305,VI,2025,"JL. RAYA POROS BONTANG KM.7 DESA SUKA RAHMAT KEC.TELUK PANDAN, KOTA BONTANG",KAB. KUTAI TIMUR,DODO,SBM Kaltimut III Fuel,BOA1,BOA2,NOT CERTIFIED,58.01,41.33,72.21,59.88,Basic,"Masa Berlaku APAR, Pelumas, APAB, Salam, APAR, Grounding, Izin Prinsip"
2025-10-22,2025-10-21,64-78322,VI,2025,"JL. PRAMUKA KEL.SUNGAI RENGAS, KEC.",Kab Kubu Raya,DODO,SBM Kalbar I Fuel,BOA1,BOA2,NOT CERTIFIED,83.57,84.33,75.51,89.43,Basic,
2025-10-21,2025-10-21,34-42307,III,2025,"JL. RAYA MALINGPING, PDG, LEBAK",Kabupaten Lebak,DODO,SBM Banten III Fuel,BOA1,CA,CERTIFIED,93.69,86.00,99.04,95.36,Basic,
2025-10-21,2025-10-21,24-34523,II,2025,LOKASI BLAMBANGAN UMPU,Kab Way Kanan,DODO,SBM Lampung III Fuel,BOA1,BOA2,NOT CERTIFIED,43.61,38.67,30.33,57.54,Basic,"Izin Prinsip, Masa Berlaku APAR, Pelumas, APAR"
2025-10-22,2025-10-21,64-76122,VI,2025,Jl.Negara KM 42 Desa Bukit Raya Kec.Sepaku,KAB. PENAJAM,DODO,SBM Kaltimut I Fuel,BOA1,BOA2,NOT CERTIFIED,71.2,53.00,80.38,77.03,Basic,"Grounding, Pelumas, Izin Prinsip"
2025-10-22,2025-10-21,64-77303,VI,2025,JL. MALUANG DESA MALUANG,Kab Berau,DODO,SBM Kaltimut III Fuel,BOA1,BOA2,NOT CERTIFIED,52.73,53.33,60.42,45.40,Basic,"Masa Berlaku APAR, Pelumas, Izin Prinsip, APAR, APAB"
2025-10-24,2025-10-21,14-275547,I,2025,"Jl. Lintas Sumatera, Koto Baru, Kec. Koto Baru, Kabupaten Dharmasraya",Kab. Dharmas Raya,DODO,SBM Sumatera Barat II Fuel,BOA1,BOA2,NOT CERTIFIED,48.52,33.00,64.43,48.30,Basic,"Masa Berlaku APAR, Pelumas, Grounding, DU Dispenser, APAR, Salam, Izin Prinsip"
2025-10-21,2025-10-21,54-86508,V,2025,DS. POTA KEC. SAMBI RAMPAS,Kab Manggarai,DODO,SBM NTT III Fuel,BOA1,BOA2,NOT CERTIFIED,57.15,31.33,76.80,61.78,Basic,"HP, Pelumas, Masa Berlaku APAR, Trims"
2025-10-21,2025-10-21,24-347149,II,2025,JL. RAYA LINTAS TENGAH TRANS SUMATE,Kab Way Kanan,DODO,SBM Lampung III Fuel,BOA1,BOA2,NOT CERTIFIED,41.53,45.67,20.44,54.56,Basic,"CCTV, Pelumas, Masa Berlaku APAR, APAR, APAB, Izin Prinsip"
2025-10-21,2025-10-21,54-80808,V,2025,DESA NUSU KEC.KUBU AMLAPURA,Kab Karangasem,DODO,SBM Bali III Fuel,BOA1,BOA2,NOT CERTIFIED,56.37,58.33,38.85,66.80,Basic,"HP, Izin Prinsip, CCTV, Pelumas, APAR"
2025-10-22,2025-10-21,64-73901,VI,2025,JL.JEND.SUDIRMAN RT.05/III BERIW,Kab Murung Raya,DODO,SBM Kalteng III Fuel,BOA1,BOA2,NOT CERTIFIED,72.48,62.33,91.79,65.78,Basic,"Masa Berlaku APAR, CCTV, Pelumas, Izin Prinsip, APAR"
2025-10-22,2025-10-21,64-75307,VI,2025,"JL. MT HARYONO NO. 53, KOTA BONTANG",KOTA BONTANG,DODO,SBM Kaltimut III Fuel,BOA1,BOA2,NOT CERTIFIED,50.41,42.67,53.21,54.12,Basic,"Grounding, Pelumas, Salam, Masa Berlaku APAR, Nol, APAR, Izin Prinsip"
2025-10-21,2025-10-21,64-77301,VI,2025,LOKASI KAB. BERAU,Kab Berau,DODO,SBM Kaltimut III Fuel,BOA1,BOA2,NOT CERTIFIED,39.27,32.67,50.32,35.29,Basic,"Grounding, APAR, DU Dispenser, CCTV, Izin Prinsip, Pelumas, HP, Masa Berlaku APAR, APAB"
2025-10-23,2025-10-21,34-42213,III,2025,Jalan Raya Carita Pantai Matahari Kp. Bengras desa sukanagara Pandeglang - Banten,Kabupaten Pandeglang,DODO,SBM Banten III Fuel,BOA1,BOA2,NOT CERTIFIED,77.43,64.67,87.64,79.21,Basic,"Grounding, Pelumas, CCTV"
2025-10-21,2025-10-20,64-77304,VI,2025,JL. H. ISA III TANJUNG REDEB,Kab Berau,DODO,SBM Kaltimut III Fuel,BOA1,BOA2,NOT CERTIFIED,45.77,27.00,56.78,50.89,Basic,"Izin Prinsip, CCTV, Trims, Grounding, Nol, APAB, Pelumas"
2025-10-25,2025-10-20,34-17519,III,2025,"DS. MANGUNJAYA, TAMBUN",Kabupaten Bekasi,DODO,SBM Karawang I Fuel,BOA1,CA,CERTIFIED,88.5,85.00,87.41,91.82,Basic,
2025-10-21,2025-10-20,64-76105,VI,2025,"JL. LETJEND. SUPRAPTO KEBUN SAYUR, Kodya Balikpapan",KOTA BALIKPAPAN,DODO,SBM Kaltimut I Fuel,BOA1,BOA2,NOT CERTIFIED,39.56,56.67,3.59,53.42,Basic,"DU Dispenser, Masa Berlaku APAR, Pelumas, Izin Prinsip, APAR, CCTV, Nol, APAB"
2025-10-25,2025-10-20,74-91101,VII,2025,"Jl. Bau Massepe Kota Parepare, Kota Parepare",Kodya Parepare,DODO,SBM Sulselbar III Fuel,BOA1,BOA2,NOT CERTIFIED,90.39,89.67,99.04,84.44,Basic,"Izin Prinsip, Pelumas"
2025-10-21,2025-10-20,34-42209,III,2025,"JL. RAYA LABUAN KEL.SENANGSARI PNDLG, PANDEGLANG",Kabupaten Pandeglang,DODO,SBM Banten III Fuel,BOA1,CA,CERTIFIED,91.69,87.33,98.99,89.61,Basic,
2025-10-21,2025-10-20,54-68132,V,2025,"DESA YOSORATI, KEC.SUMBER BARU, Kab. Jember",Kab. Jember,DODO,SBM Malang II Fuel,BOA1,BOA2,NOT CERTIFIED,76.52,61.67,83.45,82.41,Basic,"Izin Prinsip, Masa Berlaku APAR"
2025-10-21,2025-10-20,64-75310,VI,2025,"JL. POROS BONTANG-SANGATTA KEC. SANGATTA SELATAN, KAB. KUTAI TIMUR",KAB. KUTAI TIMUR,DODO,SBM Kaltimut III Fuel,BOA1,BOA2,NOT CERTIFIED,55.31,40.33,74.52,52.12,Basic,"APAB, Izin Prinsip, APAR, Masa Berlaku APAR, Pelumas, Salam"
2025-10-21,2025-10-20,64-78703,VI,2025,JL. PUTUSSIBAU SINTANG DS. TEKUDAK,Kab Kapuas Hulu,DODO,SBM Kalbar I Fuel,BOA1,BOA2,NOT CERTIFIED,61.74,40.67,84.85,60.36,Basic,"Izin Prinsip, Pelumas, APAR, Masa Berlaku APAR, HP"
2025-10-21,2025-10-20,64-76127,VI,2025,"Jl Ahmad Yani, No 51 , Gunungsari Ulu. Kodya Balikpapan",Kota Balikpapan,DODO,SBM Kaltimut I Fuel,BOA1,BOA2,NOT CERTIFIED,62.06,75.00,30.78,75.56,Basic,"DU Dispenser, Masa Berlaku APAR, Izin Prinsip, Pelumas"
2025-10-23,2025-10-20,14-275562,I,2025,"Jl. Lintas Sumatera, Limo Koto, Kec. Koto VII, Kabupaten Sijunjung",Kab. Sawah Lunto SJJ,DODO,SBM Sumatera Barat II Fuel,BOA1,BOA2,NOT CERTIFIED,55.41,48.67,76.04,44.92,Basic,"APAR, Salam, Pelumas, Izin Prinsip, Masa Berlaku APAR, APAB"
2025-10-25,2025-10-20,74-93704,VII,2025,"JL. POROS POLEANG, KEL. BAMBAEA - P",Kab Bombana,DODO,SBM Sultra II Fuel,BOA1,CA,CERTIFIED,89.84,86.33,91.38,91.33,Basic,
2025-10-21,2025-10-20,64-77305,VI,2025,JL. BUJANGGA RT.08 KEL. BENDUNGUN,Kab Berau,DODO,SBM Kaltimut III Fuel,BOA1,BOA2,NOT CERTIFIED,61.02,43.00,72.21,65.43,Basic,"CCTV, Izin Prinsip, APAB, Salam, Pelumas"
2025-10-22,2025-10-20,34-42211,III,2025,"Jl. Raya  Labuan Km 13 Cisantri Pandeglang, PANDEGLANG",Kabupaten Pandeglang,DODO,SBM Banten III Fuel,BOA1,BOA2,NOT CERTIFIED,79.22,68.67,80.26,86.34,Basic,"Izin Prinsip, CCTV"
2025-10-25,2025-10-20,34-17421,III,2025,Jln. Raya Hankam no. 4,Kodya Bekasi,DODO,SBM Karawang I Fuel,BOA1,BOA2,NOT CERTIFIED,84.56,74.67,83.71,92.18,Basic,"Masa Berlaku APAR, Izin Prinsip"
2025-10-21,2025-10-20,64-75309,VI,2025,"JL. PENDIDIKAN KEC.TELUK LINGGA, KAB. KUTAI TIMUR",KAB. KUTAI TIMUR,DODO,SBM Kaltimut III Fuel,BOA1,BOA2,NOT CERTIFIED,49.47,39.67,61.04,48.15,Basic,"Salam, Izin Prinsip, APAB, APAR, Masa Berlaku APAR, Pelumas"
2025-10-25,2025-10-20,34-17311,III,2025,"JL.BOULEVARD 3 PERUM HARVEST CITY KEL RAGEMANUNGGAL KEC SETU, KAB. BEKASI, JAWA BARAT",Kabupaten Bekasi,DODO,SBM Karawang I Fuel,BOA1,CA,CERTIFIED,88.48,87.33,86.39,90.83,Basic,
2025-10-20,2025-10-20,64-78702,VI,2025,JL. LINTAS SELATAN DS. MUJAN KEC. B,Kab Kapuas Hulu,DODO,SBM Kalbar II Fuel,BOA1,BOA2,NOT CERTIFIED,51.2,45.67,64.64,45.13,Basic,"APAR, Grounding, Masa Berlaku APAR, APAB, Produk JBU, Izin Prinsip, Pelumas, HP"
2025-10-22,2025-10-20,34-45525,III,2025,Jl Raya Jatimulya RT 05 RW 01 Desa Jatimulya Kec Cidahu,Kabupaten Kuningan,DODO,SBM Cirebon I Fuel,BOA1,BOA2,NOT CERTIFIED,84.86,66.00,93.68,92.41,Basic,CCTV
2025-10-20,2025-10-20,33-43201,III,2025,JL. RAY. SINDANGBARANG - CIDAUN DS.SEGETEN KEC.SINDANGBARANG CIANJUR,Kabupaten Cianjur,CODO,SBM Sukabumi I Fuel,BOA1,BOA2,NOT CERTIFIED,68.14,67.33,40.28,90.02,Basic,Izin Prinsip
2025-10-25,2025-10-20,34-17420,III,2025,Kota Bekasi,Kodya Bekasi,DODO,SBM Karawang I Fuel,BOA1,BOA2,NOT CERTIFIED,84.78,88.00,77.77,87.62,Basic,Izin Prinsip
2025-10-20,2025-10-20,64-76102,VI,2025,"JL. MAYJEND. SUTOYO No.46, Kodya Balikpapan",KOTA BALIKPAPAN,DODO,SBM Kaltimut I Fuel,BOA1,BOA2,NOT CERTIFIED,79.37,76.00,95.74,69.62,Basic,"Pelumas, Masa Berlaku APAR, Izin Prinsip, APAB"
2025-10-20,2025-10-20,64-756006,VI,2025,"Jl. Soekarno Hatta, Kel.Swarga Bara, Kec. Sangatta Utara",Kab Kutai Timur,DODO,SBM Kaltimut II Fuel,BOA1,BOA2,NOT CERTIFIED,51.61,41.33,38.67,69.02,Basic,"Izin Prinsip, Salam, APAB, Pelumas"
2025-10-20,2025-10-20,64-73801,VI,2025,"JL. NEGARA KM.6 (MUARA TEWEH- BANJARMASIN), KAB. BARITO UTARA",KAB. BARITO UTARA,DODO,SBM Kalteng III Fuel,BOA1,BOA2,NOT CERTIFIED,68.12,52.33,91.79,62.02,Basic,"Masa Berlaku APAR, APAR, Izin Prinsip"
2025-10-21,2025-10-20,64-77309,VI,2025,"JL. HARM AYOEB, KEL. BEDUNGUN, KEC.",Kab Berau,DODO,SBM Kaltimut III Fuel,BOA1,BOA2,NOT CERTIFIED,93.57,85.67,100.00,94.68,Basic,Izin Prinsip
2025-10-22,2025-10-18,34-17558,III,2025,"DS. MANGUNJAYA, TAMBUN",Kab Bekasi,DODO,SBM Karawang I Fuel,BOA1,CA,CERTIFIED,88.06,80.67,87.28,93.92,Basic,
2025-10-25,2025-10-18,74-91215,VII,2025,Jl. Poros Pinrang-Enrekang,Kab. Pinrang,DODO,SBM Sulselbar III Fuel,BOA1,BOA2,NOT CERTIFIED,62.66,49.00,51.58,80.47,Basic,"Izin Prinsip, Masa Berlaku APAR, Pelumas, APAR"
2025-10-20,2025-10-18,64-78618,VI,2025,"JL. RAYA SINTANG - PUTTUSIBAU, DESA",Kab Sintang,DODO,SBM Kalbar II Fuel,BOA1,BOA2,NOT CERTIFIED,59.96,35.67,79.21,64.03,Basic,"Izin Prinsip, HP, Pelumas, Masa Berlaku APAR"
2025-10-20,2025-10-18,64-73803,VI,2025,"JL. BRIGJEND. KATAMSO KM.2 KEL.MELAYU, KAB. BARITO UTARA",KAB. BARITO UTARA,DODO,SBM Kalteng III Fuel,BOA1,BOA2,NOT CERTIFIED,76.11,53.33,98.99,76.02,Basic,"Pelumas, Izin Prinsip, APAR"
2025-10-20,2025-10-18,64-75204,VI,2025,"JL. MOH. HATTA 05/08 KEL.MUARA JAWA, Kab. Kutai Kartanegara",KAB. KUTAI KERTANEGA,DODO,SBM Kaltimut II Fuel,BOA1,BOA2,NOT CERTIFIED,60.42,59.00,54.75,65.75,Basic,"Masa Berlaku APAR, Pelumas, APAB, Izin Prinsip"
2025-10-22,2025-10-18,83-97702,VIII,2025,Jl. Boulevard Dodoku Danau Ali Kelurahan Soa Siu,KOTA TERNATE,CODO I,SBM Maluku Utara I,BOA1,BOA2,NOT CERTIFIED,43.83,44.00,15.78,64.26,Basic,"CCTV, Pelumas, Izin Prinsip"
2025-10-22,2025-10-18,14-223359,I,2025,"UNJUR, KEL. UNJUR, KEC. SIMANINDO",Kab. Samosir,DODO,SBM Sibolga II Fuel,BOA1,BOA2,NOT CERTIFIED,77.81,69.67,67.71,91.50,Basic,"Pelumas, Izin Prinsip"
2025-10-22,2025-10-18,34-45129,III,2025,"DS. LUNG BENDA, KEC.PALIMANAN CRB, KABUPATEN CIREBON",Kabupaten Cirebon,DODO,SBM Cirebon I Fuel,BOA1,CA,CERTIFIED,89.53,80.67,96.35,91.08,Basic,
2025-10-25,2025-10-18,74-91218,VII,2025,Jl. Briptu Suherman (Jalan Lingkar) Kel. Jaya Kec. Watangsawitto  Pinrang,Kab. Pinrang,DODO,SBM Sulselbar III Fuel,BOA1,BOA2,NOT CERTIFIED,82.78,65.67,93.10,87.88,Basic,Pelumas
2025-10-22,2025-10-18,13-277521,I,2025,"Jl. Raya Muara Labuh, Pakan Rabaa Utara, Kec. Koto Parik Gadang Diateh, Kabupaten Solok Selatan",Kab. Solok Selatan,CODO I,SBM Sumatera Barat II Fuel,BOA1,BOA2,NOT CERTIFIED,60.21,39.00,53.38,81.68,Basic,"Izin Prinsip, Pelumas, CCTV"
2025-10-20,2025-10-18,64-796001,VI,2025,JL.SIDOMULYO KM.24 MELAWI,Kab Melawi,DODO,SBM Kalbar I Fuel,BOA1,BOA2,NOT CERTIFIED,54.73,42.33,67.71,53.33,Basic,"HP, Pelumas, Izin Prinsip, Masa Berlaku APAR, APAR"
2025-10-20,2025-10-18,24-34110,II,2025,JL. RAYA LINTAS TIMUR,Kab Lampung Timur,DODO,SBM Lampung II Fuel,BOA1,BOA2,NOT CERTIFIED,81.32,79.00,85.34,80.02,Basic,Masa Berlaku APAR
2025-10-22,2025-10-18,34-45241,III,2025,"JALAN RAYA CIREBON INDRAMAYU, DESA",Kabupaten Indramayu,DODO,SBM Cirebon II Fuel,BOA1,CA,CERTIFIED,93.91,84.67,98.99,97.15,Basic,
2025-10-20,2025-10-18,64-75206,VI,2025,"JL. RAYA HANDIL KEL. SUNGAI SELUANG, KEC.SAMBOJA, KAB. KUKAR, Kab. Kutai Kartanegara",KAB. KUTAI KERTANEGA,DODO,SBM Kaltimut II Fuel,BOA1,BOA2,NOT CERTIFIED,42.65,11.67,56.10,55.80,Basic,"Salam, APAR, Trims, Nol, Izin Prinsip, APAB, Masa Berlaku APAR"
2025-10-22,2025-10-18,14-211262,I,2025,"DESA BAHAPAL RAYA, KEC. RAYA",Kab Simalungun,DODO,SBM Medan III Fuel,BOA1,BOA2,NOT CERTIFIED,37.29,37.00,11.71,56.61,Basic,"CCTV, Izin Prinsip, Pelumas, APAB, APAR"
2025-10-20,2025-10-18,64-73809,VI,2025,"JL. PRAMUKA RT.16 KEL.LANJAS KEC.MUARA TEWEH , KAB. BARITO UTARA",KAB. BARITO UTARA,DODO,SBM Kalteng III Fuel,BOA1,BOA2,NOT CERTIFIED,67.55,46.67,88.13,67.38,Basic,"Pelumas, Izin Prinsip, Masa Berlaku APAR"
2025-10-31,2025-10-17,64-76124,VI,2025,JL.Mulawarman No.86 RT.05 Teritip,KAB. PENAJAM,DODO,SBM Kaltimut I Fuel,BOA1,CA,CERTIFIED,90.79,86.00,98.94,87.78,Basic,
2025-10-18,2025-10-17,64-751027,VI,2025,Jl. H.M Rifaddin Kel. Harapan Baru,KOTA SAMARINDA,DODO,SBM Kaltimut II Fuel,BOA1,BOA2,NOT CERTIFIED,52.71,35.33,70.48,52.42,Basic,"APAB, Pelumas, Salam, Masa Berlaku APAR, Izin Prinsip"
